question,category,chunk,article
Quels sont les avantages de l'utilisation de l'intelligence artificielle dans la production musicale,LA POST-PROD,4615db39-1,4615db39
Comment l'IA influence-t-elle le rôle des producteurs audio et des ingénieurs du son,LA POST-PROD,4615db39-1,4615db39
Quelles compétences sont nécessaires pour utiliser efficacement les outils d'assistance IA en audio,LA POST-PROD,4615db39-1,4615db39
Comment l'essor des home-studios a-t-il changé l'accès à la production audio,LA POST-PROD,4615db39-1,4615db39
Quels types de problèmes audio l'intelligence artificielle peut-elle aider à résoudre,LA POST-PROD,4615db39-1,4615db39
Quelles compétences sont nécessaires pour travailler efficacement avec des outils d'intelligence artificielle dans la production audio,LA POST-PROD,4615db39-2,4615db39
Comment l'intelligence artificielle peut-elle influencer l'avenir des métiers du studio de production,LA POST-PROD,4615db39-2,4615db39
Pourquoi est-il important de maintenir une communication précise avec un professionnel lors de l'utilisation de l'IA,LA POST-PROD,4615db39-2,4615db39
Quels sont les avantages de l'utilisation des plugins IA pour le nettoyage des pistes audio,LA POST-PROD,4615db39-2,4615db39
De quelle manière l'IA peut-elle aider à soulager la pression liée aux délais dans la production musicale,LA POST-PROD,4615db39-2,4615db39
Quels sont les avantages de l'utilisation de l'intelligence artificielle dans la production audio,LA POST-PROD,4615db39-3,4615db39
Comment l'intelligence artificielle change-t-elle le flux de travail audio sur le long terme,LA POST-PROD,4615db39-3,4615db39
Quelles sont les futures applications potentielles des outils d'intelligence artificielle dans la musique,LA POST-PROD,4615db39-3,4615db39
De quelle manière l'IA peut-elle collaborer avec les producteurs audio pour améliorer la créativité,LA POST-PROD,4615db39-3,4615db39
Quelles sont les implications de l'IA sur la distinction entre amateurs et professionnels dans le domaine audio,LA POST-PROD,4615db39-3,4615db39
Quelles sont les nouvelles compétences exigées pour les producteurs audio à l'ère de l'intelligence artificielle,LA POST-PROD,4615db39-4,4615db39
Comment l'intelligence artificielle pourrait-elle modifier le rôle traditionnel d'un ingénieur du son,LA POST-PROD,4615db39-4,4615db39
Quels types de musique peuvent être générés entièrement par des outils d'intelligence artificielle,LA POST-PROD,4615db39-4,4615db39
De quelle manière l'intelligence artificielle peut-elle faciliter la créativité d'un sound designer,LA POST-PROD,4615db39-4,4615db39
Est-ce que l'intelligence artificielle pourrait un jour remplacer la collaboration humaine en musique,LA POST-PROD,4615db39-4,4615db39
Quels sont les principaux besoins en matière de restauration audio dans différentes industries,LA POST-PROD,3632a3b4-1,3632a3b4
Comment l'intelligence artificielle contribue-t-elle à la réduction du bruit dans le son,LA POST-PROD,3632a3b4-1,3632a3b4
Quels types de logiciels sont utilisés pour le dé-mixage audio,LA POST-PROD,3632a3b4-1,3632a3b4
En quoi le développement numérique a-t-il influencé la production de médias et la restauration audio,LA POST-PROD,3632a3b4-1,3632a3b4
Quels sont les différents secteurs qui bénéficient des technologies de restauration audio,LA POST-PROD,3632a3b4-1,3632a3b4
Quels sont les problèmes communs rencontrés lors de l'enregistrement audio et comment peuvent-ils affecter la qualité finale,LA POST-PROD,3632a3b4-2,3632a3b4
Pourquoi est-il important de réaliser un bon enregistrement initial avant de passer à la post-production audio,LA POST-PROD,3632a3b4-2,3632a3b4
Quels types de logiciels peuvent être utilisés pour la restauration audio et quelles fonctionnalités offrent-ils,LA POST-PROD,3632a3b4-2,3632a3b4
Comment le deep learning et les plug-ins audio influencent-ils le processus de dé-mixage et de dé-bruitage,LA POST-PROD,3632a3b4-2,3632a3b4
Quelles sont les implications de l'utilisation de matériel de mauvaise qualité sur le résultat final d'un projet audio,LA POST-PROD,3632a3b4-2,3632a3b4
Quels sont les principes fondamentaux pour obtenir une bonne qualité audio avant la production,LA POST-PROD,3632a3b4-3,3632a3b4
Comment les avancées en intelligence artificielle influencent-elles la restauration audio,LA POST-PROD,3632a3b4-3,3632a3b4
Quels sont les outils et plug-ins audio populaires pour la réduction de bruit en post-production,LA POST-PROD,3632a3b4-3,3632a3b4
Quelle est l'importance de l'enregistrement dans la chaîne de production audio,LA POST-PROD,3632a3b4-3,3632a3b4
Comment iZotope RX se distingue-t-il dans le domaine de la restauration audio,LA POST-PROD,3632a3b4-3,3632a3b4
Quels sont les différents modules de réparation audio disponibles dans le logiciel mentionné dans le document,LA POST-PROD,3632a3b4-4,3632a3b4
Comment l'intelligence artificielle est-elle utilisée dans les outils de dé-mixage audio,LA POST-PROD,3632a3b4-4,3632a3b4
Quels problèmes audio peuvent être résolus grâce aux outils de restauration audio,LA POST-PROD,3632a3b4-4,3632a3b4
Comment iZotope RX facilite-t-il la suppression de bruit indésirable dans les enregistrements audio,LA POST-PROD,3632a3b4-4,3632a3b4
Quelles sont les approches innovantes pour traiter des problèmes d'enregistrement de musique en studio,LA POST-PROD,3632a3b4-4,3632a3b4
Quelle est l'application principale de l'intelligence artificielle dans le processus de restauration audio,LA POST-PROD,3632a3b4-5,3632a3b4
Comment le dé-mixage facilite-t-il l'isolement des éléments sonores dans un enregistrement,LA POST-PROD,3632a3b4-5,3632a3b4
Quels sont les avantages du deep learning dans les logiciels de production audio,LA POST-PROD,3632a3b4-5,3632a3b4
Quelles stratégies étaient utilisées avant l'essor de l'intelligence artificielle pour le traitement audio,LA POST-PROD,3632a3b4-5,3632a3b4
Comment l'intelligence artificielle affecte-t-elle les processus de remixage musical et de remastering,LA POST-PROD,3632a3b4-5,3632a3b4
Quels sont les bénéfices du deep learning dans la production audio,LA POST-PROD,3632a3b4-6,3632a3b4
Comment l'IA aide-t-elle à la restauration audio,LA POST-PROD,3632a3b4-6,3632a3b4
Quelles sont les applications du dé-mixage dans la musique,LA POST-PROD,3632a3b4-6,3632a3b4
Quels outils sont utilisés pour le de-noise et le de-reverb,LA POST-PROD,3632a3b4-6,3632a3b4
Quelle est la fonction de ISSE dans l'édition audio,LA POST-PROD,3632a3b4-6,3632a3b4
Quelles sont les fonctionnalités principales du logiciel ISSE dans le domaine de l'édition audio,LA POST-PROD,3632a3b4-7,3632a3b4
Comment fonctionne l'algorithme de séparation basé sur le machine learning dans le dé-mixage audio,LA POST-PROD,3632a3b4-7,3632a3b4
Quel est le rôle de Deezer dans le développement de la technologie de dé-mixage audio,LA POST-PROD,3632a3b4-7,3632a3b4
Quelles sont les différentes configurations de stems que Spleeter peut fournir lors de la séparation audio,LA POST-PROD,3632a3b4-7,3632a3b4
Quels sont quelques exemples de logiciels qui utilisent le code de Spleeter pour le dé-mixage audio,LA POST-PROD,3632a3b4-7,3632a3b4
Quels sont les logiciels qui utilisent le code Spleeter pour le dé-mixage audio,LA POST-PROD,3632a3b4-8,3632a3b4
Comment fonctionne la fonction Music Rebalance dans iZotope RX pour séparer les stems,LA POST-PROD,3632a3b4-8,3632a3b4
Quels sont les avantages de la restauration audio avec des plug-ins à intelligence artificielle,LA POST-PROD,3632a3b4-8,3632a3b4
En quoi le plug-in Drumatom d'Accusonus est-il considéré comme une référence pour l'ingénierie du son,LA POST-PROD,3632a3b4-8,3632a3b4
Quelles sont les caractéristiques du plug-in Regroover d'Accusonus pour la séparation des éléments audio,LA POST-PROD,3632a3b4-8,3632a3b4
Quels sont les principaux avantages des plugins dans la restauration audio,LA POST-PROD,3632a3b4-9,3632a3b4
Comment un plugin comme Regroover améliore-t-il le processus de sampling,LA POST-PROD,3632a3b4-9,3632a3b4
Quelle est l'importance du deep learning dans le développement de plugins audio,LA POST-PROD,3632a3b4-9,3632a3b4
Quelles fonctionnalités sont offertes par le bundle ERA d'Accusonus,LA POST-PROD,3632a3b4-9,3632a3b4
Comment les algorithmes de Zynaptiq diffèrent-ils des autres solutions de nettoyage audio,LA POST-PROD,3632a3b4-9,3632a3b4
Quelles sont les fonctions principales dUnchirp et comment peuvent-elles améliorer un enregistrement audio,LA POST-PROD,3632a3b4-10,3632a3b4
Comment Unfilter contribue-t-il à améliorer lintelligibilité dune voix dans une mauvaise acoustique,LA POST-PROD,3632a3b4-10,3632a3b4
Quelle est la fonctionnalité dUnveil concernant la réduction de la reverb tout en préservant le son direct,LA POST-PROD,3632a3b4-10,3632a3b4
Comment fonctionne Unmix Drums et quelle est son utilité dans un mix audio,LA POST-PROD,3632a3b4-10,3632a3b4
Quels outils de restauration audio sont mentionnés et quelles sont leurs caractéristiques distinctives,LA POST-PROD,3632a3b4-10,3632a3b4
Quels sont les avantages du dé-mixage dans la production audio,LA POST-PROD,3632a3b4-11,3632a3b4
Comment l'intelligence artificielle améliore-t-elle la restauration audio,LA POST-PROD,3632a3b4-11,3632a3b4
Quelles sont les applications d'Unmix Drums dans le traitement musical,LA POST-PROD,3632a3b4-11,3632a3b4
Quels types de plugins IA Accentize propose-t-il pour le traitement vocal,LA POST-PROD,3632a3b4-11,3632a3b4
Comment la société Audionamix utilise-t-elle ses algorithmes IA dans le cinéma,LA POST-PROD,3632a3b4-11,3632a3b4
Quelles sont les techniques de dé-mixage utilisées dans le studio de production audio,LA POST-PROD,3632a3b4-12,3632a3b4
Comment l'intelligence artificielle est-elle appliquée dans la restauration audio,LA POST-PROD,3632a3b4-12,3632a3b4
Quel est le rôle des plug-ins audio dans le processus de production sonore,LA POST-PROD,3632a3b4-12,3632a3b4
Quelles innovations Google a-t-il développées pour l'isolation des sons,LA POST-PROD,3632a3b4-12,3632a3b4
Comment les stems sont-ils optimisés pour les DJ et remixeurs,LA POST-PROD,3632a3b4-12,3632a3b4
Quelles sont les principales fonctionnalités des plug-ins audio intégrant lIA dans le mixage,LA POST-PROD,813dc16d-1,813dc16d
Comment lIA peut-elle aider à la résolution de tâches correctives lors du mixage audio,LA POST-PROD,813dc16d-1,813dc16d
Quelle est la différence entre un plug-in audio traditionnel et un plug-in audio intelligent,LA POST-PROD,813dc16d-1,813dc16d
Comment la technologie de deep learning est-elle utilisée dans les logiciels de mixage audio modernes,LA POST-PROD,813dc16d-1,813dc16d
Pourquoi iZotope est-il considéré comme un pionnier dans lutilisation de lIA pour le mixage audio,LA POST-PROD,813dc16d-1,813dc16d
Quelles sont les fonctionnalités principales d'un plug-in audio assisté par l'intelligence artificielle,LA POST-PROD,813dc16d-2,813dc16d
Comment l Assistant intelligent peut-il aider un ingénieur du son dans le mixage,LA POST-PROD,813dc16d-2,813dc16d
En quoi consiste le bouton Mix Assistant dans le logiciel Neutron,LA POST-PROD,813dc16d-2,813dc16d
Comment fonctionne la fonction Masking pour identifier les problèmes de fréquence dans le mixage,LA POST-PROD,813dc16d-2,813dc16d
Quels sont les avantages de l utilisation de l IA dans la post-production audio pour les utilisateurs novices,LA POST-PROD,813dc16d-2,813dc16d
Quel est le rôle du bouton Learn dans le plug-in Neutron pour le mixage audio,LA POST-PROD,813dc16d-3,813dc16d
Comment le deep learning améliore-t-il les algorithmes utilisés dans les outils de production audio,LA POST-PROD,813dc16d-3,813dc16d
Quelles sont les fonctionnalités offertes par le bouton Assistant dans les plugins iZotope,LA POST-PROD,813dc16d-3,813dc16d
En quoi le plug-in Ozone est-il considéré comme une référence dans le domaine du mastering audio,LA POST-PROD,813dc16d-3,813dc16d
Comment les outils d'IA peuvent-ils aider les utilisateurs moins expérimentés en son,LA POST-PROD,813dc16d-3,813dc16d
Quels sont les principaux avantages de l'utilisation de l'intelligence artificielle dans la production audio,LA POST-PROD,813dc16d-4,813dc16d
Comment un plug-in comme Ozone utilise-t-il l'IA pour le mastering,LA POST-PROD,813dc16d-4,813dc16d
Quels types de traitements l'IA peut-elle proposer après une analyse audio,LA POST-PROD,813dc16d-4,813dc16d
En quoi consiste la fonction du bouton 'Assistant' dans iZotope RX,LA POST-PROD,813dc16d-4,813dc16d
Comment le 'Vocal Assistant' de Nectar aide-t-il au traitement de la voix,LA POST-PROD,813dc16d-4,813dc16d
Quels sont les avantages d'utiliser des plug-ins audio avec intelligence artificielle dans la production musicale,LA POST-PROD,813dc16d-5,813dc16d
Comment le Vocal Assistant de Nectar améliore-t-il le processus de mixage audio,LA POST-PROD,813dc16d-5,813dc16d
Quelles options de réglages sont disponibles dans le Reverb Assistant de Neoverb,LA POST-PROD,813dc16d-5,813dc16d
En quoi consiste le fonctionnement d'un EQ intelligent comme Smart:EQ de Sonible,LA POST-PROD,813dc16d-5,813dc16d
Quels types de reverbs peut-on combiner avec le plug-in Neoverb,LA POST-PROD,813dc16d-5,813dc16d
Quelles sont les caractéristiques principales d'un plug-in audio intelligent,LA POST-PROD,813dc16d-6,813dc16d
Comment l'intelligence artificielle améliore-t-elle le mixage audio,LA POST-PROD,813dc16d-6,813dc16d
Quels types d'outils audio utilisent des principes d'intelligence artificielle,LA POST-PROD,813dc16d-6,813dc16d
Comment fonctionne le compresseur Smart:Comp dans le traitement audio,LA POST-PROD,813dc16d-6,813dc16d
Quelles sont les étapes pour ré-analyser un profil audio avec un plug-in IA,LA POST-PROD,813dc16d-6,813dc16d
Quels sont les avantages de l'utilisation de l'intelligence artificielle dans le mixage audio,LA POST-PROD,813dc16d-7,813dc16d
Comment fonctionne le mode 'spectral ducking' dans un compresseur,LA POST-PROD,813dc16d-7,813dc16d
Quelles sont les propriétés sonores que l'on peut ajuster avec Smart:Reverb,LA POST-PROD,813dc16d-7,813dc16d
Comment le Smart:EQ 3 organise-t-il les pistes dans un mixage,LA POST-PROD,813dc16d-7,813dc16d
Quel est le rôle des plug-ins comme VocAlign et Revoice Pro dans la correction de pitch et timing,LA POST-PROD,813dc16d-7,813dc16d
Quels sont les avantages de l'utilisation de l'intelligence artificielle dans le mixage audio,LA POST-PROD,813dc16d-8,813dc16d
Comment Revoice Pro facilite-t-il l'ajustement du timing et de la hauteur des pistes,LA POST-PROD,813dc16d-8,813dc16d
Quelles fonctionnalités uniques sont offertes par la technologie APT utilisée dans Revoice Pro,LA POST-PROD,813dc16d-8,813dc16d
En quoi Melodyne est-il efficace pour traiter les composantes tonales et non tonales du son vocal,LA POST-PROD,813dc16d-8,813dc16d
Comment les algorithmes de Melodyne aident-ils à visualiser et éditer les caractéristiques du son à un niveau détaillé,LA POST-PROD,813dc16d-8,813dc16d
Quelles sont les principales caractéristiques que l'on peut modifier à l'échelle de la note dans un logiciel de production musicale,LA POST-PROD,813dc16d-9,813dc16d
Comment Melodyne facilite-t-il le travail des auteurs-compositeurs et remixeurs en matière d'harmonisation audio,LA POST-PROD,813dc16d-9,813dc16d
Quels types de plug-ins sont proposés dans la suite Alex Audio Butler pour la post-production audiovisuelle,LA POST-PROD,813dc16d-9,813dc16d
Comment fonctionne le principe de l'auto-ducking dans le plug-in dédié aux voix dans Alex Audio Butler,LA POST-PROD,813dc16d-9,813dc16d
De quelle manière les différentes instances des plug-ins Alex Audio Butler interagissent-elles pour améliorer la qualité audio globale,LA POST-PROD,813dc16d-9,813dc16d
Quels sont les types de pistes que le plug-in Alex Audio Butler prend en charge dans le mixage audio,LA POST-PROD,813dc16d-10,813dc16d
Comment l'utilisation de l'assistance IA de l'Equalizer 4 de Tonebooster peut-elle améliorer le processus de mixage,LA POST-PROD,813dc16d-10,813dc16d
En quoi les fonctionnalités du Mastering Bundle Elevate de Eventide se distinguent-elles des autres outils de mastering,LA POST-PROD,813dc16d-10,813dc16d
Quelles sont les différentes options de réglage disponibles pour le traitement audio dans l'Equalizer 4,LA POST-PROD,813dc16d-10,813dc16d
Comment le deep learning est-il intégré dans les plug-ins audio d'Acustica Audio,LA POST-PROD,813dc16d-10,813dc16d
Quelles sont les ambitions du projet IRIS dAcustica Audio pour le futur des plug-ins audio,LA POST-PROD,813dc16d-11,813dc16d
Comment le deep learning est-il intégré dans le développement des plug-ins dAcustica Audio,LA POST-PROD,813dc16d-11,813dc16d
De quelle manière un ingénieur du son participe-t-il à la création du plug-in intelligent,LA POST-PROD,813dc16d-11,813dc16d
Quelles données sont enregistrées par le plug-in pour apprendre des choix de l'ingénieur du son,LA POST-PROD,813dc16d-11,813dc16d
Quelles pourraient être les implications de lutilisation du deep learning pour le mixage et le mastering audio,LA POST-PROD,813dc16d-11,813dc16d
Quels sont les bénéfices de l'intelligence artificielle dans le mixage et le mastering audio,LA POST-PROD,813dc16d-12,813dc16d
Comment le deep learning améliore-t-il les plug-ins audio existants,LA POST-PROD,813dc16d-12,813dc16d
Quelles questions l'assistant intelligent peut-il aider à résoudre lors du traitement audio,LA POST-PROD,813dc16d-12,813dc16d
Dans quels types de plug-ins l'IA a-t-elle été initialement utilisée,LA POST-PROD,813dc16d-12,813dc16d
Quel sera l'impact futur de l'IA sur les presets dans les logiciels audio,LA POST-PROD,813dc16d-12,813dc16d
Quels sont les avantages des plug-ins audio utilisant des algorithmes FFT par rapport aux modèles traditionnels,LA POST-PROD,2da6d6a5-1,2da6d6a5
Comment fonctionne l'analyse spectrale dans le traitement dynamique du son,LA POST-PROD,2da6d6a5-1,2da6d6a5
Quelles sont les différences entre les EQ intelligents et les compresseurs classiques,LA POST-PROD,2da6d6a5-1,2da6d6a5
En quoi le plug-in Gullfoss de Sound Theory se distingue-t-il des autres outils de traitement audio,LA POST-PROD,2da6d6a5-1,2da6d6a5
Pourquoi certains utilisateurs qualifient-ils ces nouveaux plug-ins de 'game-changer' dans le domaine de la production audio,LA POST-PROD,2da6d6a5-1,2da6d6a5
Quels sont les avantages de l'utilisation d'un algorithme de traitement spectral dynamique dans la post-production audio,LA POST-PROD,2da6d6a5-2,2da6d6a5
Comment un plug-in peut-il améliorer la clarté d'un signal sonore,LA POST-PROD,2da6d6a5-2,2da6d6a5
En quoi les plug-ins intelligents se distinguent-ils des égaliseurs conventionnels,LA POST-PROD,2da6d6a5-2,2da6d6a5
Quelles sont les caractéristiques principales des réglages sur le plug-in Gullfoss,LA POST-PROD,2da6d6a5-2,2da6d6a5
Pourquoi est-il important d'avoir une interface utilisateur intuitive pour les plug-ins audio,LA POST-PROD,2da6d6a5-2,2da6d6a5
Quels sont les bénéfices d'utiliser des algorithmes d'intelligence artificielle dans la production audio,LA POST-PROD,2da6d6a5-3,2da6d6a5
Comment le plugin Smooth Operator se compare-t-il au Soothe2 de Oeksound,LA POST-PROD,2da6d6a5-3,2da6d6a5
Quelles sont les différentes tâches que l'on peut effectuer avec un égaliseur,LA POST-PROD,2da6d6a5-3,2da6d6a5
Quels sont les problèmes courants que l'on peut résoudre avec un égaliseur standard,LA POST-PROD,2da6d6a5-3,2da6d6a5
Comment les plugins peuvent-ils aider à équilibrer le spectre fréquentiel,LA POST-PROD,2da6d6a5-3,2da6d6a5
Quelles sont les méthodes pour traiter les fréquences problématiques en production audio,LA POST-PROD,2da6d6a5-4,2da6d6a5
Comment un EQ Notch peut-il affecter le timbre général d'un son,LA POST-PROD,2da6d6a5-4,2da6d6a5
Quels effets peuvent provoquer les compresseurs multibandes lors du traitement audio,LA POST-PROD,2da6d6a5-4,2da6d6a5
En quoi consiste le plugin Soothe et comment se distingue-t-il des plugins traditionnels,LA POST-PROD,2da6d6a5-4,2da6d6a5
Comment les plugins modernes identifient-ils et traitent-ils les problèmes de fréquence en temps réel,LA POST-PROD,2da6d6a5-4,2da6d6a5
Quels sont les avantages des plug-ins audio nouvelle génération pour le traitement du son dans le studio de production audio,LA POST-PROD,2da6d6a5-5,2da6d6a5
Comment les algorithmes FFT influencent-ils le traitement des enregistrements audio selon le document,LA POST-PROD,2da6d6a5-5,2da6d6a5
Quelle est l'importance de l'équilibre spectral dans un enregistrement audio,LA POST-PROD,2da6d6a5-5,2da6d6a5
Comment les plug-ins peuvent-ils atténuer la froideur ou l'agressivité de l'audio digital,LA POST-PROD,2da6d6a5-5,2da6d6a5
De quelle manière Unfilter aide-t-il à traiter les anomalies de réponse en fréquence dans les enregistrements,LA POST-PROD,2da6d6a5-5,2da6d6a5
Quelles sont les caractéristiques principales d'un égaliseur spectral dynamique,LA POST-PROD,2da6d6a5-6,2da6d6a5
Comment l'intelligence artificielle améliore-t-elle les processus de mixage audio,LA POST-PROD,2da6d6a5-6,2da6d6a5
Quel est le rôle d'un plugin dans la gestion du masquage sonore,LA POST-PROD,2da6d6a5-6,2da6d6a5
Comment fonctionne le Trackspacer pour créer de l'espace dans un mixage,LA POST-PROD,2da6d6a5-6,2da6d6a5
Quelles différences existent entre MSpectralDynamics et d'autres plugins de traitement audio,LA POST-PROD,2da6d6a5-6,2da6d6a5
Quels sont les avantages du traitement en Side-Chain dans le mixage audio,LA POST-PROD,2da6d6a5-7,2da6d6a5
Comment un filtre harmonique unique peut-il améliorer le contrôle des fréquences d'un instrument,LA POST-PROD,2da6d6a5-7,2da6d6a5
Pourquoi est-il important de détecter automatiquement la fondamentale d'une note jouée lors du mixage,LA POST-PROD,2da6d6a5-7,2da6d6a5
En quoi les plug-ins présentés facilitent-ils le travail des utilisateurs en termes de traitement audio,LA POST-PROD,2da6d6a5-7,2da6d6a5
Quelle est la signification de la configuration 'set and forget' pour un plugin et comment cela impacte la créativité,LA POST-PROD,2da6d6a5-7,2da6d6a5
Quels sont les avantages de l'utilisation des algorithmes puissants dans les plug-ins audio modernes,LA POST-PROD,2da6d6a5-8,2da6d6a5
Comment les plug-ins audio s'adaptent-ils aux différents types de signaux musicaux,LA POST-PROD,2da6d6a5-8,2da6d6a5
Quelles sont les fonctionnalités de l'éditeur de courbe à forme libre de Unfilter,LA POST-PROD,2da6d6a5-8,2da6d6a5
En quoi Unfilter peut-il améliorer des enregistrements réalisés dans des conditions non optimales,LA POST-PROD,2da6d6a5-8,2da6d6a5
Les plug-ins audio modernes peuvent-ils remplacer les EQ traditionnels dans le processus de production sonore,LA POST-PROD,2da6d6a5-8,2da6d6a5
Quels sont les avantages d'utiliser des plug-ins audio modernes pour la production sonore,LA POST-PROD,2da6d6a5-9,2da6d6a5
Comment l'intelligence artificielle pourrait-elle transformer le processus de mixage audio,LA POST-PROD,2da6d6a5-9,2da6d6a5
Quelles sont les similitudes entre les égaliseurs dynamiques et les égaliseurs traditionnels,LA POST-PROD,2da6d6a5-9,2da6d6a5
Pourquoi est-il important de sculpter soi-même le son lors du mixage,LA POST-PROD,2da6d6a5-9,2da6d6a5
Quelles étapes sont essentielles pour assurer la cohérence d'un mixage audio,LA POST-PROD,2da6d6a5-9,2da6d6a5
Quels sont les principaux avantages de l'utilisation de l'intelligence artificielle dans le processus de mastering audio,LA POST-PROD,afc9b1b1-1,afc9b1b1
Comment les services en ligne de mastering audio se distinguent-ils des plugins traditionnels,LA POST-PROD,afc9b1b1-1,afc9b1b1
Pourquoi certains ingénieurs en mastering ont-ils initialement pris au sérieux l'impact de LANDR sur leur métier,LA POST-PROD,afc9b1b1-1,afc9b1b1
Quel était le volume de morceaux traités par LANDR selon son PDG en 2018,LA POST-PROD,afc9b1b1-1,afc9b1b1
Comment l'évolution des technologies de mastering a-t-elle influencé la perception des ingénieurs du son,LA POST-PROD,afc9b1b1-1,afc9b1b1
Quelles sont les perspectives d'évolution des compétences des ingénieurs de mastering avec l'arrivée de l'intelligence artificielle dans la production audio,LA POST-PROD,afc9b1b1-2,afc9b1b1
Comment l'intelligence artificielle contribue-t-elle à améliorer la productivité des artistes dans le domaine de la musique,LA POST-PROD,afc9b1b1-2,afc9b1b1
Quels rôles les algorithmes peuvent-ils jouer en complément du travail humain dans un studio de mastering,LA POST-PROD,afc9b1b1-2,afc9b1b1
Comment les services en ligne comme LANDR répondent-ils aux besoins des artistes dans le processus de production musicale,LA POST-PROD,afc9b1b1-2,afc9b1b1
Quelles sont les différences clés entre le mastering traditionnel et celui assisté par l'intelligence artificielle,LA POST-PROD,afc9b1b1-2,afc9b1b1
Quelles sont les raisons principales du succès de LANDR dans le domaine du mastering audio,LA POST-PROD,afc9b1b1-3,afc9b1b1
Comment l'intelligence artificielle contribue-t-elle à l'amélioration des services de mastering,LA POST-PROD,afc9b1b1-3,afc9b1b1
Pourquoi est-il important d'avoir un mixage irréprochable avant d'utiliser un algorithme d'IA pour le mastering,LA POST-PROD,afc9b1b1-3,afc9b1b1
Quels formats audio nécessitent un processus de mastering différent et pourquoi,LA POST-PROD,afc9b1b1-3,afc9b1b1
Comment l'algorithme d'IA de LANDR s'adapte-t-il aux besoins spécifiques de chaque chanson,LA POST-PROD,afc9b1b1-3,afc9b1b1
Quels sont les principaux outils utilisés par l'intelligence artificielle pour le mastering de musique,LA POST-PROD,afc9b1b1-4,afc9b1b1
Comment l'intelligence artificielle adapte-t-elle le traitement audio en fonction de la chanson,LA POST-PROD,afc9b1b1-4,afc9b1b1
Quelles sont les plateformes de mastering musical qui ont émergé à la suite de LANDR,LA POST-PROD,afc9b1b1-4,afc9b1b1
Quels types de services en ligne sont offerts par LANDR en plus du mastering audio,LA POST-PROD,afc9b1b1-4,afc9b1b1
