question,category,chunk,article
Quel est l'impact de l'intelligence artificielle dans la post-production audio?,LA POST-PROD,4615db39-1,4615db39
Comment l'IA influence-t-elle la production musicale actuelle?,LA POST-PROD,4615db39-1,4615db39
Quelles sont les tendances des outils audio utilisant l'IA sur le marché?,LA POST-PROD,4615db39-1,4615db39
En quoi l'IA permet-elle aux amateurs d'obtenir des résultats professionnels?,LA POST-PROD,4615db39-1,4615db39
Quels avantages l'IA offre-t-elle aux artistes et créateurs dans leur travail?,LA POST-PROD,4615db39-1,4615db39
Comment l'intelligence artificielle peut-elle aider un producteur audio en post-production ?,LA POST-PROD,4615db39-2,4615db39
Quels sont les avantages des outils d'assistance IA pour un débutant en musique ?,LA POST-PROD,4615db39-2,4615db39
Pourquoi est-il important d'avoir des compétences en audio et sound design même avec des outils d'assistance ?,LA POST-PROD,4615db39-2,4615db39
Quelles évolutions de l'IA peuvent offrir des opportunités pour les producteurs audio ?,LA POST-PROD,4615db39-2,4615db39
Comment l'industrie de la production audio évolue-t-elle et s'adapte-t-elle aux changements ?,LA POST-PROD,4615db39-2,4615db39
Comment l'intelligence artificielle peut-elle aider dans le processus de production audio ?,LA POST-PROD,4615db39-3,4615db39
Quelles sont les opportunites offertes par l'IA pour les producteurs audio ?,LA POST-PROD,4615db39-3,4615db39
Pourquoi est-il important de s'adapter aux changements technologiques dans le domaine de l'audio ?,LA POST-PROD,4615db39-3,4615db39
Comment la collaboration avec des artistes peut-elle évoluer grâce à l'IA ?,LA POST-PROD,4615db39-3,4615db39
Quels types d'outils utilisant l'IA sont attendus dans le futur de la production musicale ?,LA POST-PROD,4615db39-3,4615db39
Quels outils utilisant l intelligence artificielle sont actuellement disponibles sur le marché ?,LA POST-PROD,4615db39-4,4615db39
Comment la collaboration entre l IA et les producteurs audio pourrait-elle évoluer dans le futur ?,LA POST-PROD,4615db39-4,4615db39
Quelles sont les tendances de l utilisation de l intelligence artificielle dans la production musicale ?,LA POST-PROD,4615db39-4,4615db39
Quels exemples d applications futures de l IA peuvent être imaginés dans le domaine de la musique ?,LA POST-PROD,4615db39-4,4615db39
Comment les algorithmes d apprentissage automatique pourraient-ils personnaliser l expérience utilisateur dans la production audio ?,LA POST-PROD,4615db39-4,4615db39
Quels outils IA sont utilisés dans le traitement du langage naturel ?,LA POST-PROD,4615db39-5,4615db39
Comment l'IA va-t-elle influencer le rôle des producteurs audio ?,LA POST-PROD,4615db39-5,4615db39
Y a-t-il une différence entre amateurs et professionnels dans la production audio avec l'IA ?,LA POST-PROD,4615db39-5,4615db39
Comment l'IA affectera-t-elle les compétences requises en ingénierie du son ?,LA POST-PROD,4615db39-5,4615db39
L'IA peut-elle remplacer la créativité humaine dans la production musicale ?,LA POST-PROD,4615db39-5,4615db39
Quels sont les principaux besoins en restauration audio dans divers secteurs ?,LA POST-PROD,3632a3b4-1,3632a3b4
Comment l'intelligence artificielle a-t-elle influencé les logiciels de dé-mixage ?,LA POST-PROD,3632a3b4-1,3632a3b4
Quels types de logiciels sont efficaces pour réparer et nettoyer l'audio ?,LA POST-PROD,3632a3b4-1,3632a3b4
Pourquoi la restauration audio est-elle toujours nécessaire malgré les avancées numériques ?,LA POST-PROD,3632a3b4-1,3632a3b4
Quels secteurs utilisent des systèmes de restauration audio comme Cedar ?,LA POST-PROD,3632a3b4-1,3632a3b4
Quels sont les principaux problèmes rencontrés lors de la production audio?,LA POST-PROD,3632a3b4-2,3632a3b4
Comment les bruits ambiants peuvent-ils affecter la qualité d'un enregistrement?,LA POST-PROD,3632a3b4-2,3632a3b4
Pourquoi la restauration audio est-elle importante dans le processus de post-production?,LA POST-PROD,3632a3b4-2,3632a3b4
Quels outils sont souvent utilisés pour le dé-mixage et la restauration audio?,LA POST-PROD,3632a3b4-2,3632a3b4
Quel est le principe fondamental à comprendre dans le traitement audio en post-production?,LA POST-PROD,3632a3b4-2,3632a3b4
Quel est le lien entre la qualité d'enregistrement et les résultats de la post-production?,LA POST-PROD,3632a3b4-3,3632a3b4
Comment l'IA a-t-elle influencé la restauration audio ces dernières années?,LA POST-PROD,3632a3b4-3,3632a3b4
Quelles sont les limitations du traitement audio en post-production?,LA POST-PROD,3632a3b4-3,3632a3b4
Quels sont les progrès récents dans le domaine de la réduction de bruit?,LA POST-PROD,3632a3b4-3,3632a3b4
Pourquoi dit-on que la meilleure qualité audio s'obtient dès l'enregistrement?,LA POST-PROD,3632a3b4-3,3632a3b4
Quelles sont les avancées de l'intelligence artificielle dans la production audio?,LA POST-PROD,3632a3b4-4,3632a3b4
Quels sont les principaux plugins de restauration audio présents dans Adobe Audition?,LA POST-PROD,3632a3b4-4,3632a3b4
Comment iZotope RX a-t-il changé la restauration audio depuis son lancement?,LA POST-PROD,3632a3b4-4,3632a3b4
Quels types de problèmes audio iZotope RX peut-il résoudre efficacement?,LA POST-PROD,3632a3b4-4,3632a3b4
Quelles méthodes de nettoyage audio sont considérées comme innovantes dans le contexte de la post-production?,LA POST-PROD,3632a3b4-4,3632a3b4
Quels sont les outils innovants proposés par lIA pour la restauration audio ?,LA POST-PROD,3632a3b4-5,3632a3b4
Comment lIA aide-t-elle à résoudre les problèmes d'enregistrement en studio ?,LA POST-PROD,3632a3b4-5,3632a3b4
Quelles fonctions spécifiques lIA utilise-t-elle pour la détection des bruits lors de la post-production ?,LA POST-PROD,3632a3b4-5,3632a3b4
En quoi l'approche de lIA pour le dé-mixage audio est-elle différente des techniques traditionnelles ?,LA POST-PROD,3632a3b4-5,3632a3b4
Quels sont les avantages d'utiliser loutil Repair Assistant d'iZotope RX ?,LA POST-PROD,3632a3b4-5,3632a3b4
Quels sont les principaux défis de la restauration audio avec l'intelligence artificielle?,LA POST-PROD,3632a3b4-6,3632a3b4
Comment l'IA aide-t-elle à l'isolation de la voix dans un enregistrement?,LA POST-PROD,3632a3b4-6,3632a3b4
Quelles sont les applications potentielles du dé-mixage dans la production musicale?,LA POST-PROD,3632a3b4-6,3632a3b4
En quoi le deep learning améliore-t-il le processus de séparation des sources audio?,LA POST-PROD,3632a3b4-6,3632a3b4
Quelles techniques traditionnelles rendaient le dé-mixage difficile avant l'IA?,LA POST-PROD,3632a3b4-6,3632a3b4
Quels sont les plug-ins audio utilisés pour réduire le bruit dans la production audio?,LA POST-PROD,3632a3b4-7,3632a3b4
Comment fonctionne le dé-mixage dans le contexte de la musique?,LA POST-PROD,3632a3b4-7,3632a3b4
Quelles technologies sont utilisées pour la restauration audio?,LA POST-PROD,3632a3b4-7,3632a3b4
Quel est le rôle des stems dans un morceau de musique?,LA POST-PROD,3632a3b4-7,3632a3b4
Quels projets de recherche sont liés au dé-mixage musical?,LA POST-PROD,3632a3b4-7,3632a3b4
Quelles sont les institutions qui ont développé l'outil ISSE pour la séparation audio?,LA POST-PROD,3632a3b4-8,3632a3b4
Comment fonctionne l'algorithme de séparation basé sur le machine learning dans ISSE?,LA POST-PROD,3632a3b4-8,3632a3b4
Quel est le rôle de Deezer dans le développement de l'IA en dé-mixage audio?,LA POST-PROD,3632a3b4-8,3632a3b4
Quels types de stems Spleeter permet-il de séparer dans un enregistrement audio?,LA POST-PROD,3632a3b4-8,3632a3b4
Quand a été lancé l'outil d'édition audio ISSE et quel est son statut en terme de disponibilité?,LA POST-PROD,3632a3b4-8,3632a3b4
Quels sont les avantages du dé-mixage avec l'IA dans la production audio?,LA POST-PROD,3632a3b4-9,3632a3b4
Quelles sont les principales fonctions des logiciels utilisant le code Spleeter?,LA POST-PROD,3632a3b4-9,3632a3b4
Comment fonctionne la fonction Music Rebalance dans iZotope RX?,LA POST-PROD,3632a3b4-9,3632a3b4
Pourquoi est-il nécessaire d'installer des outils python pour utiliser Spleeter?,LA POST-PROD,3632a3b4-9,3632a3b4
Quelles marques proposent des plug-ins audio basés sur l'intelligence artificielle?,LA POST-PROD,3632a3b4-9,3632a3b4
Quels sont les avantages du dé-mixage dans la production audio?,LA POST-PROD,3632a3b4-10,3632a3b4
Quelles sont les fonctionnalités du plugin Drumatom d'Accusonus?,LA POST-PROD,3632a3b4-10,3632a3b4
Comment le plugin Regroover facilite-t-il la séparation des éléments d'une boucle audio?,LA POST-PROD,3632a3b4-10,3632a3b4
Pourquoi Accusonus est-il considéré comme un pionnier dans le domaine du machine learning en audio?,LA POST-PROD,3632a3b4-10,3632a3b4
En quoi consiste la restauration audio et quels outils peuvent être utilisés?,LA POST-PROD,3632a3b4-10,3632a3b4
Quels sont les avantages de Regroover dans le domaine du sampling ?,LA POST-PROD,3632a3b4-11,3632a3b4
Comment le bundle ERA d'Accusonus se distingue-t-il des autres logiciels de nettoyage sonore ?,LA POST-PROD,3632a3b4-11,3632a3b4
Quelles fonctionnalités offrent les plugins tels que Noise Remover et Voice Leveler ?,LA POST-PROD,3632a3b4-11,3632a3b4
Pourquoi les plugins de Zynaptiq sont-ils considérés comme intéressants pour le sound design ?,LA POST-PROD,3632a3b4-11,3632a3b4
En quoi le plugin Unchirp contribue-t-il à la restauration audio après un encodage à bas débit ?,LA POST-PROD,3632a3b4-11,3632a3b4
Quels sont les avantages de l'utilisation de l'intelligence artificielle dans la restauration audio?,LA POST-PROD,3632a3b4-12,3632a3b4
Comment Unfilter améliore-t-il l'intelligibilité d'une voix enregistrée?,LA POST-PROD,3632a3b4-12,3632a3b4
Quelles sont les capacités de Unveil en matière de dé-réverbération?,LA POST-PROD,3632a3b4-12,3632a3b4
Comment Unfilter peut-il être utilisé pour le sound design?,LA POST-PROD,3632a3b4-12,3632a3b4
Quels types de traitements Unveil peut-il effectuer sur un enregistrement audio?,LA POST-PROD,3632a3b4-12,3632a3b4
Quels sont les principaux avantages de l'IA dans la restauration audio?,LA POST-PROD,3632a3b4-13,3632a3b4
Comment Unmix Drums peut-il modifier la partie batterie d'une musique?,LA POST-PROD,3632a3b4-13,3632a3b4
Quelles ambiances l'IA peut-elle recréer en temps réel?,LA POST-PROD,3632a3b4-13,3632a3b4
Quels outils Accentize propose-t-elle pour améliorer les dialogues?,LA POST-PROD,3632a3b4-13,3632a3b4
Comment SpectralBalance aide-t-il à corriger les déséquilibres fréquentiels?,LA POST-PROD,3632a3b4-13,3632a3b4
Quelles sont les fonctionnalités principales des plugins IA proposés par Accentize ?,LA POST-PROD,3632a3b4-14,3632a3b4
Comment Audionamix a-t-elle d'abord gagné en notoriété dans le domaine de la post-production audio ?,LA POST-PROD,3632a3b4-14,3632a3b4
Quels sont les deux logiciels de service offerts par Audionamix ?,LA POST-PROD,3632a3b4-14,3632a3b4
En quoi consiste le principe de décomposition en stems selon Xtrax Stem d'Audionamix ?,LA POST-PROD,3632a3b4-14,3632a3b4
Quel est le but de Google Soundfilter dans le domaine de l'audio ?,LA POST-PROD,3632a3b4-14,3632a3b4
Comment fonctionne le dé-mixage dans la production audio ?,LA POST-PROD,3632a3b4-15,3632a3b4
Quels outils peuvent être utilisés pour la restauration audio ?,LA POST-PROD,3632a3b4-15,3632a3b4
Comment le deep learning influence-t-il la conception sonore ?,LA POST-PROD,3632a3b4-15,3632a3b4
Quel est le rôle des plug-ins audio dans le processus de post-production ?,LA POST-PROD,3632a3b4-15,3632a3b4
Quelles avancées Google a-t-il faites avec Soundfilter dans le domaine audio ?,LA POST-PROD,3632a3b4-15,3632a3b4
Quels sont les avantages de lIA dans un studio de post-production audio ?,LA POST-PROD,813dc16d-1,813dc16d
Comment les plug-ins audio modernes utilisent-ils le deep learning ?,LA POST-PROD,813dc16d-1,813dc16d
Quelles fonctions peut offrir un assistant virtuel dans le mixage ?,LA POST-PROD,813dc16d-1,813dc16d
Quels sont quelques exemples de plug-ins audio intégrant de lIA ?,LA POST-PROD,813dc16d-1,813dc16d
Quelle est la différence entre Neutron et d'autres outils de mixage audio ?,LA POST-PROD,813dc16d-1,813dc16d
Quels sont les avantages d'utiliser un plug-in audio assisté par intelligence artificielle ?,LA POST-PROD,813dc16d-2,813dc16d
Comment fonctionne le bouton Mix Assistant dans le logiciel Neutron ?,LA POST-PROD,813dc16d-2,813dc16d
Est-ce que l'intelligence artificielle peut remplacer un ingénieur du son humain ?,LA POST-PROD,813dc16d-2,813dc16d
Quelles sont les fonctionnalités de Neutron pour le mixage audio ?,LA POST-PROD,813dc16d-2,813dc16d
En quoi iZotope est-il considéré comme un pionnier de la technologie IA dans les plug-ins audio ?,LA POST-PROD,813dc16d-2,813dc16d
Quels sont les avantages d'utiliser un assistant intelligent en mixage ?,LA POST-PROD,813dc16d-3,813dc16d
Comment le bouton 'Masking' aide-t-il lors du mixage de pistes audio ?,LA POST-PROD,813dc16d-3,813dc16d
Quelle est la fonction du bouton 'Learn' dans l'EQ Neutron ?,LA POST-PROD,813dc16d-3,813dc16d
En quoi Neutron est-il considéré comme un plug-in innovant pour le mixage ?,LA POST-PROD,813dc16d-3,813dc16d
Comment l'apprentissage profond influence-t-il les algorithmes utilisés dans le mixage audio ?,LA POST-PROD,813dc16d-3,813dc16d
Quelles sont les innovations principales de lIA dans le mixage audio ?,LA POST-PROD,813dc16d-4,813dc16d
Comment le deep learning aide-t-il dans le processus de production audio ?,LA POST-PROD,813dc16d-4,813dc16d
Quels avantages offre un plug-in intelligent pour les utilisateurs débutants ?,LA POST-PROD,813dc16d-4,813dc16d
De quelle manière lIA pourrait-elle évoluer dans le domaine de la post-production audio ?,LA POST-PROD,813dc16d-4,813dc16d
Quels produits dIzotope intègrent des fonctionnalités dIA pour le mixage et le mastering ?,LA POST-PROD,813dc16d-4,813dc16d
Quels sont les avantages de l utilisation de l IA dans le mixage audio ?,LA POST-PROD,813dc16d-5,813dc16d
Comment fonctionne le Mix Assistant de Neutron ?,LA POST-PROD,813dc16d-5,813dc16d
Quelles sont les options de traitement offertes par Ozone lors du mastering ?,LA POST-PROD,813dc16d-5,813dc16d
Comment l IA analyse les morceaux pour proposer des traitements appropriés ?,LA POST-PROD,813dc16d-5,813dc16d
Quel est le rôle du Repair Assistant dans le logiciel iZotope RX ?,LA POST-PROD,813dc16d-5,813dc16d
Quels sont les outils que propose le logiciel RX pour réparer un fichier audio ?,LA POST-PROD,813dc16d-6,813dc16d
Comment le plug-in Nectar aide-t-il dans le traitement de la voix ?,LA POST-PROD,813dc16d-6,813dc16d
Quelles sont les fonctionnalités du 'Vocal Assistant' dans Nectar ?,LA POST-PROD,813dc16d-6,813dc16d
De quoi est capable le plug-in Neoverb en matière de reverb ?,LA POST-PROD,813dc16d-6,813dc16d
Comment l'intelligence artificielle est-elle utilisée dans les plug-ins de iZotope ?,LA POST-PROD,813dc16d-6,813dc16d
Quels sont les avantages de l'utilisation de l'intelligence artificielle dans le mixage audio ?,LA POST-PROD,813dc16d-7,813dc16d
Comment fonctionne le Reverb Assistant de Neoverb ?,LA POST-PROD,813dc16d-7,813dc16d
Quelle est la particularité des plug-ins de mixage de Sonible par rapport aux autres ?,LA POST-PROD,813dc16d-7,813dc16d
Quelles couleurs sonores peut-on choisir avec Neoverb ?,LA POST-PROD,813dc16d-7,813dc16d
Comment les plug-ins de Sonible utilisent-ils l'assistance IA dans leur fonctionnement ?,LA POST-PROD,813dc16d-7,813dc16d
Comment l'intelligence artificielle est-elle utilisée dans le mixage audio ?,LA POST-PROD,813dc16d-8,813dc16d
Quels sont les avantages des plug-ins audio intelligents ?,LA POST-PROD,813dc16d-8,813dc16d
Comment le Smart:EQ traite-t-il les résonances indésirables ?,LA POST-PROD,813dc16d-8,813dc16d
Quelles sont les caractéristiques que l'algorithme du Smart:Comp analyse ?,LA POST-PROD,813dc16d-8,813dc16d
Peut-on ajuster manuellement les paramètres d'un plug-in intelligent ?,LA POST-PROD,813dc16d-8,813dc16d
Comment l'intelligence artificielle peut-elle améliorer le mixage dans un studio de production audio ?,LA POST-PROD,813dc16d-9,813dc16d
Quelles sont les caractéristiques de la Smart:Reverb proposée par Sonible ?,LA POST-PROD,813dc16d-9,813dc16d
Comment fonctionne le mode 'spectral ducking' dans un compresseur intelligent ?,LA POST-PROD,813dc16d-9,813dc16d
Quels sont les avantages du Smart:EQ 3 par rapport aux égaliseurs traditionnels ?,LA POST-PROD,813dc16d-9,813dc16d
Comment peut-on organiser les pistes dans une hiérarchie avec la vue de groupe de Smart:EQ 3 ?,LA POST-PROD,813dc16d-9,813dc16d
Comment l'intelligence artificielle améliore-t-elle le mixage audio?,LA POST-PROD,813dc16d-10,813dc16d
Quel est le rôle de Revoice Pro dans la post-production audio?,LA POST-PROD,813dc16d-10,813dc16d
Comment le plug-in VocAlign facilite-t-il l'alignement des pistes vocales?,LA POST-PROD,813dc16d-10,813dc16d
Quelles sont les principales fonctionnalités de l'application Revoice Pro?,LA POST-PROD,813dc16d-10,813dc16d
Comment fonctionne la technologie APT dans le logiciel Revoice Pro?,LA POST-PROD,813dc16d-10,813dc16d
Quels sont les avantages de l'utilisation de l'intelligence artificielle dans la production audio ?,LA POST-PROD,813dc16d-11,813dc16d
Comment fonctionne l'algorithme de Melodyne pour le traitement vocal ?,LA POST-PROD,813dc16d-11,813dc16d
Quelles sont les caractéristiques que l'on peut éditer note par note avec Melodyne ?,LA POST-PROD,813dc16d-11,813dc16d
Pourquoi Melodyne est-il considéré comme un outil performant pour la séparation des sources audio ?,LA POST-PROD,813dc16d-11,813dc16d
En quoi l'outil de reconnaissance automatique de tonalité aide-t-il les auteurs-compositeurs et les remixeurs ?,LA POST-PROD,813dc16d-11,813dc16d
Quelles sont les fonctions principales des plug-ins Alex Audio Butler dans la post-production audio ?,LA POST-PROD,813dc16d-12,813dc16d
Comment l'intelligence artificielle améliore-t-elle le mixage audio dans les projets vidéo ?,LA POST-PROD,813dc16d-12,813dc16d
Quels avantages les auteurs-compositeurs et remixeurs peuvent-ils tirer de l'utilisation de la technologie IA ?,LA POST-PROD,813dc16d-12,813dc16d
Comment la suite de plug-ins Alex Audio Butler s'adapte-t-elle aux différents types de pistes audio ?,LA POST-PROD,813dc16d-12,813dc16d
Pourquoi est-il important d'utiliser des plug-ins intelligents comme Alex Audio Butler pour le son à l'image ?,LA POST-PROD,813dc16d-12,813dc16d
Quels sont les avantages de l'auto-ducking dans la post-production audio ?,LA POST-PROD,813dc16d-13,813dc16d
Comment l'IA aide-t-elle à ajuster le volume des effets sonores ?,LA POST-PROD,813dc16d-13,813dc16d
Quels sont les principaux usages du plug-in Equalizer 4 de Tonebooster ?,LA POST-PROD,813dc16d-13,813dc16d
Comment le système de loudness est-il géré pour différents types de musique ?,LA POST-PROD,813dc16d-13,813dc16d
Quelles alternatives au produit Ozone de iZotope propose Eventide dans le Mastering ?,LA POST-PROD,813dc16d-13,813dc16d
Quels sont les avantages des plug-ins audio intelligents dans le mixage?,LA POST-PROD,813dc16d-14,813dc16d
Comment fonctionne le deep learning dans les plug-ins audio?,LA POST-PROD,813dc16d-14,813dc16d
Quelles sont les caractéristiques du limiteur multi-bandes mentionné dans le document?,LA POST-PROD,813dc16d-14,813dc16d
Comment Acustica Audio intègre-t-il l'intelligence artificielle dans ses plug-ins?,LA POST-PROD,813dc16d-14,813dc16d
Quelle est la différence entre un mixage automatique et un approche créative dans le deep learning?,LA POST-PROD,813dc16d-14,813dc16d
Comment l'intelligence artificielle peut-elle améliorer le mixage audio ?,LA POST-PROD,813dc16d-15,813dc16d
Quels sont les avantages des plug-ins audio intelligents dans la production sonore ?,LA POST-PROD,813dc16d-15,813dc16d
Comment l'apprentissage profond change-t-il l'utilisation des plug-ins en studio ?,LA POST-PROD,813dc16d-15,813dc16d
De quelle manière peut-on enseigner des techniques à un plug-in audio ?,LA POST-PROD,813dc16d-15,813dc16d
Comment l'IA influence-t-elle le processus de post-production des pistes audio ?,LA POST-PROD,813dc16d-15,813dc16d
Comment lIA sintegre-t-elle dans les plug-ins audio ?,LA POST-PROD,813dc16d-16,813dc16d
Quels sont les premiers plug-ins audio qui ont beneficie de lIA ?,LA POST-PROD,813dc16d-16,813dc16d
Quel est le role de lIA dans le mixage ?,LA POST-PROD,813dc16d-16,813dc16d
Comment lIA influence-t-elle le choix de la compression ?,LA POST-PROD,813dc16d-16,813dc16d
Quelles autres applications de lIA seront abordees dans le prochain article ?,LA POST-PROD,813dc16d-16,813dc16d
Quels sont les nouveaux plug-ins audio qui utilisent l'intelligence artificielle?,LA POST-PROD,2da6d6a5-1,2da6d6a5
Comment l'IA influence-t-elle les EQ et compresseurs dans la production audio?,LA POST-PROD,2da6d6a5-1,2da6d6a5
Quelles sont les différences entre les plug-ins audio nouvelle génération et les EQ traditionnels?,LA POST-PROD,2da6d6a5-1,2da6d6a5
Quel est le rôle de l'algorithme FFT dans le traitement du son?,LA POST-PROD,2da6d6a5-1,2da6d6a5
Pourquoi certains utilisateurs qualifient-ils ces plug-ins de 'game-changer'?,LA POST-PROD,2da6d6a5-1,2da6d6a5
Quel est l'objectif de l'algorithme FFT dans le traitement audio ?,LA POST-PROD,2da6d6a5-2,2da6d6a5
Comment le plug-in Gullfoss améliore-t-il la perception sonore ?,LA POST-PROD,2da6d6a5-2,2da6d6a5
Quelles sont les innovations proposées par Noveltech Audio en son filtrage ?,LA POST-PROD,2da6d6a5-2,2da6d6a5
De quelle manière l'analyse spectrale se distingue-t-elle du façonnement traditionnel du son ?,LA POST-PROD,2da6d6a5-2,2da6d6a5
Pourquoi le plugin Gullfoss est-il nommé d'après une chute d'eau en Islande ?,LA POST-PROD,2da6d6a5-2,2da6d6a5
Quels sont les principaux avantages des nouveaux plug-ins audio par rapport aux EQ traditionnels ?,LA POST-PROD,2da6d6a5-3,2da6d6a5
Comment les réglages des plug-ins comme Gullfoss se distinguent-ils des compresseurs classiques ?,LA POST-PROD,2da6d6a5-3,2da6d6a5
Quelle est l'importance de l'interface utilisateur dans les plug-ins audio modernes ?,LA POST-PROD,2da6d6a5-3,2da6d6a5
Quels sont les fonctionnalités principales des réglages de Gullfoss ?,LA POST-PROD,2da6d6a5-3,2da6d6a5
Comment l'intelligence artificielle influence-t-elle le traitement audio dans les studios de production ?,LA POST-PROD,2da6d6a5-3,2da6d6a5
Quels sont les avantages des algorithmes innovants dans le traitement audio ?,LA POST-PROD,2da6d6a5-4,2da6d6a5
Comment l'intelligence artificielle peut-elle faciliter le travail en studio de production audio ?,LA POST-PROD,2da6d6a5-4,2da6d6a5
Quelles sont les différentes tâches que l'on peut effectuer avec un égaliseur audio ?,LA POST-PROD,2da6d6a5-4,2da6d6a5
Comment un plugin peut-il aider à améliorer le son lors de la post-production ?,LA POST-PROD,2da6d6a5-4,2da6d6a5
Quels types de contenu indésirable peut-on nettoyer avec un égaliseur standard ?,LA POST-PROD,2da6d6a5-4,2da6d6a5
Quels outils peuvent causer des problèmes de timbre lors de la production audio?,LA POST-PROD,2da6d6a5-5,2da6d6a5
Quelles sont les fonctions principales d'un plugin comme Soothe2?,LA POST-PROD,2da6d6a5-5,2da6d6a5
Comment un EQ Notch affecte-t-il le timbre de la voix?,LA POST-PROD,2da6d6a5-5,2da6d6a5
Quels sont les inconvénients d'utiliser des compresseurs multibandes en post-production?,LA POST-PROD,2da6d6a5-5,2da6d6a5
Quelle est la caractéristique unique des plugins développés par Oeksound?,LA POST-PROD,2da6d6a5-5,2da6d6a5
Quels sont les avantages des plugins de traitement audio comme OD DeEdger ?,LA POST-PROD,2da6d6a5-6,2da6d6a5
Comment les plugins gèrent-ils la réduction de la harshness dans le signal audio ?,LA POST-PROD,2da6d6a5-6,2da6d6a5
Pourquoi la maîtrise de la harshness digitale est-elle importante dans la production audio ?,LA POST-PROD,2da6d6a5-6,2da6d6a5
En quoi les algorithmes tels que FFT contribuent-ils à l'optimisation du son ?,LA POST-PROD,2da6d6a5-6,2da6d6a5
Comment l'utilisation d'EQ peut-elle aider à équilibrer le spectre fréquentiel ?,LA POST-PROD,2da6d6a5-6,2da6d6a5
Quels sont les impacts de l'utilisation de l'EQ dans le processus de post-production audio ?,LA POST-PROD,2da6d6a5-7,2da6d6a5
Comment un plug-in audio peut-il aider à équilibrer le spectre fréquentiel ?,LA POST-PROD,2da6d6a5-7,2da6d6a5
Quelles sont les fonctions principales d'Unfilter dans les enregistrements de dialogue ?,LA POST-PROD,2da6d6a5-7,2da6d6a5
Comment les plug-ins nouvelle génération améliorent-ils les enregistrements de guitare ou de piano ?,LA POST-PROD,2da6d6a5-7,2da6d6a5
De quelle manière la dernière version du DSEQ 3 facilite-t-elle l'analyse des fréquences ?,LA POST-PROD,2da6d6a5-7,2da6d6a5
Quelles sont les principales caractéristiques du plugin DSEQ de TBProAudio ?,LA POST-PROD,2da6d6a5-8,2da6d6a5
Comment l'intelligence artificielle est-elle utilisée dans le plugin DSEQ ?,LA POST-PROD,2da6d6a5-8,2da6d6a5
Quelles techniques sont couramment utilisées pour remédier au masquage dans un mixage audio ?,LA POST-PROD,2da6d6a5-8,2da6d6a5
Qu'est-ce que le Trackspacer de Wavesfactory et comment fonctionne-t-il ?,LA POST-PROD,2da6d6a5-8,2da6d6a5
Comment le Trackspacer crée-t-il de l'espace dans un mixage audio ?,LA POST-PROD,2da6d6a5-8,2da6d6a5
Quels sont les avantages de l'utilisation des plug-ins audio pour le mixage?,LA POST-PROD,2da6d6a5-9,2da6d6a5
Comment le SurferEQ de Sound Radix améliore-t-il le traitement des fréquences?,LA POST-PROD,2da6d6a5-9,2da6d6a5
Quelles fonctionnalités offre MSpectralDynamics de Melda productions?,LA POST-PROD,2da6d6a5-9,2da6d6a5
En quoi le traitement en Side-Chain est-il bénéfique pour le mixage audio?,LA POST-PROD,2da6d6a5-9,2da6d6a5
Pourquoi est-il important d'utiliser l'intelligence artificielle dans le studio de production audio?,LA POST-PROD,2da6d6a5-9,2da6d6a5
Quels sont les avantages des plug-ins audio utilisant une technologie IA ?,LA POST-PROD,2da6d6a5-10,2da6d6a5
