question,category,chunk,article
Quels étaient les producteurs influents dans les années 80 et 90 en matière de breakbeat ?,LE SOUND DESIGN,8f4deb1c-8,8f4deb1c
Quels breaks sont devenus cultes en dehors du Amen Break ?,LE SOUND DESIGN,8f4deb1c-8,8f4deb1c
Comment le morceau Apache a-t-il influencé le hip-hop ?,LE SOUND DESIGN,8f4deb1c-8,8f4deb1c
Pourquoi le son du kit de batterie Funky Drummer est-il si populaire ?,LE SOUND DESIGN,8f4deb1c-8,8f4deb1c
Quelles sont les références de morceaux utilisant des breaks célèbres ?,LE SOUND DESIGN,8f4deb1c-8,8f4deb1c
Pourquoi le Amen Break est-il devenu si populaire dans le monde de la musique?,LE SOUND DESIGN,8f4deb1c-9,8f4deb1c
Quelles sont les caractéristiques qui rendent le Amen Break si intéressant pour le sampling?,LE SOUND DESIGN,8f4deb1c-9,8f4deb1c
Combien de temps dure le Amen Break et pourquoi est-ce un avantage?,LE SOUND DESIGN,8f4deb1c-9,8f4deb1c
En quoi la diversité des coups de batterie du Amen Break contribue-t-elle à son utilisation par les artistes?,LE SOUND DESIGN,8f4deb1c-9,8f4deb1c
Qui est le batteur qui a joué le Amen Break et quel est son style?,LE SOUND DESIGN,8f4deb1c-9,8f4deb1c
Quelles sont les différences entre un rythme standard et celui du Amen Break?,LE SOUND DESIGN,8f4deb1c-10,8f4deb1c
Comment les coups de la caisse claire contribuent-ils à la tension rythmique dans le Breakbeat?,LE SOUND DESIGN,8f4deb1c-10,8f4deb1c
Quels types de transformations peut-on appliquer au Amen Break?,LE SOUND DESIGN,8f4deb1c-10,8f4deb1c
Comment peut-on réorganiser les coups individuels du Amen Break pour créer de nouveaux motifs?,LE SOUND DESIGN,8f4deb1c-10,8f4deb1c
Peux-tu expliquer l'importance du décalage de la caisse claire dans le rythme du Amen Break?,LE SOUND DESIGN,8f4deb1c-10,8f4deb1c
Quelles sonorites sont recommandees pour obtenir l'effet Braam dans le sound design ?,LE SOUND DESIGN,80af6c63-1,80af6c63
Comment peut-on editer les couches sonores pour le son Braam ?,LE SOUND DESIGN,80af6c63-1,80af6c63
Quels traitements sont utilises pour le son Braam au niveau de la distorsion et de la reverb ?,LE SOUND DESIGN,80af6c63-1,80af6c63
Quelles techniques de time-stretching et de changement de pitch peuvent aider dans le sound design ?,LE SOUND DESIGN,80af6c63-1,80af6c63
Comment le son Braam est-il utilise dans les bandes-annonces de films d'action ?,LE SOUND DESIGN,80af6c63-1,80af6c63
Quel est le son utilisé pour créer l'effet Braam dans le design sonore ?,LE SOUND DESIGN,80af6c63-2,80af6c63
Pourquoi l'effet Braam est-il tant utilisé dans les trailers de films ?,LE SOUND DESIGN,80af6c63-2,80af6c63
D'où provient l'origine officielle du son Braam ?,LE SOUND DESIGN,80af6c63-2,80af6c63
Quel impact le son Braam a-t-il sur le ressenti du public ?,LE SOUND DESIGN,80af6c63-2,80af6c63
Comment Hans Zimmer se sent-il par rapport à l'utilisation du son Braam dans l'industrie ?,LE SOUND DESIGN,80af6c63-2,80af6c63
Qu est ce que le son Braam et comment contribue t il a l impact d un film?,LE SOUND DESIGN,80af6c63-3,80af6c63
Quelles sont les techniques de sound design utilisees pour recreer le son Braam?,LE SOUND DESIGN,80af6c63-3,80af6c63
Comment le son Braam peut il influencer l ambiance d un teaser ou d une bande annonce?,LE SOUND DESIGN,80af6c63-3,80af6c63
Pourquoi le son Braam est il efficace dans les genres de science fiction et d horreur?,LE SOUND DESIGN,80af6c63-3,80af6c63
Quels sont les elements clés pour obtenir un son puissant et inquietant comme le Braam?,LE SOUND DESIGN,80af6c63-3,80af6c63
Quels sont les éléments clés pour créer un son Braam efficace ?,LE SOUND DESIGN,80af6c63-4,80af6c63
Comment choisir les sons de cuivres pour un projet audio ?,LE SOUND DESIGN,80af6c63-4,80af6c63
Quelle technique peut-on utiliser pour enregistrer des sons d'environnement ?,LE SOUND DESIGN,80af6c63-4,80af6c63
Comment se manifeste le son de 'horn' en français dans le contexte audio ?,LE SOUND DESIGN,80af6c63-4,80af6c63
Quels outils ou ressources peuvent aider dans la création de sons sur Ableton ?,LE SOUND DESIGN,80af6c63-4,80af6c63
Quels sont les avantages du layering dans le sound design ?,LE SOUND DESIGN,80af6c63-5,80af6c63
Comment puis-je élargir le son dans l'espace ?,LE SOUND DESIGN,80af6c63-5,80af6c63
Quels instruments de cuivre recommandez-vous pour enrichir le son ?,LE SOUND DESIGN,80af6c63-5,80af6c63
Quelle note devrais-je utiliser pour le son Brass dans Ableton ?,LE SOUND DESIGN,80af6c63-5,80af6c63
Comment utiliser un Rack d'instrument pour superposer des sons dans Ableton ?,LE SOUND DESIGN,80af6c63-5,80af6c63
Comment créer un effet stéréo élargi dans mes productions audio ?,LE SOUND DESIGN,80af6c63-6,80af6c63
Quelle technique puis-je utiliser pour obtenir un son plus puissant et agressif ?,LE SOUND DESIGN,80af6c63-6,80af6c63
Comment utiliser le panning pour répartir mes instruments dans l'espace sonore ?,LE SOUND DESIGN,80af6c63-6,80af6c63
Quelles notes MIDI devrais-je ajouter pour bien répartir le son sur toute sa tessiture ?,LE SOUND DESIGN,80af6c63-6,80af6c63
Pourquoi est-il important d'utiliser la distorsion dans le sound design ?,LE SOUND DESIGN,80af6c63-6,80af6c63
Quelles sont les étapes pour créer l'effet Braam dans une production sonore?,LE SOUND DESIGN,80af6c63-7,80af6c63
Comment la reverb influence-t-elle l'impact d'un son cinématique?,LE SOUND DESIGN,80af6c63-7,80af6c63
Pourquoi est-il important de traiter l'EQ et la compression après la distorsion?,LE SOUND DESIGN,80af6c63-7,80af6c63
Comment peut-on utiliser le pitch-bend pour ajouter du mouvement à un son?,LE SOUND DESIGN,80af6c63-7,80af6c63
Quels types de sons sont considérés comme des classiques dans la production cinématique?,LE SOUND DESIGN,80af6c63-7,80af6c63
Comment remplir l'espace fréquentiel des basses fréquences pour un son impressionnant?,LE SOUND DESIGN,80af6c63-8,80af6c63
Quel effet est communément appelé l'effet Glue dans le processus de son?,LE SOUND DESIGN,80af6c63-8,80af6c63
Quels sont les avantages de faire un bounce audio dans un projet?,LE SOUND DESIGN,80af6c63-8,80af6c63
Comment un traitement léger de compression influence-t-il le son final?,LE SOUND DESIGN,80af6c63-8,80af6c63
Pourquoi est-il important d'utiliser des subwoofers pour obtenir le meilleur impact sonore?,LE SOUND DESIGN,80af6c63-8,80af6c63
Quelles sont les techniques pour recréer un son épique en sound design ?,LE SOUND DESIGN,80af6c63-9,80af6c63
Comment le son Braam est-il structuré en termes de tonalité ?,LE SOUND DESIGN,80af6c63-9,80af6c63
Quels éléments de timbre caractérisent la première partie du son Braam ?,LE SOUND DESIGN,80af6c63-9,80af6c63
Quel type de son est utilisé comme base pour la création de sons cinématiques ?,LE SOUND DESIGN,80af6c63-9,80af6c63
Quelle est l'importance de l'analyse d'un son original avant de le reproduire ?,LE SOUND DESIGN,80af6c63-9,80af6c63
Quelles sont les sources idéales pour créer des effets sonores puissants en sound design?,LE SOUND DESIGN,80af6c63-10,80af6c63
Pourquoi est-il recommandé d'utiliser des sons réels plutôt que de tout synthétiser?,LE SOUND DESIGN,80af6c63-10,80af6c63
Comment le son Braam a-t-il été obtenu et quels éléments ont été utilisés?,LE SOUND DESIGN,80af6c63-10,80af6c63
Quel type d'instrument a été enregistré pour contribuer au son final du Braam?,LE SOUND DESIGN,80af6c63-10,80af6c63
Quels sont les différents sons sources mentionnés pour le sound design du Braam?,LE SOUND DESIGN,80af6c63-10,80af6c63
Quels sont les sons sources que je peux utiliser pour créer un effet épique ?,LE SOUND DESIGN,80af6c63-11,80af6c63
Comment appliquer la technique du time-stretch dans Ableton ?,LE SOUND DESIGN,80af6c63-11,80af6c63
Quelle est l'importance du réglage du pitch dans le sound design ?,LE SOUND DESIGN,80af6c63-11,80af6c63
Quels traitements EQ dois-je effectuer pour améliorer un son ?,LE SOUND DESIGN,80af6c63-11,80af6c63
Comment superposer différents échantillons pour créer un son final puissant ?,LE SOUND DESIGN,80af6c63-11,80af6c63
Comment le son Braam peut-il apporter impact et puissance dans une production audio ?,LE SOUND DESIGN,80af6c63-12,80af6c63
Quels traitements sont appliqués pour obtenir le son final après superposition des échantillons ?,LE SOUND DESIGN,80af6c63-12,80af6c63
Pourquoi est-il important de bien choisir l'algorithme de time-stretch ?,LE SOUND DESIGN,80af6c63-12,80af6c63
Quel échantillon est utilisé pour ajouter un léger impact au son dans le processus de sound design ?,LE SOUND DESIGN,80af6c63-12,80af6c63
Comment la fréquence sub est-elle générée dans la création du son Braam ?,LE SOUND DESIGN,80af6c63-12,80af6c63
Quels traitements sont nécessaires pour obtenir le son final d'un projet audio ?,LE SOUND DESIGN,80af6c63-13,80af6c63
Comment le son Braam est-il créé et traité dans la production sonore ?,LE SOUND DESIGN,80af6c63-13,80af6c63
Quelle est l'importance de la reverb dans le sound design selon cet exemple ?,LE SOUND DESIGN,80af6c63-13,80af6c63
Comment gérer les basses fréquences lors de la production sonore ?,LE SOUND DESIGN,80af6c63-13,80af6c63
Quelles sont les étapes clés pour éditer le sample de sirène dans le projet ?,LE SOUND DESIGN,80af6c63-13,80af6c63
Quels traitements appliquent-on pour obtenir un son granuleux et sale dans le sound design ?,LE SOUND DESIGN,80af6c63-14,80af6c63
Comment superposer efficacement des sons pour créer une version finale cohérente ?,LE SOUND DESIGN,80af6c63-14,80af6c63
Quelles étapes suivent pour assembler et comparer les sons dans un projet audio ?,LE SOUND DESIGN,80af6c63-14,80af6c63
Quel effet est utilisé dans Ableton pour donner un aspect particulier à un son ?,LE SOUND DESIGN,80af6c63-14,80af6c63
Comment finaliser le rendu audio pour le comparer avec l'original ?,LE SOUND DESIGN,80af6c63-14,80af6c63
Quelles sont les trois utilisations créatives du delay discutées dans le podcast Arsonor ?,LE SOUND DESIGN,56324d1b-1,56324d1b
Quel est le premier effet de delay mentionné dans l'épisode ?,LE SOUND DESIGN,56324d1b-1,56324d1b
Comment le delay a-t-il influencé des courants musicaux au fil du temps ?,LE SOUND DESIGN,56324d1b-1,56324d1b
Pourquoi le delay est-il considéré comme un outil puissant pour les musiciens et producteurs audio ?,LE SOUND DESIGN,56324d1b-1,56324d1b
Quelle est la différence entre delay et écho selon le contenu de l'épisode ?,LE SOUND DESIGN,56324d1b-1,56324d1b
Quels sont les origines des premiers effets de delay dans la musique ?,LE SOUND DESIGN,56324d1b-2,56324d1b
Comment un effet de delay peut-il améliorer une prise de son sans ambiance ?,LE SOUND DESIGN,56324d1b-2,56324d1b
Pourquoi le delay est-il considéré comme un effet de base dans le sound design ?,LE SOUND DESIGN,56324d1b-2,56324d1b
Quelles sont les précautions à prendre pour éviter d'abuser de l'effet de delay dans un mixage ?,LE SOUND DESIGN,56324d1b-2,56324d1b
Qu'est-ce que l'écho de slapback et dans quel contexte musical a-t-il été popularisé ?,LE SOUND DESIGN,56324d1b-2,56324d1b
Quelles sont les origines de l’effet de slapback echo dans le rockabilly?,LE SOUND DESIGN,56324d1b-3,56324d1b
Comment les premiers artistes de rockabilly ont-ils utilisé le slapback echo?,LE SOUND DESIGN,56324d1b-3,56324d1b
Quels réglages sont recommandés pour reproduire un slapback echo efficace?,LE SOUND DESIGN,56324d1b-3,56324d1b
Pourquoi est-il important de limiter les répétitions lorsque l'on utilise un effet de delay?,LE SOUND DESIGN,56324d1b-3,56324d1b
Quel est l'impact du réglage dry/wet sur le son final d'un enregistrement?,LE SOUND DESIGN,56324d1b-3,56324d1b
Quels sont les types de délais recommandés pour un son vintage?,LE SOUND DESIGN,56324d1b-4,56324d1b
Comment reproduire un effet de delay facilement avec un DAW?,LE SOUND DESIGN,56324d1b-4,56324d1b
Est-il intéressant d'utiliser un délai à bande ou analogique pour le sound design?,LE SOUND DESIGN,56324d1b-4,56324d1b
Quelle est la différence entre l'effet de delay et la reverb en termes d'application?,LE SOUND DESIGN,56324d1b-4,56324d1b
Comment ajouter de la modulation sur le délai dans un projet audio?,LE SOUND DESIGN,56324d1b-4,56324d1b
Quels sont les avantages d'utiliser le delay au lieu de la reverb lors du mixage ?,LE SOUND DESIGN,56324d1b-5,56324d1b
Comment le delay à la croche pointée peut-il être utilisé dans la production musicale ?,LE SOUND DESIGN,56324d1b-5,56324d1b
Quelles sont les différentes valeurs de temps de delay que l'on peut appliquer ?,LE SOUND DESIGN,56324d1b-5,56324d1b
Pourquoi est-il important de synchroniser les delays avec le tempo d'une piste ?,LE SOUND DESIGN,56324d1b-5,56324d1b
Qui est l'artiste connu pour son utilisation innovante du delay sur guitare ?,LE SOUND DESIGN,56324d1b-5,56324d1b
Quels sont les réglages importants pour créer un effet de delay stéréo réussi ?,LE SOUND DESIGN,56324d1b-6,56324d1b
Comment l'effet de delay de The Edge de U2 contribue-t-il à son son unique ?,LE SOUND DESIGN,56324d1b-6,56324d1b
Quelles sont les différences entre un delay stéréo avec des temps identiques et un delay avec des temps variés ?,LE SOUND DESIGN,56324d1b-6,56324d1b
Comment appliquer un chorus sur l'effet de delay sans affecter le reste de l'instrument ?,LE SOUND DESIGN,56324d1b-6,56324d1b
En quoi consiste le dub delay et comment peut-il être utilisé dans la création musicale ?,LE SOUND DESIGN,56324d1b-6,56324d1b
Quelle est l'origine du Dub delay dans la musique ?,LE SOUND DESIGN,56324d1b-7,56324d1b
Quels sont les éléments de base pour créer un effet de delay ?,LE SOUND DESIGN,56324d1b-7,56324d1b
Comment le feedback affecte-t-il les répétitions dans un delay ?,LE SOUND DESIGN,56324d1b-7,56324d1b
Quel matériel était utilisé par les artistes dub pionniers ?,LE SOUND DESIGN,56324d1b-7,56324d1b
Quels sont les effets modernes souvent ajoutés au dub delay ?,LE SOUND DESIGN,56324d1b-7,56324d1b
Quels sont les différents moyens de mettre en pratique l'effet de delay dans une production audio ?,LE SOUND DESIGN,56324d1b-8,56324d1b
Comment le choix du routing du signal audio influence-t-il le son final dans le sound design ?,LE SOUND DESIGN,56324d1b-8,56324d1b
Quelles sont les étapes pour utiliser un plugin de delay de manière efficace dans un morceau ?,LE SOUND DESIGN,56324d1b-8,56324d1b
Pourquoi est-il recommandé d'utiliser une configuration en Send/Return pour le delay ?,LE SOUND DESIGN,56324d1b-8,56324d1b
Quel conseil donneriez-vous pour éviter des problèmes de son lors d'expérimentations de sound design ?,LE SOUND DESIGN,56324d1b-8,56324d1b
Quels sont les dangers liés au feedback lors de l'utilisation d'effets de delay en sound design ?,LE SOUND DESIGN,56324d1b-9,56324d1b
Comment utiliser un limiteur pour protéger mes enceintes lors d'expérimentations sonores ?,LE SOUND DESIGN,56324d1b-9,56324d1b
Quelle est l'importance d'expérimenter avec différents temps de delay en direct ?,LE SOUND DESIGN,56324d1b-9,56324d1b
Comment puis-je effectuer le feedback par l'envoi de la piste retour dans elle-même ?,LE SOUND DESIGN,56324d1b-9,56324d1b
Quels types de filtres devrais-je considérer après le delay pour contrôler le son ?,LE SOUND DESIGN,56324d1b-9,56324d1b
Quels effets puis-je ajouter après un delay pour améliorer le son ?,LE SOUND DESIGN,56324d1b-10,56324d1b
Comment utiliser un filtre Bandpass avec un effet de delay ?,LE SOUND DESIGN,56324d1b-10,56324d1b
Quel est l'importance d'utiliser un limiteur après le delay ?,LE SOUND DESIGN,56324d1b-10,56324d1b
Pourquoi devrais-je Bouncer le résultat sur une piste audio ?,LE SOUND DESIGN,56324d1b-10,56324d1b
Quels sont les conseils pour affiner l'effet de delay au mixage ?,LE SOUND DESIGN,56324d1b-10,56324d1b
Qu'est-ce que l'écoute analytique dans le sound design ?,LE SOUND DESIGN,c5c2d81d-1,c5c2d81d
Comment améliorer mes compétences en mixage audio ?,LE SOUND DESIGN,c5c2d81d-1,c5c2d81d
Pourquoi est-il important de poser des questions lors de l'écoute de la musique ?,LE SOUND DESIGN,c5c2d81d-1,c5c2d81d
Quels sont les éléments d'un bon processing audio ?,LE SOUND DESIGN,c5c2d81d-1,c5c2d81d
Où puis-je écouter le podcast Arsonor pour apprendre davantage sur le son ?,LE SOUND DESIGN,c5c2d81d-1,c5c2d81d
Comment puis-je améliorer mes compétences d'écoute pour la production musicale?,LE SOUND DESIGN,c5c2d81d-2,c5c2d81d
Pourquoi est-il important de se concentrer sur l'écoute des sons en audio?,LE SOUND DESIGN,c5c2d81d-2,c5c2d81d
Qu'est-ce que l'écoute analytique et comment l'appliquer dans mes productions?,LE SOUND DESIGN,c5c2d81d-2,c5c2d81d
Quels éléments devrais-je observer lorsque j'écoute de la musique?,LE SOUND DESIGN,c5c2d81d-2,c5c2d81d
Comment le format podcast peut-il aider à développer mes capacités d'écoute?,LE SOUND DESIGN,c5c2d81d-2,c5c2d81d
Pourquoi est-il important decouter attentivement les productions musicales?,LE SOUND DESIGN,c5c2d81d-3,c5c2d81d
Comment une écoute analytique peut-elle améliorer mes compétences en production musicale?,LE SOUND DESIGN,c5c2d81d-3,c5c2d81d
Quelles sont les quatre catégories de questions à se poser lors de l'écoute de la musique?,LE SOUND DESIGN,c5c2d81d-3,c5c2d81d
Quels aspects de la musique devrais-je analyser pour devenir un meilleur producteur?,LE SOUND DESIGN,c5c2d81d-3,c5c2d81d
"Quels types de leçons peut-on tirer en écoutant des morceaux, qu'ils soient bons ou mauvais?",LE SOUND DESIGN,c5c2d81d-3,c5c2d81d
Comment peut-on améliorer nos productions en écoutant les sons du quotidien ?,LE SOUND DESIGN,c5c2d81d-4,c5c2d81d
Quels éléments doivent être analysés lors de l'arrangement et de l'instrumentation d'un morceau ?,LE SOUND DESIGN,c5c2d81d-4,c5c2d81d
Quelles questions se poser concernant le timbre d'un son durant le sound design ?,LE SOUND DESIGN,c5c2d81d-4,c5c2d81d
Comment évaluer le mixage en fonction des niveaux et de la position des instruments dans l'espace stéréo ?,LE SOUND DESIGN,c5c2d81d-4,c5c2d81d
Quels sont les aspects à observer lors de l'analyse des effets appliqués aux différents éléments sonores ?,LE SOUND DESIGN,c5c2d81d-4,c5c2d81d
Quels sont les principaux défis auxquels sont confrontés les producteurs débutants en musique?,LE SOUND DESIGN,c5c2d81d-5,c5c2d81d
Comment l'écoute active peut-elle améliorer mes compétences en production musicale?,LE SOUND DESIGN,c5c2d81d-5,c5c2d81d
Quelles sont les questions courantes que l'on se pose lors de l'analyse de mixages?,LE SOUND DESIGN,c5c2d81d-5,c5c2d81d
Pourquoi certains producteurs préfèrent-ils le traitement analogique à celui numérique?,LE SOUND DESIGN,c5c2d81d-5,c5c2d81d
Comment faire le lien entre les actions de traitement audio et leurs effets sur le son?,LE SOUND DESIGN,c5c2d81d-5,c5c2d81d
Comment la qualité sonore influence-t-elle l'écoute des podcasts sur le sound design ?,LE SOUND DESIGN,c5c2d81d-6,c5c2d81d
Pourquoi est-il important d'écouter avec un bon casque pour le sound design ?,LE SOUND DESIGN,c5c2d81d-6,c5c2d81d
Quelle est la finalité de l'écoute dans la production audio selon le podcast ?,LE SOUND DESIGN,c5c2d81d-6,c5c2d81d
Comment les écouteurs du téléphone affectent-ils la qualité d'écoute lors des épisodes ?,LE SOUND DESIGN,c5c2d81d-6,c5c2d81d
Pourquoi le fichier audio est-il compressé et comment cela impacte-t-il l'écoute ?,LE SOUND DESIGN,c5c2d81d-6,c5c2d81d
Comment l'analyse d'un son du quotidien peut-elle améliorer nos productions musicales ?,LE SOUND DESIGN,c5c2d81d-7,c5c2d81d
Quelles étapes sont nécessaires pour traiter un son de voiture qui se rapproche ?,LE SOUND DESIGN,c5c2d81d-7,c5c2d81d
Comment utiliser la technique de panoramique pour simuler un mouvement sonore ?,LE SOUND DESIGN,c5c2d81d-7,c5c2d81d
Quel est l'exemple concret de design sonore mentionné dans le document ?,LE SOUND DESIGN,c5c2d81d-7,c5c2d81d
Où puis-je télécharger l'épisode correspondant pour approfondir mes connaissances ?,LE SOUND DESIGN,c5c2d81d-7,c5c2d81d
Comment l'automatisation du panoramique influence-t-elle la perception des sons dans une production audio ?,LE SOUND DESIGN,c5c2d81d-8,c5c2d81d
Quelle est l'importance du volume perçu lorsque l'objet sonore se rapproche ?,LE SOUND DESIGN,c5c2d81d-8,c5c2d81d
Comment utiliser la compression pour mettre en évidence des sons subtils dans une production ?,LE SOUND DESIGN,c5c2d81d-8,c5c2d81d
Quelles variations de fréquences peut-on observez en fonction de la distance d'un objet sonore ?,LE SOUND DESIGN,c5c2d81d-8,c5c2d81d
Comment un filtre low-pass peut-il aider à retranscrire la distance d'un son dans un mixage ?,LE SOUND DESIGN,c5c2d81d-8,c5c2d81d
Quels sont les avantages de l'ecoute analytique dans la production audio ?,LE SOUND DESIGN,c5c2d81d-9,c5c2d81d
Comment la reverb influe-t-elle sur la perception de l'espace dans un son ?,LE SOUND DESIGN,c5c2d81d-9,c5c2d81d
Quel est l'impact de la distance sur le rendu de la reverb dans une production audio ?,LE SOUND DESIGN,c5c2d81d-9,c5c2d81d
Quelles sont les différences entre le son direct et les réflexions de reverb ?,LE SOUND DESIGN,c5c2d81d-9,c5c2d81d
Comment régler le pré-delai sur un plugin de reverb et pourquoi est-il important ?,LE SOUND DESIGN,c5c2d81d-9,c5c2d81d
Comment l'analyse des sons du quotidien peut-elle améliorer mes productions audio ?,LE SOUND DESIGN,c5c2d81d-10,c5c2d81d
Qu'est-ce qu'un riser et comment l'utiliser dans une production musicale ?,LE SOUND DESIGN,c5c2d81d-10,c5c2d81d
Pourquoi est-il important d'écouter attentivement les sons avant de les traiter ?,LE SOUND DESIGN,c5c2d81d-10,c5c2d81d
Comment les traitements audio peuvent-ils transformer un son basique en quelque chose d'intéressant ?,LE SOUND DESIGN,c5c2d81d-10,c5c2d81d
Quelle est la clé pour devenir meilleur en production audio selon cet épisode ?,LE SOUND DESIGN,c5c2d81d-10,c5c2d81d
Comment l'écoute analytique influence-t-elle la production musicale ?,LE SOUND DESIGN,c5c2d81d-11,c5c2d81d
Pourquoi est-il important de mieux écouter les sons du quotidien ?,LE SOUND DESIGN,c5c2d81d-11,c5c2d81d
Quelles sont les propriétés physiques du son que je devrais connaître ?,LE SOUND DESIGN,c5c2d81d-11,c5c2d81d
Où puis-je télécharger l'épisode en qualité audio optimale ?,LE SOUND DESIGN,c5c2d81d-11,c5c2d81d
Comment puis-je partager mes commentaires sur le podcast ?,LE SOUND DESIGN,c5c2d81d-11,c5c2d81d
Quelles sont les modulations les plus courantes dans un synthétiseur?,LE SOUND DESIGN,9ca72a61-1,9ca72a61
Quels modulateurs peuvent être utilisés pour moduler le pitch?,LE SOUND DESIGN,9ca72a61-1,9ca72a61
Comment l'enveloppe affecte-t-elle le volume de sortie d'un son?,LE SOUND DESIGN,9ca72a61-1,9ca72a61
Qu'est-ce que le réglage de l'attaque influence sur le son produit?,LE SOUND DESIGN,9ca72a61-1,9ca72a61
Comment peut-on utiliser le LFO pour moduler d'autres paramètres?,LE SOUND DESIGN,9ca72a61-1,9ca72a61
Quelles sont les modulations courantes utilisées dans le sound design ?,LE SOUND DESIGN,9ca72a61-2,9ca72a61
Comment une enveloppe peut-elle affecter le cut-off d'un filtre ?,LE SOUND DESIGN,9ca72a61-2,9ca72a61
Quels effets peut-on créer avec des réglages d'attaque plus longs sur un synthétiseur ?,LE SOUND DESIGN,9ca72a61-2,9ca72a61
Comment peut-on assigner une enveloppe à la résonance d'un filtre ?,LE SOUND DESIGN,9ca72a61-2,9ca72a61
Quel est l'effet d'une enveloppe sur le pitch d'un oscillateur ?,LE SOUND DESIGN,9ca72a61-2,9ca72a61
Quelles sont les modulations courantes utilisées dans le sound design ?,LE SOUND DESIGN,9ca72a61-3,9ca72a61
Comment fonctionne le LFO et à quoi sert-il dans un synthétiseur ?,LE SOUND DESIGN,9ca72a61-3,9ca72a61
Quel est l'impact de l'enveloppe ADSR sur le son d'un kick ?,LE SOUND DESIGN,9ca72a61-3,9ca72a61
Comment le pitch enveloppe affecte-t-il le timbre d'une note ?,LE SOUND DESIGN,9ca72a61-3,9ca72a61
Quels effets peuvent être créés en modifiant le cut-off du filtre ?,LE SOUND DESIGN,9ca72a61-3,9ca72a61
Quelles sont les modulations courantes que l'on peut utiliser dans un synthétiseur ?,LE SOUND DESIGN,9ca72a61-4,9ca72a61
Comment le key tracking influence-t-il le pitch dans les samplers ?,LE SOUND DESIGN,9ca72a61-4,9ca72a61
Quelle est l'importance de l'enveloppe ADSR dans le sound design ?,LE SOUND DESIGN,9ca72a61-4,9ca72a61
De quelle manière le modulateur Key affecte-t-il le cut-off du filtre ?,LE SOUND DESIGN,9ca72a61-4,9ca72a61
Comment peut-on simuler un instrument de manière réaliste dans un sampler ?,LE SOUND DESIGN,9ca72a61-4,9ca72a61
Quelles sont les modulations courantes utilisées dans le sound design ?,LE SOUND DESIGN,9ca72a61-5,9ca72a61
Comment la vélocité influence-t-elle la sonorité d'un instrument virtuel ?,LE SOUND DESIGN,9ca72a61-5,9ca72a61
Quel est le rôle de l'enveloppe ADSR dans la modulation des sons ?,LE SOUND DESIGN,9ca72a61-5,9ca72a61
Comment peut-on contrôler le decay des notes percussives sur un synthétiseur ?,LE SOUND DESIGN,9ca72a61-5,9ca72a61
En quoi consiste la modulation de la vélocité sur l'amplitude d'un son ?,LE SOUND DESIGN,9ca72a61-5,9ca72a61
Quels sont les impacts de la vélocité sur le cut-off d'un filtre dans un synthétiseur ?,LE SOUND DESIGN,9ca72a61-6,9ca72a61
Comment la vélocité influence-t-elle le point de départ d'un sample dans un sampler ?,LE SOUND DESIGN,9ca72a61-6,9ca72a61
Quels réglages sont disponibles pour ajuster l'influence du Key dans un synthétiseur ?,LE SOUND DESIGN,9ca72a61-6,9ca72a61
Comment les différents échantillons sont-ils assignés aux touches dans un sampler ?,LE SOUND DESIGN,9ca72a61-6,9ca72a61
Quels sont les effets d'une vélocité élevée sur l'attaque de l'enveloppe d'amplitude ?,LE SOUND DESIGN,9ca72a61-6,9ca72a61
Quelles sont les effets de la vélocité sur l'attaque de l'enveloppe d'amplitude ?,LE SOUND DESIGN,9ca72a61-7,9ca72a61
Comment la vélocité influence-t-elle la quantité de l'enveloppe du filtre ?,LE SOUND DESIGN,9ca72a61-7,9ca72a61
Quel impact a la vélocité sur les variations de pitch dans un synthétiseur ?,LE SOUND DESIGN,9ca72a61-7,9ca72a61
