question,category,chunk,article
Comment la distorsion peut-elle affecter le caractère d'un son et quels paramètres doivent être ajustés pour un bon effet,LE SOUND DESIGN,173567a9-10,173567a9
Quels sont les différents traitements que l'on peut appliquer à un son dans une chaîne du signal,LE SOUND DESIGN,173567a9-11,173567a9
Comment utiliser les presets d'un plugin pour modifier le caractère d'un son,LE SOUND DESIGN,173567a9-11,173567a9
Quels réglages de compression sont nécessaires pour unifier les éléments percussifs d'une track,LE SOUND DESIGN,173567a9-11,173567a9
Pourquoi est-il important de tester l'ordre des effets comme l'EQ et la distorsion,LE SOUND DESIGN,173567a9-11,173567a9
Comment comparer le son brut d'une boucle avec le résultat final après traitement,LE SOUND DESIGN,173567a9-11,173567a9
Quelles sont les origines du Breakbeat dans la musique,LE SOUND DESIGN,8f4deb1c-1,8f4deb1c
Comment le Amen Break a-t-il influencé différents genres musicaux,LE SOUND DESIGN,8f4deb1c-1,8f4deb1c
Qu'est-ce qu'un breakbeat et comment est-il défini,LE SOUND DESIGN,8f4deb1c-1,8f4deb1c
Pourquoi le Amen Break est-il considéré comme la boucle la plus samplée,LE SOUND DESIGN,8f4deb1c-1,8f4deb1c
Quelle technique de production sera démontrée dans le prochain épisode,LE SOUND DESIGN,8f4deb1c-1,8f4deb1c
Quelles sont les origines du terme break dans le contexte du sound design,LE SOUND DESIGN,8f4deb1c-2,8f4deb1c
Comment le sampling a-t-il été utilisé par les producteurs de hip hop dans les années 70,LE SOUND DESIGN,8f4deb1c-2,8f4deb1c
Quels éléments de percussion sont généralement extraits lors du sampling d'un break,LE SOUND DESIGN,8f4deb1c-2,8f4deb1c
Quelles sont les caractéristiques d'un extrait rythmique à utiliser dans un morceau,LE SOUND DESIGN,8f4deb1c-2,8f4deb1c
Comment la technique du breakbeat a-t-elle influencé l'évolution de la musique,LE SOUND DESIGN,8f4deb1c-2,8f4deb1c
Quelles sont les origines du Amen Break et qui l'a interprété,LE SOUND DESIGN,8f4deb1c-3,8f4deb1c
Comment le sampling a-t-il changé la production musicale dans les années 80 et 90,LE SOUND DESIGN,8f4deb1c-3,8f4deb1c
Quelles sont les caractéristiques techniques des samplers utilisés à l'époque,LE SOUND DESIGN,8f4deb1c-3,8f4deb1c
Quel impact le sampling a-t-il eu sur l'esthétique sonore des musiques électroniques,LE SOUND DESIGN,8f4deb1c-3,8f4deb1c
Comment les producteurs de l'époque utilisaient-ils les vieilles chansons pour créer de nouvelles compositions,LE SOUND DESIGN,8f4deb1c-3,8f4deb1c
Quelles sont les origines du Amen Break et qui l'a enregistré,LE SOUND DESIGN,8f4deb1c-4,8f4deb1c
Comment le Amen Break a-t-il influencé le développement du hip hop,LE SOUND DESIGN,8f4deb1c-4,8f4deb1c
Quels styles musicaux ont utilisé le Amen Break après sa création,LE SOUND DESIGN,8f4deb1c-4,8f4deb1c
Quelle technique musicale a rendu le Amen Break populaire dans les années 80,LE SOUND DESIGN,8f4deb1c-4,8f4deb1c
Comment le Amen Break a-t-il été utilisé dans les genres Jungle et Drum'n'Bass,LE SOUND DESIGN,8f4deb1c-4,8f4deb1c
Quelles sont les origines du Amen Break et comment a-t-il été utilisé dans différents genres musicaux,LE SOUND DESIGN,8f4deb1c-5,8f4deb1c
Comment le Amen Break a-t-il influencé le développement du hip hop et de la jungle,LE SOUND DESIGN,8f4deb1c-5,8f4deb1c
Quelles sont les caractéristiques qui rendent le Amen Break si polyvalent et populaire,LE SOUND DESIGN,8f4deb1c-5,8f4deb1c
Quels sont quelques exemples de morceaux récents qui utilisent le Amen Break,LE SOUND DESIGN,8f4deb1c-5,8f4deb1c
Comment l'application WhoSampled peut-elle aider à comprendre l'impact du sampling dans la musique,LE SOUND DESIGN,8f4deb1c-5,8f4deb1c
Quels sont les autres breaks intéressants en dehors du Amen Break,LE SOUND DESIGN,8f4deb1c-6,8f4deb1c
Comment le Amen Break a t il influencé le hip hop et la musique jungle,LE SOUND DESIGN,8f4deb1c-6,8f4deb1c
Quels producteurs étaient influencés par les mêmes collections de breaks dans les années 80 et 90,LE SOUND DESIGN,8f4deb1c-6,8f4deb1c
Quelles sont les particularités du son du kit de batterie dans Funky Drummer de James Brown,LE SOUND DESIGN,8f4deb1c-6,8f4deb1c
Quel rôle joue le sampling dans la création de boucles musicales comme celles du morceau Apache,LE SOUND DESIGN,8f4deb1c-6,8f4deb1c
Quels sont les éléments qui rendent le Amen Break si populaire dans le milieu de la musique électronique,LE SOUND DESIGN,8f4deb1c-7,8f4deb1c
Comment la longueur du Amen Break influence-t-elle son utilisation par les artistes,LE SOUND DESIGN,8f4deb1c-7,8f4deb1c
De quelle manière la variété des coups de batterie contribue-t-elle au succès du Amen Break,LE SOUND DESIGN,8f4deb1c-7,8f4deb1c
Pourquoi le rythme syncopé du Amen Break est-il apprécié par les producteurs de musique,LE SOUND DESIGN,8f4deb1c-7,8f4deb1c
Quelles spécificités des coups de la caisse claire jouent un rôle dans l'impact rythmique du Amen Break,LE SOUND DESIGN,8f4deb1c-7,8f4deb1c
Quelles sont les particularités du breakbeat Amen Break dans la musique hip hop et jungle,LE SOUND DESIGN,8f4deb1c-8,8f4deb1c
Comment la caisse claire contribue-t-elle aux motifs rythmiques dans le Amen Break,LE SOUND DESIGN,8f4deb1c-8,8f4deb1c
Quelles techniques de transformation peuvent être appliquées au Amen Break pour créer des sons uniques,LE SOUND DESIGN,8f4deb1c-8,8f4deb1c
Quels outils et logiciels sont recommandés pour travailler sur le Amen Break dans le sound design,LE SOUND DESIGN,8f4deb1c-8,8f4deb1c
Comment le réarrangement des coups individuels du Amen Break peut-il mener à des textures intéressantes,LE SOUND DESIGN,8f4deb1c-8,8f4deb1c
Quelles sonorités sont souvent utilisées pour créer l'effet du Braam dans le sound design,LE SOUND DESIGN,80af6c63-1,80af6c63
Comment le layering est-il appliqué dans la création du son Braam,LE SOUND DESIGN,80af6c63-1,80af6c63
Quel rôle joue la distorsion et la reverb dans le traitement du son Braam,LE SOUND DESIGN,80af6c63-1,80af6c63
Quelles techniques de time-stretching sont pertinentes pour le sound design,LE SOUND DESIGN,80af6c63-1,80af6c63
Pourquoi le son Braam est-il considéré comme essentiel dans les bandes-annonces de films,LE SOUND DESIGN,80af6c63-1,80af6c63
Quelle est l'origine du son Braam et quel compositeur est associé à son utilisation,LE SOUND DESIGN,80af6c63-2,80af6c63
En quoi le son Braam influence t il notre perception des films d'action et d'horreur,LE SOUND DESIGN,80af6c63-2,80af6c63
Quels éléments sonores sont essentiels pour créer un effet similaire au son Braam,LE SOUND DESIGN,80af6c63-2,80af6c63
Comment ce son est il devenu une tendance dans le design sonore pour les trailers de films,LE SOUND DESIGN,80af6c63-2,80af6c63
Quelles techniques de sound design peuvent être appliquées pour reproduire le son Braam de manière originale,LE SOUND DESIGN,80af6c63-2,80af6c63
Quelles sont les techniques de sound design utilisées pour créer un effet puissant et impactant dans la musique,LE SOUND DESIGN,80af6c63-3,80af6c63
Comment le layering contribue-t-il à la formation d'un son cohérent dans le sound design,LE SOUND DESIGN,80af6c63-3,80af6c63
Pourquoi est-il important de choisir un son de qualité à la source pour le sound design,LE SOUND DESIGN,80af6c63-3,80af6c63
Quels types d'instruments sont recommandés pour obtenir un son de type Braam,LE SOUND DESIGN,80af6c63-3,80af6c63
Comment la reverb et la saturation jouent-elles un rôle dans la création d'effets sonores épiques,LE SOUND DESIGN,80af6c63-3,80af6c63
Quels outils ou racks pourraient être utilisés pour créer des effets de brass dans Ableton,LE SOUND DESIGN,80af6c63-4,80af6c63
Comment peut-on améliorer la richesse d'un son en utilisant le layering des instruments,LE SOUND DESIGN,80af6c63-4,80af6c63
Quelle technique peut-on appliquer pour répartir les sons dans l'espace stéréo,LE SOUND DESIGN,80af6c63-4,80af6c63
Comment réussir à élargir un son si le panoramique semble insuffisant,LE SOUND DESIGN,80af6c63-4,80af6c63
Quelle est l'importance de varier les timbres lors de la superposition de sons dans un projet audio,LE SOUND DESIGN,80af6c63-4,80af6c63
Comment utiliser le panning pour répartir plusieurs instruments dans un projet audio,LE SOUND DESIGN,80af6c63-5,80af6c63
Quelle est l'importance de la saturation et de la distorsion dans la conception sonore,LE SOUND DESIGN,80af6c63-5,80af6c63
Comment la reverb peut-elle contribuer à créer un effet cinématique puissant,LE SOUND DESIGN,80af6c63-5,80af6c63
Quels outils ou techniques peut-on utiliser pour affiner les sonorités après l'application de la distorsion,LE SOUND DESIGN,80af6c63-5,80af6c63
Comment peut-on introduire du mouvement dans un son en utilisant le pitch-bend,LE SOUND DESIGN,80af6c63-5,80af6c63
Comment peut-on créer un mouvement dans un son en utilisant le pitch-bend,LE SOUND DESIGN,80af6c63-6,80af6c63
Quels éléments doivent être ajoutés pour renforcer l'impact d'un son cinématique,LE SOUND DESIGN,80af6c63-6,80af6c63
Quel est le rôle de la compression dans le traitement final d'un projet audio,LE SOUND DESIGN,80af6c63-6,80af6c63
Pourquoi est-il préférable de faire un bounce audio plutôt que de rester en MIDI,LE SOUND DESIGN,80af6c63-6,80af6c63
Quels avantages offre le fichier audio par rapport au fichier MIDI dans un projet,LE SOUND DESIGN,80af6c63-6,80af6c63
Quel effet sonore est utilisé pour apporter impact et puissance dans le sound design,LE SOUND DESIGN,80af6c63-7,80af6c63
Quels types de sons bruts sont recommandés pour créer un son cinématographique,LE SOUND DESIGN,80af6c63-7,80af6c63
Comment le son Braam se décompose-t-il en différentes parties,LE SOUND DESIGN,80af6c63-7,80af6c63
Quelle est l'importance de l'analyse du son original dans le processus de sound design,LE SOUND DESIGN,80af6c63-7,80af6c63
Comment peut-on sauvegarder et organiser ses créations sonores dans une collection personnelle,LE SOUND DESIGN,80af6c63-7,80af6c63
Comment peut-on utiliser l'effet de reverb pour enrichir un son dans le sound design,LE SOUND DESIGN,80af6c63-8,80af6c63
Quelle technique peut-on appliquer pour ajuster la longueur d'un échantillon audio,LE SOUND DESIGN,80af6c63-8,80af6c63
Comment vérifier si un son est à la bonne tonalité lors de son traitement,LE SOUND DESIGN,80af6c63-8,80af6c63
Quels types de sons peuvent être superposés pour créer un effet d'impact puissant,LE SOUND DESIGN,80af6c63-8,80af6c63
Quel est l'impact du stretching inversé sur la tonalité d'un échantillon sonore,LE SOUND DESIGN,80af6c63-8,80af6c63
Quelles sont les étapes pour modifier le pitch d'un échantillon afin d'obtenir la tonalité souhaitée,LE SOUND DESIGN,80af6c63-9,80af6c63
Comment le traitement EQ influence-t-il la qualité sonore d'un effet de son,LE SOUND DESIGN,80af6c63-9,80af6c63
Pourquoi est-il important de choisir le bon algorithme de time-stretch lors de l'édition sonore,LE SOUND DESIGN,80af6c63-9,80af6c63
Quelles techniques peuvent être utilisées pour obtenir un son d'impact dans un design sonore,LE SOUND DESIGN,80af6c63-9,80af6c63
Comment le traitement final sur le groupe sonore contribue-t-il à la qualité du son global,LE SOUND DESIGN,80af6c63-9,80af6c63
Quels sont les principaux effets utilisés pour obtenir le son Braam dans le sound design,LE SOUND DESIGN,80af6c63-10,80af6c63
Comment la modification de la tonalité du sample de sirène influence-t-elle son rendu final,LE SOUND DESIGN,80af6c63-10,80af6c63
Quel est le processus de traitement appliqué au sample de didgeridoo pour créer un son granuleux,LE SOUND DESIGN,80af6c63-10,80af6c63
Comment le layering des sons contribue-t-il à la richesse du sound design final,LE SOUND DESIGN,80af6c63-10,80af6c63
Pourquoi est-il important d'appliquer des traitements sur le bus master dans un projet audio,LE SOUND DESIGN,80af6c63-10,80af6c63
Quelles techniques peuvent être utilisées pour créer un effet sonore puissant dans le sound design,LE SOUND DESIGN,80af6c63-11,80af6c63
Comment le son de la corne de navire peut-il être combiné avec d'autres sons pour obtenir un effet souhaité,LE SOUND DESIGN,80af6c63-11,80af6c63
Quelle est l'importance du traitement audio lors du mixage des sons superposés,LE SOUND DESIGN,80af6c63-11,80af6c63
Comment peut-on évaluer l'impact d'un son final par rapport à une version originale,LE SOUND DESIGN,80af6c63-11,80af6c63
Quels éléments sont nécessaires pour finaliser un projet de sound design de manière cohérente,LE SOUND DESIGN,80af6c63-11,80af6c63
Quels sont les différents types d'effets de delay mentionnés dans l'enregistrement,LE SOUND DESIGN,56324d1b-1,56324d1b
Comment le delay peut-il être utilisé pour améliorer une prise de son,LE SOUND DESIGN,56324d1b-1,56324d1b
Pourquoi l'effet de delay est-il considéré comme un outil puissant pour les musiciens,LE SOUND DESIGN,56324d1b-1,56324d1b
Quelles sont les conséquences d'une mauvaise utilisation du delay dans un mixage,LE SOUND DESIGN,56324d1b-1,56324d1b
Comment le delay a-t-il influencé le développement de certains courants musicaux,LE SOUND DESIGN,56324d1b-1,56324d1b
Quelles sont les différentes manières de créer un effet de delay en fonction des types,LE SOUND DESIGN,56324d1b-2,56324d1b
Comment le slapback echo a-t-il été développé à l'origine,LE SOUND DESIGN,56324d1b-2,56324d1b
Quels réglages sont nécessaires pour reproduire un effet de slapback efficace,LE SOUND DESIGN,56324d1b-2,56324d1b
Comment équilibrer le niveau du son retardé par rapport au signal d'origine,LE SOUND DESIGN,56324d1b-2,56324d1b
Pourquoi est-il important de limiter le feedback lors de l'utilisation d'un effet de delay,LE SOUND DESIGN,56324d1b-2,56324d1b
Comment ajuste-t-on le contrôle de répétition pour un effet de delay efficace,LE SOUND DESIGN,56324d1b-3,56324d1b
Quels types de plugins de delay sont recommandés pour obtenir un son vintage,LE SOUND DESIGN,56324d1b-3,56324d1b
Comment équilibrer le niveau entre le son retardé et le signal d'origine,LE SOUND DESIGN,56324d1b-3,56324d1b
Quelles sont les techniques pour simuler des variations en pitch avec un effet de delay,LE SOUND DESIGN,56324d1b-3,56324d1b
Pourquoi utiliser un delay plutôt qu'une reverb lors du mixage,LE SOUND DESIGN,56324d1b-3,56324d1b
Quels sont les différents types de synchronisation pour les effets de delay en musique,LE SOUND DESIGN,56324d1b-4,56324d1b
Comment le delay stéréo peut-il créer une sensation de tapis rythmique,LE SOUND DESIGN,56324d1b-4,56324d1b
Quelle est la différence entre une croche régulière et une croche pointée dans le contexte du delay,LE SOUND DESIGN,56324d1b-4,56324d1b
Comment peut-on ajuster les temps de delay à gauche et à droite pour obtenir un effet stéréo,LE SOUND DESIGN,56324d1b-4,56324d1b
Qui est un artiste réputé pour l'utilisation du delay avec des croches pointées dans sa musique,LE SOUND DESIGN,56324d1b-4,56324d1b
Quels sont les effets de delay que l'on peut appliquer pour améliorer un son en stéréo,LE SOUND DESIGN,56324d1b-5,56324d1b
Comment peut-on recréer un rythme en cascade avec des temps de delay différents pour la gauche et la droite,LE SOUND DESIGN,56324d1b-5,56324d1b
Quelle est l'importance du paramètre de feedback dans les effets de delay dans un contexte de musique dub,LE SOUND DESIGN,56324d1b-5,56324d1b
Quels équipements étaient utilisés par les artistes dub pionniers pour créer des effets de delay,LE SOUND DESIGN,56324d1b-5,56324d1b
Comment appliquer un chorus seulement sur l'effet de delay sans affecter le reste de l'instrument,LE SOUND DESIGN,56324d1b-5,56324d1b
Quelles sont les propriétés fondamentales de l'effet de delay que je dois comprendre pour l'utiliser correctement,LE SOUND DESIGN,56324d1b-6,56324d1b
Comment le routing du signal audio influence-t-il le rendu final de l'effet de delay,LE SOUND DESIGN,56324d1b-6,56324d1b
Pourquoi est-il recommandé d'utiliser un limiteur lors des expérimentations en sound design,LE SOUND DESIGN,56324d1b-6,56324d1b
Quels sont les avantages d'utiliser un plugin de delay à bande pour obtenir un effet de delay classic,LE SOUND DESIGN,56324d1b-6,56324d1b
Comment automatiser l'envoi du delay pour créer des effets ponctuels dans un morceau de musique,LE SOUND DESIGN,56324d1b-6,56324d1b
Quelles sont les précautions à prendre pour éviter la saturation lors de l'utilisation d'effets de delay,LE SOUND DESIGN,56324d1b-7,56324d1b
Comment peut-on utiliser un limiteur dans une chaîne de traitement audio,LE SOUND DESIGN,56324d1b-7,56324d1b
Quelle est l'importance d'expérimenter avec les temps de delay et les effets associés,LE SOUND DESIGN,56324d1b-7,56324d1b
Quelles méthodes traditionnelles permettent de créer un effet de feedback avec une piste audio,LE SOUND DESIGN,56324d1b-7,56324d1b
Pourquoi est-il conseillé de bouncer un effet de delay sur une piste audio à part entière,LE SOUND DESIGN,56324d1b-7,56324d1b
Comment l écoute analytique peut elle améliorer mes compétences en sound design,LE SOUND DESIGN,c5c2d81d-1,c5c2d81d
Quelles sont les bonnes questions à se poser lors de l écoute musicale,LE SOUND DESIGN,c5c2d81d-1,c5c2d81d
Comment le processing audio est il lié à mes intentions de production,LE SOUND DESIGN,c5c2d81d-1,c5c2d81d
Quelle est la différence entre le travail d un compositeur et d un ingénieur du son,LE SOUND DESIGN,c5c2d81d-1,c5c2d81d
Pourquoi est il important d apprendre à écouter les sons de manière attentive,LE SOUND DESIGN,c5c2d81d-1,c5c2d81d
Quelles sont les caractéristiques fondamentales de l'écoute analytique dans le domaine de la production musicale,LE SOUND DESIGN,c5c2d81d-2,c5c2d81d
Comment peut-on améliorer ses compétences d'écoute pour devenir un meilleur producteur musical,LE SOUND DESIGN,c5c2d81d-2,c5c2d81d
Pourquoi est-il important d'analyser les sons du quotidien pour le sound design,LE SOUND DESIGN,c5c2d81d-2,c5c2d81d
Quelles questions doit-on se poser pendant l'écoute d'un morceau pour en tirer le meilleur enseignement,LE SOUND DESIGN,c5c2d81d-2,c5c2d81d
Comment la technique d'écoute peut-elle affecter la création musicale et le mixage,LE SOUND DESIGN,c5c2d81d-2,c5c2d81d
Quelles sont les différentes catégories de questions à se poser lors de l'écoute d'un morceau,LE SOUND DESIGN,c5c2d81d-3,c5c2d81d
Comment décririez-vous la différence entre le couplet et le refrain dans un morceau de musique,LE SOUND DESIGN,c5c2d81d-3,c5c2d81d
Quels types d'effets peuvent être observés lors de l'analyse d'une production sonore,LE SOUND DESIGN,c5c2d81d-3,c5c2d81d
Quels aspects doivent être pris en compte lors de l'évaluation du mixage d'un morceau,LE SOUND DESIGN,c5c2d81d-3,c5c2d81d
Comment la tonalité d'un morceau influence-t-elle sa composition,LE SOUND DESIGN,c5c2d81d-3,c5c2d81d
Quelle est l'importance de l'écoute analytique dans la production musicale,LE SOUND DESIGN,c5c2d81d-4,c5c2d81d
Comment faire le lien entre les interrogations et les outils de production,LE SOUND DESIGN,c5c2d81d-4,c5c2d81d
Quelles sont les conséquences de l'écoute sur le traitement des sons,LE SOUND DESIGN,c5c2d81d-4,c5c2d81d
Comment l'écoute active peut-elle améliorer mes compétences en sound design,LE SOUND DESIGN,c5c2d81d-4,c5c2d81d
Quels sont les avantages du traitement analogique par rapport au numérique,LE SOUND DESIGN,c5c2d81d-4,c5c2d81d
Comment l'écoute analytique peut-elle améliorer mes productions sonores,LE SOUND DESIGN,c5c2d81d-5,c5c2d81d
Quel est l'impact de la qualité sonore sur l'expérience d'écoute d'un podcast,LE SOUND DESIGN,c5c2d81d-5,c5c2d81d
Quelles sont les erreurs courantes à éviter lors de l'écoute de contenus audio,LE SOUND DESIGN,c5c2d81d-5,c5c2d81d
Comment concevoir un effet de montée à partir d'un son du quotidien,LE SOUND DESIGN,c5c2d81d-5,c5c2d81d
Pourquoi est-il important d'analyser des sons réels dans le processus de création musicale,LE SOUND DESIGN,c5c2d81d-5,c5c2d81d
Quelles sont les étapes pour traiter un son de voiture afin de simuler son déplacement vers l'auditeur,LE SOUND DESIGN,c5c2d81d-6,c5c2d81d
Comment la variation du panoramique influence-t-elle la perception du mouvement sonore,LE SOUND DESIGN,c5c2d81d-6,c5c2d81d
Quelle est l'importance de l'automation du volume dans la perception d'un son qui se rapproche,LE SOUND DESIGN,c5c2d81d-6,c5c2d81d
Comment le contenu en hautes fréquences change-t-il en fonction de la distance d'un objet sonore,LE SOUND DESIGN,c5c2d81d-6,c5c2d81d
Quel outil peut être utilisé pour mettre en évidence des sons subtils qui ne sont pas audibles à distance,LE SOUND DESIGN,c5c2d81d-6,c5c2d81d
Comment utiliser un filtre Low-pass pour améliorer la perception des objets sonores dans une production audio,LE SOUND DESIGN,c5c2d81d-7,c5c2d81d
Quelle est l'importance de la distance entre un objet sonore et l'auditeur dans le traitement de la réverbération,LE SOUND DESIGN,c5c2d81d-7,c5c2d81d
Comment le pré-délai influence-t-il l'effet de réverbération dans un mixage audio,LE SOUND DESIGN,c5c2d81d-7,c5c2d81d
En quoi consiste l'écoute A/B dans le processus d'évaluation d'un son final,LE SOUND DESIGN,c5c2d81d-7,c5c2d81d
Comment peut-on appliquer un riser dans un contexte musical en utilisant un bruit blanc,LE SOUND DESIGN,c5c2d81d-7,c5c2d81d
Comment l'écoute analytique peut-elle améliorer mes productions musicales,LE SOUND DESIGN,c5c2d81d-8,c5c2d81d
Quelles techniques peuvent rendre un son plus intéressant en sound design,LE SOUND DESIGN,c5c2d81d-8,c5c2d81d
Comment utiliser un riser dans un contexte musical spécifique,LE SOUND DESIGN,c5c2d81d-8,c5c2d81d
Pourquoi est-il important d'écouter le monde qui nous entoure en tant que producteur musical,LE SOUND DESIGN,c5c2d81d-8,c5c2d81d
Quel est l'équipement le plus essentiel pour un ingénieur du son selon l'épisode,LE SOUND DESIGN,c5c2d81d-8,c5c2d81d
Quelles sont les principales sources de modulation que l'on peut utiliser dans un synthétiseur,LE SOUND DESIGN,9ca72a61-1,9ca72a61
Comment l'enveloppe ADSR influence-t-elle la forme du son en sortie,LE SOUND DESIGN,9ca72a61-1,9ca72a61
Quels paramètres du filtre peuvent être modulés par une enveloppe,LE SOUND DESIGN,9ca72a61-1,9ca72a61
Quel rôle joue la vélocité dans la modération du son d'un synthétiseur,LE SOUND DESIGN,9ca72a61-1,9ca72a61
En quoi consiste la modulation du pitch d'un oscillateur et comment est-elle réalisée,LE SOUND DESIGN,9ca72a61-1,9ca72a61
Quelles sont les différentes façons de moduler le cut-off d'un filtre dans un synthétiseur,LE SOUND DESIGN,9ca72a61-2,9ca72a61
Comment fonctionne l'enveloppe ADSR et son impact sur le son,LE SOUND DESIGN,9ca72a61-2,9ca72a61
Quels effets peuvent être créés en utilisant un LFO sur le pitch d'un oscillateur,LE SOUND DESIGN,9ca72a61-2,9ca72a61
En quoi l'assignation d'une enveloppe à la résonance du filtre peut-elle enrichir le son,LE SOUND DESIGN,9ca72a61-2,9ca72a61
Quels sont les réglages typiques pour une enveloppe dédiée au pitch dans un synthétiseur,LE SOUND DESIGN,9ca72a61-2,9ca72a61
Quels sont les effets de la modulation sur le panoramique dans un synthétiseur,LE SOUND DESIGN,9ca72a61-3,9ca72a61
Comment le LFO influence-t-il le cut-off d'un filtre dans la conception sonore,LE SOUND DESIGN,9ca72a61-3,9ca72a61
Quel rôle joue le key tracking dans le contrôle de la brillance des notes jouées,LE SOUND DESIGN,9ca72a61-3,9ca72a61
Comment la vélocité peut-elle affecter le réglage du cut-off dans un sampler,LE SOUND DESIGN,9ca72a61-3,9ca72a61
Quelle est l'importance du decay dans l'enveloppe d'amplitude pour les notes percussives,LE SOUND DESIGN,9ca72a61-3,9ca72a61
Quelles sont les modulations courantes utilisées dans le sound design des synthétiseurs,LE SOUND DESIGN,9ca72a61-4,9ca72a61
Comment la vélocité influence-t-elle le son dans un synthétiseur ou un sampler,LE SOUND DESIGN,9ca72a61-4,9ca72a61
Quel est le rôle d'un LFO et comment est-il lié à la tonalité des notes,LE SOUND DESIGN,9ca72a61-4,9ca72a61
De quelle manière l'enveloppe ADSR peut-elle être ajustée pour des notes percussives,LE SOUND DESIGN,9ca72a61-4,9ca72a61
Comment la modulation du cut-off affecte-t-elle le timbre d'un son,LE SOUND DESIGN,9ca72a61-4,9ca72a61
Quelles sont les différentes modulations que l'on peut appliquer pour influencer le point de départ d'un échantillon dans un synthétiseur,LE SOUND DESIGN,9ca72a61-5,9ca72a61
Comment la vélocité peut-elle modifier l'attaque d'une enveloppe d'amplitude lors de la lecture d'un son,LE SOUND DESIGN,9ca72a61-5,9ca72a61
Quel effet la vélocité a-t-elle sur l'intensité des mouvements de filtre et sur l'enveloppe associée,LE SOUND DESIGN,9ca72a61-5,9ca72a61
Dans quelle mesure l'aftertouch peut-il être utilisé pour ajouter des variations dans le cut-off d'un filtre,LE SOUND DESIGN,9ca72a61-5,9ca72a61
Comment le pitch-bend est-il utilisé pour simuler des variations subtiles de son dans des instruments comme le violon ou les cuivres,LE SOUND DESIGN,9ca72a61-5,9ca72a61
Quelles sont les principales fonctions de la molette de modulation dans un synthétiseur,LE SOUND DESIGN,9ca72a61-6,9ca72a61
Comment l'enveloppe ADSR influence-t-elle la sonorité d'un son synthétisé,LE SOUND DESIGN,9ca72a61-6,9ca72a61
Quel est le rôle du LFO dans la modulation des paramètres du son,LE SOUND DESIGN,9ca72a61-6,9ca72a61
Comment peut-on ajuster le decay d'un son percussif dans une production audio,LE SOUND DESIGN,9ca72a61-6,9ca72a61
Quelles modulations peuvent être assignées aux paramètres du filtre sur un synthétiseur,LE SOUND DESIGN,9ca72a61-6,9ca72a61
Quels sont les principaux contrôles de modulation que l'on trouve dans un synthétiseur,LE SOUND DESIGN,c3b2f68e-1,c3b2f68e
Comment l'enveloppe et le LFO contribuent-ils à l'évolution du son,LE SOUND DESIGN,c3b2f68e-1,c3b2f68e
Quelles sont les différentes façons de moduler un son dans la section des oscillateurs,LE SOUND DESIGN,c3b2f68e-1,c3b2f68e
Pourquoi est-il important d'affecter une enveloppe au volume de sortie du son,LE SOUND DESIGN,c3b2f68e-1,c3b2f68e
