question,category,chunk,article
Comment gérer la profondeur d'un mixage pour créer une meilleure impression d'espace,LA POST-PROD,9665b994-4,9665b994
Quels problèmes peuvent survenir en raison d'un déséquilibre de largeur stéréo dans un mixage,LA POST-PROD,9665b994-4,9665b994
Dans quel contexte un mixage presque mono pourrait-il être approprié selon le genre musical,LA POST-PROD,9665b994-4,9665b994
Comment l'arrangement des instruments influence-t-il la répartition de la largeur stéréo dans un mix,LA POST-PROD,9665b994-4,9665b994
Quels sont les éléments à considérer pour élargir la largeur stéréo dans un mixage audio,LA POST-PROD,9665b994-5,9665b994
Comment l'arrangement musical influence-t-il le traitement de la largeur stéréo,LA POST-PROD,9665b994-5,9665b994
Quelle technique peut-on utiliser pour traiter les déséquilibres dans le panorama stéréo,LA POST-PROD,9665b994-5,9665b994
Pourquoi est-il important de garder une oreille sur la balance tonale lors des ajustements de largeur stéréo,LA POST-PROD,9665b994-5,9665b994
Comment l'utilisation d'un EQ en mode mid/side aide-t-elle à améliorer l'équilibre fréquentiel de la stéréo,LA POST-PROD,9665b994-5,9665b994
Quelles techniques peut-on utiliser pour améliorer la séparation des éléments dans un mixage,LA POST-PROD,9665b994-6,9665b994
Pourquoi est-il important de garder les basses fréquences en majorité en mono,LA POST-PROD,9665b994-6,9665b994
Comment l'utilisation d'un EQ en mode M/S peut-elle influencer le traitement des zones de fréquences,LA POST-PROD,9665b994-6,9665b994
Quels effets négatifs peut avoir une largeur stéréo excessive sur le mixage lorsqu'il est sommé en mono,LA POST-PROD,9665b994-6,9665b994
Dans quels contextes entend-on souvent de la musique en mono aujourd'hui,LA POST-PROD,9665b994-6,9665b994
Quels sont les avantages d'écouter un mixage en mono pour améliorer la largeur stéréo,LA POST-PROD,9665b994-7,9665b994
Comment le positionnement des haut-parleurs peut-il affecter la perception du son stéréo,LA POST-PROD,9665b994-7,9665b994
Quelles sont les techniques mentionnées pour traiter la largeur stéréo dans un mixage,LA POST-PROD,9665b994-7,9665b994
Pourquoi est-il important de s'assurer qu'un mixage sonne bien en mono avant d'ajouter des effets,LA POST-PROD,9665b994-7,9665b994
Comment la qualité du mixage en mono peut-elle être utilisée comme un contrôle de qualité,LA POST-PROD,9665b994-7,9665b994
Quelles sont les techniques de panoramique que je peux utiliser pour améliorer mon mixage,LA POST-PROD,9665b994-8,9665b994
Comment l'effet de reverb affecte-t-il la largeur et la profondeur du son dans un mix,LA POST-PROD,9665b994-8,9665b994
Quelles précautions dois-je prendre lors de l'utilisation du panoramique pour maintenir l'équilibre stéréo,LA POST-PROD,9665b994-8,9665b994
Qu'est-ce que l'autopan et comment peut-il ajouter de l'intérêt rythmique dans un mix,LA POST-PROD,9665b994-8,9665b994
Pourquoi il est important de vérifier le mixage en mono pour éviter que le son ne se rétrécisse,LA POST-PROD,9665b994-8,9665b994
Quel est l'effet de la reverb sur la largeur stéréo et comment peut-on la configurer sans altérer le son,LA POST-PROD,9665b994-9,9665b994
Comment utiliser le delay et l'effet Haas pour créer une sensation de largeur stéréo,LA POST-PROD,9665b994-9,9665b994
Quelles sont les étapes pour doubler une piste afin d'équilibrer le son entre les enceintes,LA POST-PROD,9665b994-9,9665b994
Pourquoi est-il important de vérifier la compatibilité mono lorsque l'on utilise des effets de largeur stéréo,LA POST-PROD,9665b994-9,9665b994
Quelles techniques peut-on appliquer pour différencier deux pistes doublées et obtenir un effet de largeur stéréo,LA POST-PROD,9665b994-9,9665b994
Quelles sont les techniques pour créer une largeur stéréo dans un mixage audio,LA POST-PROD,9665b994-10,9665b994
Comment utiliser le micro-shifting pour élargir une piste audio tout en la maintenant centrée,LA POST-PROD,9665b994-10,9665b994
Quels sont les avantages d'utiliser un plugin d'élargissement stéréo par rapport aux méthodes traditionnelles,LA POST-PROD,9665b994-10,9665b994
Quelle est l'importance d'enregistrer plusieurs versions d'une même prestation pour la largeur stéréo,LA POST-PROD,9665b994-10,9665b994
De quelle manière les EQ et les effets peuvent-ils contribuer à la création de différences entre les pistes,LA POST-PROD,9665b994-10,9665b994
Quelles sont les considérations préalables à prendre en compte pour travailler la largeur stéréo dans un mixage,LA POST-PROD,9665b994-11,9665b994
Comment peut-on utiliser le delay pour élargir une piste vocale au centre,LA POST-PROD,9665b994-11,9665b994
Quelles techniques simples peut-on tester pour gérer la largeur stéréo avec des outils existants,LA POST-PROD,9665b994-11,9665b994
Pourquoi est-il important de maintenir un son naturel lors de l'élargissement de la largeur stéréo,LA POST-PROD,9665b994-11,9665b994
Dans quel contexte utilise-t-on généralement l'élargissement de fréquence sur la piste Master,LA POST-PROD,9665b994-11,9665b994
Quelles sont les caractéristiques de l'image stéréo dans un mixage audio professionnel,LA POST-PROD,0ab34f0f-1,0ab34f0f
Comment le placement des instruments influence-t-il l'image stéréo,LA POST-PROD,0ab34f0f-1,0ab34f0f
Quels sont les effets d'une largeur stéréo variable sur l'ambiance d'un morceau,LA POST-PROD,0ab34f0f-1,0ab34f0f
En quoi le concept de delay est-il important pour l'image stéréo,LA POST-PROD,0ab34f0f-1,0ab34f0f
Quelle est la différence entre un son perçu d'une seule oreille et celui perçu en stéréo,LA POST-PROD,0ab34f0f-1,0ab34f0f
Quelles sont les différences perceptibles entre le son qui arrive à l'oreille gauche et à l'oreille droite,LA POST-PROD,0ab34f0f-2,0ab34f0f
Comment le cerveau localise-t-il une source sonore dans l'espace,LA POST-PROD,0ab34f0f-2,0ab34f0f
Quels paramètres influencent la perception binaurale du son,LA POST-PROD,0ab34f0f-2,0ab34f0f
Pourquoi l'effet binaural est-il plus efficace lors de l'écoute au casque,LA POST-PROD,0ab34f0f-2,0ab34f0f
Comment peut-on simuler les différences binaurales en utilisant des technologies modernes,LA POST-PROD,0ab34f0f-2,0ab34f0f
Quelles sont les différences entre l'écoute au casque et l'écoute sur enceintes en termes de perception sonore,LA POST-PROD,0ab34f0f-3,0ab34f0f
Comment le son binaural est-il simulé pour créer une perception 3D autour de l'auditeur,LA POST-PROD,0ab34f0f-3,0ab34f0f
Quels sont les éléments qui influencent la localisation du son entre les oreilles droite et gauche,LA POST-PROD,0ab34f0f-3,0ab34f0f
Quelle est l'importance de la configuration des haut-parleurs pour obtenir un effet stéréo optimal,LA POST-PROD,0ab34f0f-3,0ab34f0f
Comment fonctionne une tête artificielle dans la capture du son binaural,LA POST-PROD,0ab34f0f-3,0ab34f0f
Qu est ce qui distingue un son mono d un son stereo et comment cela influence t il l experience d écoute,LA POST-PROD,0ab34f0f-4,0ab34f0f
Comment fonctionne le concept de centre fantome dans une configuration stereo et quelle est son importance,LA POST-PROD,0ab34f0f-4,0ab34f0f
Quels sont les effets d un son arrivant de manière tardive à l une des oreilles sur la perception de l image sonore,LA POST-PROD,0ab34f0f-4,0ab34f0f
Qu est ce que la source virtuelle et comment se manifeste t elle dans un enregistrement stereo,LA POST-PROD,0ab34f0f-4,0ab34f0f
Pourquoi la position de l auditeur est elle cruciale pour une meilleure perception stéréo dans un environnement d écoute,LA POST-PROD,0ab34f0f-4,0ab34f0f
Quelles sont les conditions idéales pour un ingénieur du mixage lorsqu'il écoute de la musique,LA POST-PROD,0ab34f0f-5,0ab34f0f
Comment la position d'écoute influence-t-elle la perception de l'image stéréo,LA POST-PROD,0ab34f0f-5,0ab34f0f
Quels sont les facteurs qui affectent la largeur stéréo dans un mixage audio,LA POST-PROD,0ab34f0f-5,0ab34f0f
Comment le panoramique et le volume interagissent-ils pour créer des effets stéréo,LA POST-PROD,0ab34f0f-5,0ab34f0f
Pourquoi est-il important de prendre en compte plusieurs dimensions lors de la création d'une image stéréo,LA POST-PROD,0ab34f0f-5,0ab34f0f
Quelles sont les étapes à suivre pour intégrer un morceau de référence dans ma session de mixage,LA POST-PROD,af597c08-1,af597c08
Comment puis-je effectuer un test A/B de manière efficace entre mon mixage et la référence,LA POST-PROD,af597c08-1,af597c08
Pourquoi est-il important de garder la piste de référence sans traitements audio,LA POST-PROD,af597c08-1,af597c08
Comment aligner l'audio de la référence avec mon mixage pour une écoute comparative,LA POST-PROD,af597c08-1,af597c08
Quels sont les avantages d'utiliser un morceau de référence lors du mixage ou du mastering,LA POST-PROD,af597c08-1,af597c08
Comment aligner correctement l'audio de mes références avec mon mixage,LA POST-PROD,af597c08-2,af597c08
Quelle est l'importance de la fonction Solo dans un test de comparaison A/B,LA POST-PROD,af597c08-2,af597c08
Comment s'assurer que mes niveaux sonores soient équivalents lors de la comparaison,LA POST-PROD,af597c08-2,af597c08
Quelles sont les étapes pour mettre en place un test A/B efficace,LA POST-PROD,af597c08-2,af597c08
Pourquoi est-il nécessaire d'utiliser des morceaux sortis du commerce comme références,LA POST-PROD,af597c08-2,af597c08
Pourquoi est-il essentiel de comparer deux sons à un niveau de loudness perçu égal,LA POST-PROD,af597c08-3,af597c08
Comment ajuster le niveau de gain sur la piste de référence pour un test A/B efficace,LA POST-PROD,af597c08-3,af597c08
Quelle est l'importance d'utiliser des morceaux de référence qui n'ont pas subi la Loudness War,LA POST-PROD,af597c08-3,af597c08
Quelles sont les étapes à suivre pour effectuer un test A/B précis avec un limiteur,LA POST-PROD,af597c08-3,af597c08
Pourquoi est-il conseillé de ne pas appliquer de traitement au mixage final avant le mastering,LA POST-PROD,af597c08-3,af597c08
Comment peut-on utiliser les plugins pour faciliter le test A/B dans un mixage,LA POST-PROD,af597c08-4,af597c08
Quelles sont les bonnes pratiques pour calibrer ses oreilles avant de commencer un mixage,LA POST-PROD,af597c08-4,af597c08
Pourquoi est-il important de garder son mixage final sans traitement pour le test A/B,LA POST-PROD,af597c08-4,af597c08
Quels éléments sonores doit-on comparer pendant un test A/B selon le son global du mixage,LA POST-PROD,af597c08-4,af597c08
Comment intégrer plusieurs morceaux de référence dans un plugin pour l'écoute comparative,LA POST-PROD,af597c08-4,af597c08
Comment dois-je évaluer le volume des basses fréquences dans mon mixage,LA POST-PROD,af597c08-5,af597c08
Quels éléments dois-je comparer lors d'un test A/B pour améliorer mon mixage,LA POST-PROD,af597c08-5,af597c08
Comment le placement spatial des instruments influence-t-il la perception du son,LA POST-PROD,af597c08-5,af597c08
Quelles sont les différentes techniques pour ajuster le niveau des instruments dans un mixage,LA POST-PROD,af597c08-5,af597c08
Pourquoi est-il important d'utiliser des références lors de l'évaluation de mon travail en post-production,LA POST-PROD,af597c08-5,af597c08
Quels sont les critères à considérer pour choisir un morceau de référence pertinent pour le mixage,LA POST-PROD,70be07f7-1,70be07f7
Comment la liste de morceaux de référence peut-elle évoluer au fil du temps pour un producteur débutant,LA POST-PROD,70be07f7-1,70be07f7
Pourquoi est-il important de ne pas se limiter à ses goûts personnels lors du choix de morceaux de référence,LA POST-PROD,70be07f7-1,70be07f7
Comment l'écoute critique et l'analyse objective peuvent-elles améliorer mes compétences en mixage,LA POST-PROD,70be07f7-1,70be07f7
Quelles étapes suivre pour analyser efficacement un morceau de musique et en tirer des leçons pour son propre mixage,LA POST-PROD,70be07f7-1,70be07f7
Comment choisir des morceaux de référence pour un projet de mixage,LA POST-PROD,70be07f7-2,70be07f7
Pourquoi est-il important de discuter avec le client sur ses préférences sonores,LA POST-PROD,70be07f7-2,70be07f7
Quels sont les critères à considérer lors de la sélection des morceaux de référence,LA POST-PROD,70be07f7-2,70be07f7
Comment une liste personnelle de morceaux de référence peut-elle aider en post-production,LA POST-PROD,70be07f7-2,70be07f7
Pourquoi est-il nécessaire de connaître l'évolution des styles de mixage au fil du temps,LA POST-PROD,70be07f7-2,70be07f7
Quels sont les critères essentiels pour choisir des morceaux de référence en post-production sonore,LA POST-PROD,70be07f7-3,70be07f7
Comment peut-on utiliser des références pour travailler sur des instruments spécifiques lors du mixage,LA POST-PROD,70be07f7-3,70be07f7
Pourquoi est-il important d'écouter des morceaux ayant des caractéristiques sonores limitantes dans le processus de mixage,LA POST-PROD,70be07f7-3,70be07f7
Quelle est l'importance de l'écoute critique dans la sélection des morceaux de référence,LA POST-PROD,70be07f7-3,70be07f7
Comment peut-on juger l'efficacité de son propre mix par rapport à un morceau de référence,LA POST-PROD,70be07f7-3,70be07f7
Quelles sont les caractéristiques d'un morceau de référence idéal en termes de format audio,LA POST-PROD,70be07f7-4,70be07f7
Pourquoi est-il important d'éviter les fichiers MP3 pour les morceaux de référence,LA POST-PROD,70be07f7-4,70be07f7
Comment un bon mixage influence-t-il la sélection d'un morceau de référence,LA POST-PROD,70be07f7-4,70be07f7
Quels critères déterminent la qualité d'un mixage professionnel selon les standards d'aujourd'hui,LA POST-PROD,70be07f7-4,70be07f7
Comment la dynamique d'un morceau impacte-t-elle son utilisation comme référence en post-production,LA POST-PROD,70be07f7-4,70be07f7
Pourquoi est-il important de choisir des morceaux de référence dans la production musicale,LA POST-PROD,70be07f7-5,70be07f7
Comment déterminer si un morceau a une qualité de mixage suffisamment transparente,LA POST-PROD,70be07f7-5,70be07f7
Quels critères doivent remplir les morceaux de référence pour être efficaces dans l'apprentissage du mixage,LA POST-PROD,70be07f7-5,70be07f7
Comment une instrumentation trop chargée peut-elle affecter l'analyse d'un mixage,LA POST-PROD,70be07f7-5,70be07f7
Quelles stratégies peut-on utiliser pour créer une liste efficace de morceaux de référence,LA POST-PROD,70be07f7-5,70be07f7
Comment peut-on créer une playlist efficace pour le mixage de différents genres musicaux,LA POST-PROD,70be07f7-6,70be07f7
Pourquoi est-il important de connaître les détails de ses propres mixages précédents,LA POST-PROD,70be07f7-6,70be07f7
Quels sont les avantages de choisir des morceaux non masterisés comme références,LA POST-PROD,70be07f7-6,70be07f7
Comment peut-on améliorer son écoute critique en écoutant des morceaux de référence,LA POST-PROD,70be07f7-6,70be07f7
Quels types de morceaux devraient figurer dans une liste de références pour le mixage,LA POST-PROD,70be07f7-6,70be07f7
Quelles sont les caractéristiques d'un morceau de référence en post-production musicale,LA POST-PROD,45fda362-1,45fda362
Comment l'écoute critique influence-t-elle le travail d'un ingénieur du son,LA POST-PROD,45fda362-1,45fda362
Pourquoi est-il important de comparer son mixage à des morceaux de référence,LA POST-PROD,45fda362-1,45fda362
Quels avantages un ingénieur du son peut-il tirer d'une bonne compétence d'écoute,LA POST-PROD,45fda362-1,45fda362
Comment un morceau de référence peut-il aider à évaluer la qualité d'un mixage,LA POST-PROD,45fda362-1,45fda362
Quels sont les avantages d'utiliser des morceaux de référence lors du mixage et du mastering,LA POST-PROD,45fda362-2,45fda362
Pourquoi est-il important d'avoir des morceaux de référence durant l'apprentissage du mixage,LA POST-PROD,45fda362-2,45fda362
Comment les morceaux de référence peuvent-ils améliorer notre oreille pour le mixage,LA POST-PROD,45fda362-2,45fda362
De quelle manière les morceaux de référence peuvent-ils stimuler notre créativité avant le mixage,LA POST-PROD,45fda362-2,45fda362
Quels sont les pièges à éviter lors de l'utilisation de morceaux de référence en post-production,LA POST-PROD,45fda362-2,45fda362
Pourquoi est-il important d'avoir des morceaux de référence lors du mixage,LA POST-PROD,45fda362-3,45fda362
Comment la comparaison avec un morceau de référence peut-elle aider à identifier les problèmes de mixage,LA POST-PROD,45fda362-3,45fda362
Quelles sont les conséquences de la fatigue auditive sur le jugement en mixage,LA POST-PROD,45fda362-3,45fda362
De quelle manière les morceaux de référence peuvent-ils faciliter l'écoute critique dans des environnements inconnus,LA POST-PROD,45fda362-3,45fda362
Comment l'écoute de morceaux de référence influence-t-elle l'apprentissage et le développement des compétences en ingénierie sonore,LA POST-PROD,45fda362-3,45fda362
Pourquoi est-il important d'utiliser des morceaux de référence en post-production,LA POST-PROD,45fda362-4,45fda362
Comment les morceaux de référence peuvent-ils influencer la qualité d'un mixage,LA POST-PROD,45fda362-4,45fda362
De quelle manière les références sonores aident-elles à l'enregistrement et au mixage,LA POST-PROD,45fda362-4,45fda362
Quelle est la différence entre un bon mixage et un mixage qui ne fonctionne pas sur différents systèmes d'écoute,LA POST-PROD,45fda362-4,45fda362
Quels sont les avantages d'une écoute critique dans le processus de mixage,LA POST-PROD,45fda362-4,45fda362
Quelles sont les principales raisons d'utiliser un morceau de référence en post-production,LA POST-PROD,45fda362-5,45fda362
Comment la comparaison A/B peut-elle améliorer la qualité du mixage,LA POST-PROD,45fda362-5,45fda362
Quelles compétences sont nécessaires pour évaluer la dynamique d'un mixage,LA POST-PROD,45fda362-5,45fda362
Comment déterminer si l'équilibre fréquentiel est adapté à un projet musical,LA POST-PROD,45fda362-5,45fda362
Pourquoi est-il important d'avoir une écoute critique lors de la phase de mixage,LA POST-PROD,45fda362-5,45fda362
Quelles sont les considérations importantes à avoir lors du mixage d'un morceau de musique,LA POST-PROD,45fda362-6,45fda362
Comment juger l'intensité d'une compression dans un mixage,LA POST-PROD,45fda362-6,45fda362
Pourquoi est-il crucial de discuter des choix de mixage avec l'artiste,LA POST-PROD,45fda362-6,45fda362
En quoi un morceau de référence influence-t-il le mixage d'une composition,LA POST-PROD,45fda362-6,45fda362
Quels aspects doivent être pris en compte pour l'utilisation d'une référence en session de mixage,LA POST-PROD,45fda362-6,45fda362
Quelles sont les principales fonctions du traitement EQ en mixage,LA POST-PROD,7baed9ea-1,7baed9ea
Pourquoi est-il déconseillé d'utiliser des presets pour le traitement EQ,LA POST-PROD,7baed9ea-1,7baed9ea
Comment un bon producteur doit-il aborder la manipulation de l'audio,LA POST-PROD,7baed9ea-1,7baed9ea
Quelle est l'importance d'expérimenter avec l'EQ plutôt que de suivre des charts,LA POST-PROD,7baed9ea-1,7baed9ea
Comment définir une intention claire avant de traiter un son avec l'EQ,LA POST-PROD,7baed9ea-1,7baed9ea
Quelles sont les questions à se poser avant d'appliquer un traitement EQ sur un son,LA POST-PROD,7baed9ea-2,7baed9ea
Pourquoi est-il important d'apprendre à identifier les fréquences pour le mixage audio,LA POST-PROD,7baed9ea-2,7baed9ea
Comment utiliser un EQ de manière efficace pour résoudre des problèmes sonores,LA POST-PROD,7baed9ea-2,7baed9ea
Quelle est la place recommandée de l'EQ dans la chaîne de traitement audio,LA POST-PROD,7baed9ea-2,7baed9ea
Quels outils ou applications peuvent aider à s'entraîner à reconnaître les différentes bandes de fréquences,LA POST-PROD,7baed9ea-2,7baed9ea
Quelles sont les bonnes pratiques à suivre pour utiliser un EQ en mixage,LA POST-PROD,7baed9ea-3,7baed9ea
Pourquoi est-il important de nettoyer le son avec un EQ en premier dans la chaîne,LA POST-PROD,7baed9ea-3,7baed9ea
Quels sont les pièges liés à l'utilisation du bouton Solo en mixage,LA POST-PROD,7baed9ea-3,7baed9ea
Comment les basses fréquences peuvent-elles affecter le traitement par un compresseur,LA POST-PROD,7baed9ea-3,7baed9ea
Dans quels cas est-il indispensable d'égaliser une piste en solo,LA POST-PROD,7baed9ea-3,7baed9ea
Quelles sont les situations où l'égalisation en solo est indispensable lors du mixage,LA POST-PROD,7baed9ea-4,7baed9ea
Comment peut-on ajuster le niveau de sortie d'un EQ après un traitement,LA POST-PROD,7baed9ea-4,7baed9ea
Pourquoi est-il important d'éviter de simplement rendre le son plus fort après un traitement EQ,LA POST-PROD,7baed9ea-4,7baed9ea
Comment l'effet de proximité du micro peut-il influencer le traitement EQ d'une voix,LA POST-PROD,7baed9ea-4,7baed9ea
Quelle technique permet d'écouter l'effet réel d'un traitement EQ sans changement de volume perçu,LA POST-PROD,7baed9ea-4,7baed9ea
Quelles sont les conséquences d'une augmentation du niveau sonore sur la perception du son,LA POST-PROD,7baed9ea-5,7baed9ea
Pourquoi est-il important de ne pas se fier uniquement au traitement EQ pour améliorer la qualité audio,LA POST-PROD,7baed9ea-5,7baed9ea
Quel est l'avantage d'utiliser un plugin EQ avec une fonction d'Autogain,LA POST-PROD,7baed9ea-5,7baed9ea
Combien de bandes un EQ devrait-il idéalement utiliser pour un traitement efficace,LA POST-PROD,7baed9ea-5,7baed9ea
Quelle est l'importance de faire des pauses et de se référencer dans le processus de mixage,LA POST-PROD,7baed9ea-5,7baed9ea
Quelles sont les erreurs courantes à éviter lors du traitement EQ en mixage,LA POST-PROD,7baed9ea-6,7baed9ea
Pourquoi est-il important de faire des pauses pendant le mixage,LA POST-PROD,7baed9ea-6,7baed9ea
Comment le fait d'écouter des références peut-il améliorer mon mixage,LA POST-PROD,7baed9ea-6,7baed9ea
Quels sont les avantages de l'EQ soustractif par rapport à un boost dans le mixage,LA POST-PROD,7baed9ea-6,7baed9ea
Comment la fatigue auditive impacte-t-elle ma capacité à mixer efficacement,LA POST-PROD,7baed9ea-6,7baed9ea
Quelles sont les raisons pour lesquelles il est préférable de creuser plutôt que de booster des fréquences dans un mixage,LA POST-PROD,7baed9ea-7,7baed9ea
Quel est l'effet de couper certaines fréquences sur les fréquences environnantes dans un mélange sonore,LA POST-PROD,7baed9ea-7,7baed9ea
Pourquoi est-il important de garder un bon headroom lors du mixage audio,LA POST-PROD,7baed9ea-7,7baed9ea
Quelles sont les conséquences d'une utilisation excessive d'un filtre High Pass dans un mixage,LA POST-PROD,7baed9ea-7,7baed9ea
Comment choisir une pente appropriée lors de l'utilisation d'un filtre High Pass pour éviter la rotation de phase,LA POST-PROD,7baed9ea-7,7baed9ea
Quels sont les éléments clés à considérer avant d'utiliser un filtre high-pass dans le mixage,LA POST-PROD,7baed9ea-8,7baed9ea
Comment un low-pass peut-il améliorer la séparation d'un instrument dans un mixage,LA POST-PROD,7baed9ea-8,7baed9ea
Quelles sont les conséquences de couper des hautes fréquences avec un low-pass,LA POST-PROD,7baed9ea-8,7baed9ea
Comment peut-on ajouter de la clarté dans un mixage au-delà de l'égalisation,LA POST-PROD,7baed9ea-8,7baed9ea
Quels sont les avantages d'utiliser des références sonores lors du traitement des basses fréquences,LA POST-PROD,7baed9ea-8,7baed9ea
Quelles sont les tâches principales pour lesquelles on utilise le traitement EQ en mixage,LA POST-PROD,7baed9ea-9,7baed9ea
Comment le filtre shelf peut-il être utilisé pour améliorer l'équilibre tonal d'un mixage,LA POST-PROD,7baed9ea-9,7baed9ea
Quelle est l'importance de l'EQ paramétrique pour traiter les médiums dans le mixage,LA POST-PROD,7baed9ea-9,7baed9ea
Pourquoi est-il recommandé de ne pas abuser du high shelf sur toutes les pistes,LA POST-PROD,7baed9ea-9,7baed9ea
Comment le high-pass et le low-shelf peuvent-ils être combinés pour obtenir un meilleur équilibre dans le mixage,LA POST-PROD,7baed9ea-9,7baed9ea
Quels sont les niveaux de gain recommandés lors de l'utilisation d'un boost avec un equaliseur,LA POST-PROD,7baed9ea-10,7baed9ea
Comment les boosts étroits se comparent-ils aux boosts larges en termes de qualité sonore,LA POST-PROD,7baed9ea-10,7baed9ea
Quelles sont les caractéristiques d'un EQ Pultec et comment influence-t-il le son,LA POST-PROD,7baed9ea-10,7baed9ea
Pourquoi est-il important de traiter le son avec une intention lors du mixage,LA POST-PROD,7baed9ea-10,7baed9ea
Quelles différences existe-t-il entre un EQ standard et des EQ avec options comme M/S ou dynamiques,LA POST-PROD,7baed9ea-10,7baed9ea
Quelle est la principale fonction des EQ en mixage et comment cela influence la balance tonale,LA POST-PROD,e1cd7706-1,e1cd7706
Comment peut-on définir une bonne balance tonale dans un mixage musical,LA POST-PROD,e1cd7706-1,e1cd7706
Quels sont les effets d'une mauvaise balance tonale sur la perception d'un mixage dans différents environnements,LA POST-PROD,e1cd7706-1,e1cd7706
Pourquoi la couleur sonore évolue-t-elle au fil du temps en fonction des genres musicaux et de la technologie,LA POST-PROD,e1cd7706-1,e1cd7706
Quels exemples de morceaux illustrent la variation des extrêmes basses et aigües dans les styles musicaux,LA POST-PROD,e1cd7706-1,e1cd7706
Quelle est l'importance de l'équilibre fréquentiel dans un mixage,LA POST-PROD,e1cd7706-2,e1cd7706
Comment la loi des 400 000 aide-t-elle à équilibrer les fréquences,LA POST-PROD,e1cd7706-2,e1cd7706
Quelles sont les conséquences de l'utilisation de la courbure EQ sous forme de smiley,LA POST-PROD,e1cd7706-2,e1cd7706
Pourquoi est-il difficile d'obtenir un équilibre tonal dans les médiums élevés,LA POST-PROD,e1cd7706-2,e1cd7706
