question,category,chunk,article
Pourquoi la dynamique est-elle un élément crucial dans un bon mixage ?,LA POST-PROD,70be07f7-6,70be07f7
Quelles caractéristiques doivent être évitées pour un mixage de référence universel ?,LA POST-PROD,70be07f7-6,70be07f7
Comment reconnaître un mixage de haute qualité professionnelle dans la musique contemporaine ?,LA POST-PROD,70be07f7-6,70be07f7
Comment choisir les morceaux de reference pour mon apprentissage en post-production ?,LA POST-PROD,70be07f7-7,70be07f7
Quels types d'instruments doivent être presents dans une reference universelle ?,LA POST-PROD,70be07f7-7,70be07f7
Pourquoi est-il important d'eviter les productions trop chargees lors de l'ecoute critique ?,LA POST-PROD,70be07f7-7,70be07f7
Comment une variation d'instruments influence-t-elle l'ecoute d'un morceau ?,LA POST-PROD,70be07f7-7,70be07f7
Comment etablir une liste personnelle de references musicales pour progresser en mixage ?,LA POST-PROD,70be07f7-7,70be07f7
Comment choisir un morceau de référence pour mon apprentissage en mixage?,LA POST-PROD,70be07f7-8,70be07f7
Pourquoi est-il important d'écouter des morceaux non masterisés?,LA POST-PROD,70be07f7-8,70be07f7
Quels types de morceaux devrais-je inclure dans ma liste de références?,LA POST-PROD,70be07f7-8,70be07f7
Comment mes propres mixes précédents peuvent-ils m'aider dans le choix des références?,LA POST-PROD,70be07f7-8,70be07f7
Quelle est l'importance de l'écoute critique dans le processus d'apprentissage en audio?,LA POST-PROD,70be07f7-8,70be07f7
Pourquoi est-il important d'utiliser des morceaux de reference en post-production?,LA POST-PROD,45fda362-1,45fda362
Comment l'ecoute critique contribue-t-elle au mixage et au mastering?,LA POST-PROD,45fda362-1,45fda362
Quelles caracteristiques doit avoir un morceau de reference pour l'analyse audio?,LA POST-PROD,45fda362-1,45fda362
En quoi des morceaux de reference aident-ils à evaluer la qualité d'un mixage?,LA POST-PROD,45fda362-1,45fda362
Qu'est-ce qui définit un morceau de reference dans le processus de post-production?,LA POST-PROD,45fda362-1,45fda362
Pourquoi est-il important d'utiliser des morceaux de référence en post-production?,LA POST-PROD,45fda362-2,45fda362
Comment les morceaux de référence peuvent-ils améliorer mes compétences en mixage?,LA POST-PROD,45fda362-2,45fda362
Quelles sont les erreurs à éviter lors de l'utilisation de morceaux de référence?,LA POST-PROD,45fda362-2,45fda362
En quoi le processus de comparaison A/B est-il bénéfique pour le mixage?,LA POST-PROD,45fda362-2,45fda362
Comment constituer ma propre liste de morceaux de référence efficacement?,LA POST-PROD,45fda362-2,45fda362
Quels sont les avantages d'ecouter des morceaux de reference en post-production ?,LA POST-PROD,45fda362-3,45fda362
Comment l'ecoute critique peut-elle aider dans le mixage ?,LA POST-PROD,45fda362-3,45fda362
Pourquoi est-il important de ne pas imiter un morceau de reference à l'identique ?,LA POST-PROD,45fda362-3,45fda362
Quels sont les bienfaits de la creation d'une liste de morceaux de reference pour un debutant ?,LA POST-PROD,45fda362-3,45fda362
Comment les morceaux de reference peuvent-ils influencer ma creativite pendant le mixage ?,LA POST-PROD,45fda362-3,45fda362
Pourquoi est-il important d'utiliser des morceaux de référence en post-production?,LA POST-PROD,45fda362-4,45fda362
Comment les morceaux de référence aident-ils à calibrer mes oreilles?,LA POST-PROD,45fda362-4,45fda362
Quels sont les avantages d'écouter des références dans un environnement inconnu?,LA POST-PROD,45fda362-4,45fda362
Comment éviter la fatigue auditive lors de longues sessions de mixage?,LA POST-PROD,45fda362-4,45fda362
Les morceaux de référence peuvent-ils être utiles pour l'enregistrement aussi?,LA POST-PROD,45fda362-4,45fda362
Pourquoi est-il important de référencer des morceaux en post-production ?,LA POST-PROD,45fda362-5,45fda362
Comment un morceau de référence aide-t-il à éviter les problèmes de mixage ?,LA POST-PROD,45fda362-5,45fda362
Quel est l'objectif principal de l'utilisation de morceaux de référence en mixage ?,LA POST-PROD,45fda362-5,45fda362
Comment évaluer la qualité d'un mixage à l'aide de morceaux de référence ?,LA POST-PROD,45fda362-5,45fda362
Quelles sont les conséquences de ne pas utiliser de morceaux de référence dans un mixage ?,LA POST-PROD,45fda362-5,45fda362
Pourquoi est-il essentiel d'utiliser des morceaux de référence en post-production ?,LA POST-PROD,45fda362-6,45fda362
Comment les morceaux de référence peuvent-ils améliorer mon jugement sur la qualité sonore des enceintes ?,LA POST-PROD,45fda362-6,45fda362
Quelles sont les différences entre un morceau de référence et un modèle à suivre lors du mixage ?,LA POST-PROD,45fda362-6,45fda362
De quelle manière les morceaux commerciaux peuvent-ils m'aider durant la phase de mixage final ?,LA POST-PROD,45fda362-6,45fda362
Comment l'analyse objective m'assiste-t-elle dans l'équilibrage du mixage ?,LA POST-PROD,45fda362-6,45fda362
Pourquoi est-il important d'utiliser un morceau de référence pendant le mixage?,LA POST-PROD,45fda362-7,45fda362
Quand devrais-je commencer à utiliser une référence au cours de ma session de mixage?,LA POST-PROD,45fda362-7,45fda362
Quels aspects de mon mixage dois-je comparer avec un morceau de référence?,LA POST-PROD,45fda362-7,45fda362
Comment évaluer la dynamique de mon mixage par rapport à une référence?,LA POST-PROD,45fda362-7,45fda362
Quelles décisions dois-je prendre en fonction du marché visé par ma musique?,LA POST-PROD,45fda362-7,45fda362
Pourquoi est-il important d'utiliser des morceaux de référence en post-production ?,LA POST-PROD,45fda362-8,45fda362
Comment les morceaux de référence peuvent-ils influencer mes choix de mixage ?,LA POST-PROD,45fda362-8,45fda362
Quelles sont les décisions que je dois prendre en comparant des mixages différents ?,LA POST-PROD,45fda362-8,45fda362
En quoi la discussion avec l'artiste est-elle bénéfique lors du mixage ?,LA POST-PROD,45fda362-8,45fda362
Quels critères devrais-je considérer pour choisir mes morceaux de référence ?,LA POST-PROD,45fda362-8,45fda362
Quels sont les avantages du traitement EQ dans un mixage?,LA POST-PROD,7baed9ea-1,7baed9ea
Pourquoi est-il important d'éviter les presets lors du traitement EQ?,LA POST-PROD,7baed9ea-1,7baed9ea
En quoi le traitement EQ peut-il influencer le caractère d'un son?,LA POST-PROD,7baed9ea-1,7baed9ea
Comment le traitement EQ nécessite-t-il une approche précautionneuse?,LA POST-PROD,7baed9ea-1,7baed9ea
Quelles erreurs communes devrais-je éviter lors de l'utilisation de l'EQ?,LA POST-PROD,7baed9ea-1,7baed9ea
Quelles sont les pratiques recommandées pour le traitement EQ en mixage?,LA POST-PROD,7baed9ea-2,7baed9ea
Pourquoi est-il important de traiter le son avec une intention plutôt que par défaut?,LA POST-PROD,7baed9ea-2,7baed9ea
Comment un débutant peut-il surmonter les défis liés à l'utilisation des EQ?,LA POST-PROD,7baed9ea-2,7baed9ea
Quels conseils donnerais-tu pour identifier les fréquences dans un son?,LA POST-PROD,7baed9ea-2,7baed9ea
Comment développer une écoute critique pour améliorer ses compétences en audio?,LA POST-PROD,7baed9ea-2,7baed9ea
Quelles sont les bonnes pratiques pour utiliser l'EQ en mixage ?,LA POST-PROD,7baed9ea-3,7baed9ea
Comment puis-je apprendre à reconnaître les fréquences des tonalités ?,LA POST-PROD,7baed9ea-3,7baed9ea
Pourquoi est-il recommandé d'utiliser l'EQ avant le compresseur dans la chaîne de traitement ?,LA POST-PROD,7baed9ea-3,7baed9ea
Quels outils peuvent m'aider à m'entraîner à identifier les fréquences ?,LA POST-PROD,7baed9ea-3,7baed9ea
Comment utiliser l'EQ en écoutant plutôt qu'en regardant ?,LA POST-PROD,7baed9ea-3,7baed9ea
Quelles sont les pratiques recommandées pour l'utilisation du traitement EQ en mixage ?,LA POST-PROD,7baed9ea-4,7baed9ea
Pourquoi est-il important de faire attention aux basses fréquences dans un mixage ?,LA POST-PROD,7baed9ea-4,7baed9ea
Comment un traitement EQ peut-il interférer avec un compresseur dans la chaîne de traitement ?,LA POST-PROD,7baed9ea-4,7baed9ea
Quels conseils donneriez-vous pour utiliser le bouton 'Solo' de manière efficace lors du mixage ?,LA POST-PROD,7baed9ea-4,7baed9ea
Y a-t-il des règles strictes sur le placement du traitement EQ dans la chaîne de production audio ?,LA POST-PROD,7baed9ea-4,7baed9ea
Quelles sont les bonnes pratiques pour utiliser le traitement EQ en mixage ?,LA POST-PROD,7baed9ea-5,7baed9ea
Pourquoi est-il important d'égaliser en solo dans certaines situations ?,LA POST-PROD,7baed9ea-5,7baed9ea
Comment ajuster le niveau de sortie après un traitement EQ ?,LA POST-PROD,7baed9ea-5,7baed9ea
Quels problèmes peuvent surgir lors de l'égalisation d'un son dans le mixage ?,LA POST-PROD,7baed9ea-5,7baed9ea
Comment redonner un son naturel avec l'EQ lors du mixage ?,LA POST-PROD,7baed9ea-5,7baed9ea
Quelles sont les pratiques essentielles pour un traitement EQ en mixage?,LA POST-PROD,7baed9ea-6,7baed9ea
Pourquoi est-il important de vérifier l'equivalence de niveau avant et apres un traitement EQ?,LA POST-PROD,7baed9ea-6,7baed9ea
Comment un traitement EQ peut-il affecter notre perception du son lors du mixage?,LA POST-PROD,7baed9ea-6,7baed9ea
Quels outils ou plugins peuvent aider à maintenir un niveau constant en EQ?,LA POST-PROD,7baed9ea-6,7baed9ea
Comment éviter de se laisser influencer par un changement de volume dans le mixage?,LA POST-PROD,7baed9ea-6,7baed9ea
Quelles sont les fonctionnalités des plugins EQ modernes comme ceux de Fabfilter ou Izotope?,LA POST-PROD,7baed9ea-7,7baed9ea
Pourquoi est-il déconseillé d'utiliser un EQ sur plus de cinq bandes?,LA POST-PROD,7baed9ea-7,7baed9ea
Que faire si un enregistrement audio est de mauvaise qualité à la source?,LA POST-PROD,7baed9ea-7,7baed9ea
Comment le processus d'Autogain améliore-t-il le traitement EQ?,LA POST-PROD,7baed9ea-7,7baed9ea
Pourquoi est-il important de faire des pauses lors du mixage?,LA POST-PROD,7baed9ea-7,7baed9ea
Quelles sont les erreurs courantes à éviter lors du traitement EQ en mixage ?,LA POST-PROD,7baed9ea-8,7baed9ea
Comment éviter la fatigue auditive en travaillant sur un mixage ?,LA POST-PROD,7baed9ea-8,7baed9ea
Pourquoi est-il important d'écouter des morceaux de référence lors du mixage ?,LA POST-PROD,7baed9ea-8,7baed9ea
Quels sont les avantages de l'EQ en soustractif par rapport au EQ en boost ?,LA POST-PROD,7baed9ea-8,7baed9ea
Comment le traitement symétrique peut-il aider à améliorer le son d'un mix ?,LA POST-PROD,7baed9ea-8,7baed9ea
Quelles sont les avantages de creuser des fréquences plutôt que de booster?,LA POST-PROD,7baed9ea-9,7baed9ea
Comment fonctionne l'effet de contraste dans le traitement EQ?,LA POST-PROD,7baed9ea-9,7baed9ea
Pourquoi est-il parfois préférable de couper certaines fréquences?,LA POST-PROD,7baed9ea-9,7baed9ea
Quel est le problème de rotation de phase lié au traitement EQ?,LA POST-PROD,7baed9ea-9,7baed9ea
Quels éléments du mixage peuvent bénéficier d'une atténuation des fréquences environnantes?,LA POST-PROD,7baed9ea-9,7baed9ea
Quelles sont les conséquences d'une utilisation excessive d'un filtre High Pass en mixage ?,LA POST-PROD,7baed9ea-10,7baed9ea
Comment utiliser le filtre High Pass sans rendre le mix trop plat ?,LA POST-PROD,7baed9ea-10,7baed9ea
Pourquoi est-il important de ne pas filtrer sévèrement les éléments dans les hautes fréquences ?,LA POST-PROD,7baed9ea-10,7baed9ea
Comment choisir la pente du filtre High Pass pour obtenir un meilleur résultat ?,LA POST-PROD,7baed9ea-10,7baed9ea
Qu'est-ce qui contribue réellement à la profondeur et au groove dans un mixage ?,LA POST-PROD,7baed9ea-10,7baed9ea
Quelles sont les bonnes pratiques pour obtenir de la clarté dans un mixage ?,LA POST-PROD,7baed9ea-11,7baed9ea
Comment le panoramique peut-il aider à séparer les éléments d'un mix ?,LA POST-PROD,7baed9ea-11,7baed9ea
Quelles sont les recommandations pour l'utilisation d'un high-pass ?,LA POST-PROD,7baed9ea-11,7baed9ea
Comment un low-pass peut-il contribuer à la séparation des instruments ?,LA POST-PROD,7baed9ea-11,7baed9ea
Pourquoi est-il important de connaître le comportement de ses enceintes dans le bas du spectre ?,LA POST-PROD,7baed9ea-11,7baed9ea
Quelles sont les pratiques essentielles pour le traitement EQ en mixage?,LA POST-PROD,7baed9ea-12,7baed9ea
Comment un band-pass améliore-t-il la définition des instruments?,LA POST-PROD,7baed9ea-12,7baed9ea
Quelle est la fonction principale d'un filtre shelf en mixage?,LA POST-PROD,7baed9ea-12,7baed9ea
Pourquoi est-il important de ne pas abuser du high shelf?,LA POST-PROD,7baed9ea-12,7baed9ea
Comment l'EQ paramétrique peut-il être utilisé pour traiter les médiums?,LA POST-PROD,7baed9ea-12,7baed9ea
Quels sont les avantages d'un EQ à émulation analogique lors du mixage ?,LA POST-PROD,7baed9ea-13,7baed9ea
Quelle est la différence entre un EQ correctif et un EQ de boost ?,LA POST-PROD,7baed9ea-13,7baed9ea
Pourquoi est-il recommandé d'utiliser des boosts larges et modérés en EQ ?,LA POST-PROD,7baed9ea-13,7baed9ea
Comment un EQ Pultec influence-t-il les fréquences environnantes lorsqu'on le booste ?,LA POST-PROD,7baed9ea-13,7baed9ea
Quelles sont les pratiques recommandées pour traiter les EQ en mixage ?,LA POST-PROD,7baed9ea-13,7baed9ea
Quelles sont les meilleures pratiques pour le traitement EQ en mixage ?,LA POST-PROD,7baed9ea-14,7baed9ea
Pourquoi est-il important de traiter le son avec une intention ?,LA POST-PROD,7baed9ea-14,7baed9ea
Quels types d'EQ existe-t-il au-delà des EQ standards ?,LA POST-PROD,7baed9ea-14,7baed9ea
Comment les EQ M/S et dynamiques améliorent-ils le contrôle audio ?,LA POST-PROD,7baed9ea-14,7baed9ea
Quelles sont les prochaines étapes après avoir maîtrisé le traitement EQ ?,LA POST-PROD,7baed9ea-14,7baed9ea
Comment peut-on définir une bonne balance tonale dans un mixage ?,LA POST-PROD,e1cd7706-1,e1cd7706
Pourquoi l'équilibre fréquentiel est-il important en mixage ?,LA POST-PROD,e1cd7706-1,e1cd7706
Quels sont les principaux problèmes liés à une mauvaise balance tonale ?,LA POST-PROD,e1cd7706-1,e1cd7706
Comment notre perception de la couleur sonore change-t-elle au fil des époques ?,LA POST-PROD,e1cd7706-1,e1cd7706
Pourquoi un mixage peut-il sonner différemment selon l'environnement d'écoute ?,LA POST-PROD,e1cd7706-1,e1cd7706
Comment peut-on définir la balance tonale dans un mix?,LA POST-PROD,e1cd7706-2,e1cd7706
Quelles sont les différences entre les extrêmes aiguës et basses dans un mix?,LA POST-PROD,e1cd7706-2,e1cd7706
Pourquoi est-il important d'avoir un équilibre fréquentiel homogène?,LA POST-PROD,e1cd7706-2,e1cd7706
Comment les styles musicaux influencent-ils la balance tonale?,LA POST-PROD,e1cd7706-2,e1cd7706
Quelle est la loi des 400 000 en matière de mixage?,LA POST-PROD,e1cd7706-2,e1cd7706
Comment respecter l'equilibre entre les frequences basses et aigues dans un mixage ?,LA POST-PROD,e1cd7706-3,e1cd7706
Qu'est-ce que la loi des 400 000 et comment l'appliquer ?,LA POST-PROD,e1cd7706-3,e1cd7706
Pourquoi est-il important de considérer la perception des frequences par nos oreilles ?,LA POST-PROD,e1cd7706-3,e1cd7706
Comment la courbure d'EQ en forme de smiley influence-t-elle un mix ?,LA POST-PROD,e1cd7706-3,e1cd7706
Quels sont les problemes les plus courants lies a l'equilibre des frequences dans un mixage ?,LA POST-PROD,e1cd7706-3,e1cd7706
Quels sont les problèmes fréquents liés à l'equilibre des frequences en mixage ?,LA POST-PROD,e1cd7706-4,e1cd7706
Comment un mix est-il affecte par un exces de contenu a basse frequence ?,LA POST-PROD,e1cd7706-4,e1cd7706
Quelles solutions permettent de remedier aux problemes d'equilibre des frequences ?,LA POST-PROD,e1cd7706-4,e1cd7706
Pourquoi est-il important de comparer un mix avec une piste de reference ?,LA POST-PROD,e1cd7706-4,e1cd7706
Quel risque y a-t-il à augmenter trop les hautes frequences dans un mixage ?,LA POST-PROD,e1cd7706-4,e1cd7706
Comment peut-on définir la balance tonale d'un mix ?,LA POST-PROD,e1cd7706-5,e1cd7706
Quels sont les problèmes fréquemment rencontrés avec les basses fréquences ?,LA POST-PROD,e1cd7706-5,e1cd7706
Pourquoi est-il important de gérer les hautes fréquences en phase de mixage ?,LA POST-PROD,e1cd7706-5,e1cd7706
Comment les différents systèmes d'écoute affectent-ils la reproduction des basses fréquences ?,LA POST-PROD,e1cd7706-5,e1cd7706
Quelles recommandations pour éviter un mixage agressif en aiguës ?,LA POST-PROD,e1cd7706-5,e1cd7706
Comment la balance tonale influence-t-elle un mix?,LA POST-PROD,e1cd7706-6,e1cd7706
Quels sont les exemples sonores qui illustrent une balance tonale déséquilibrée?,LA POST-PROD,e1cd7706-6,e1cd7706
Pourquoi est-il important de savoir quel élément contribue à quelle partie du spectre?,LA POST-PROD,e1cd7706-6,e1cd7706
Comment l'EQ aide-t-il à obtenir une meilleure séparation des instruments dans un mix?,LA POST-PROD,e1cd7706-6,e1cd7706
Quelles zones doivent être évaluées pour éviter le masquage entre les instruments?,LA POST-PROD,e1cd7706-6,e1cd7706
Comment aborder la balance tonale dans un mix ?,LA POST-PROD,e1cd7706-7,e1cd7706
Pourquoi est-il important d'équilibrer les extrêmes graves et aigus ?,LA POST-PROD,e1cd7706-7,e1cd7706
Quels instruments influencent le plus le bas du spectre fréquentiel ?,LA POST-PROD,e1cd7706-7,e1cd7706
Comment l'écoute des références peut-elle améliorer ma pratique en EQ ?,LA POST-PROD,e1cd7706-7,e1cd7706
En quoi le DJing contribue-t-il à l'apprentissage de l'équilibre musical ?,LA POST-PROD,e1cd7706-7,e1cd7706
Quels sont les différents types de plugins EQ disponibles en audio production ?,LA POST-PROD,6efb5d02-1,6efb5d02
Comment choisir entre un plugin EQ intégré et un plugin tiers ?,LA POST-PROD,6efb5d02-1,6efb5d02
Peux-tu expliquer la différence entre les EQ à traitement en une fois et ceux à modélisation analogique ?,LA POST-PROD,6efb5d02-1,6efb5d02
Quels sont les avantages des plugins EQ comme le Fabfilter et le Waves SSL-G ?,LA POST-PROD,6efb5d02-1,6efb5d02
Dans quels contextes devrait-on utiliser différents types de plugins EQ ?,LA POST-PROD,6efb5d02-1,6efb5d02
Quels sont les principaux types de plugins EQ disponibles sur le marché?,LA POST-PROD,6efb5d02-2,6efb5d02
Quelle est l'importance de l'EQ analogique dans l'histoire de la musique?,LA POST-PROD,6efb5d02-2,6efb5d02
En quoi le Pultec EQP-1a est-il considéré comme influent dans l'industrie musicale?,LA POST-PROD,6efb5d02-2,6efb5d02
Quels éléments ont révolutionné la reproduction sonore dans les années 70?,LA POST-PROD,6efb5d02-2,6efb5d02
Comment les ingénieurs d'enregistrement utilisent-ils les EQ dans leur travail?,LA POST-PROD,6efb5d02-2,6efb5d02
Quels sont les types de plugins EQ disponibles sur le marché?,LA POST-PROD,6efb5d02-3,6efb5d02
Comment un EQ passif se différencie-t-il d'un EQ actif?,LA POST-PROD,6efb5d02-3,6efb5d02
Quelles sont les caractéristiques sonores de l'EQ Neve?,LA POST-PROD,6efb5d02-3,6efb5d02
Pourquoi les EQ analogiques sont-ils souvent considérés comme 'magiques'?,LA POST-PROD,6efb5d02-3,6efb5d02
Quelle console a popularisé les EQ modernes dans les années 80?,LA POST-PROD,6efb5d02-3,6efb5d02
Quels sont les EQ les plus utilisés dans l'histoire de l'audio ?,LA POST-PROD,6efb5d02-4,6efb5d02
Comment le EQ Neve 1073 se distingue-t-il des autres EQ ?,LA POST-PROD,6efb5d02-4,6efb5d02
Quelles sont les différences entre les EQ actifs et passifs ?,LA POST-PROD,6efb5d02-4,6efb5d02
Pourquoi l'EQ Neve est-il considéré comme chaleureux et musical ?,LA POST-PROD,6efb5d02-4,6efb5d02
Quels EQ américains ont rivalisé avec ceux britanniques pendant l'époque ?,LA POST-PROD,6efb5d02-4,6efb5d02
Quels sont les principaux types de plugins EQ utilisés en post-production audio?,LA POST-PROD,6efb5d02-5,6efb5d02
Quelle est la différence fondamentale entre un EQ passif et un EQ actif?,LA POST-PROD,6efb5d02-5,6efb5d02
Comment un EQ passif influence-t-il les fréquences environnantes lors d'un réglage?,LA POST-PROD,6efb5d02-5,6efb5d02
Pourquoi le Pultec est-il reconnu pour son son naturel et organique?,LA POST-PROD,6efb5d02-5,6efb5d02
Quels avantages offre un EQ actif en termes de contrôle des fréquences?,LA POST-PROD,6efb5d02-5,6efb5d02
Quels sont les avantages des EQ actifs en termes de traitement du bruit de fond ?,LA POST-PROD,6efb5d02-6,6efb5d02
Comment l'avènement des plugins numériques a-t-il transformé l'utilisation des EQ ?,LA POST-PROD,6efb5d02-6,6efb5d02
Pourquoi est-il important de comprendre la relation entre l'EQ et la phase ?,LA POST-PROD,6efb5d02-6,6efb5d02
Quelle est la différence entre un filtre EQ analogique et un filtre EQ numérique ?,LA POST-PROD,6efb5d02-6,6efb5d02
Qu'est-ce qu'un EQ à phase linéaire et comment fonctionne-t-il ?,LA POST-PROD,6efb5d02-6,6efb5d02
Quels sont les types de plugins EQ et comment affectent-ils le son produit?,LA POST-PROD,6efb5d02-7,6efb5d02
Pourquoi est-il important de connaître la phase des plugins EQ lors de leur utilisation?,LA POST-PROD,6efb5d02-7,6efb5d02
Quels problèmes peuvent survenir lors du traitement EQ de plusieurs sources audio corrélées?,LA POST-PROD,6efb5d02-7,6efb5d02
Comment regrouper les pistes audio peut-il aider à résoudre des problèmes d'EQ?,LA POST-PROD,6efb5d02-7,6efb5d02
Quels sont les avantages des EQ numériques par rapport à leurs équivalents analogiques?,LA POST-PROD,6efb5d02-7,6efb5d02
Quels sont les avantages des EQ numériques par rapport aux EQ analogiques ?,LA POST-PROD,6efb5d02-8,6efb5d02
Comment les EQ intégrés dans les DAW se distinguent-ils en termes de performances ?,LA POST-PROD,6efb5d02-8,6efb5d02
Quelles sont les fonctionnalités avancées que l'on peut attendre des plugins EQ modernes ?,LA POST-PROD,6efb5d02-8,6efb5d02
Pourquoi la flexibilité des plugins EQ est-elle importante dans le mixage audio ?,LA POST-PROD,6efb5d02-8,6efb5d02
Quelle est la spécificité du Channel EQ dans Logic Pro X ?,LA POST-PROD,6efb5d02-8,6efb5d02
Quels sont les principaux avantages de lEQ 'Channel EQ' de Logic Pro X ?,LA POST-PROD,6efb5d02-9,6efb5d02
Comment lEQ à phase linéaire diffère-t-il des autres types dEQ ?,LA POST-PROD,6efb5d02-9,6efb5d02
Quels compromis doivent faire les concepteurs dEQ en matière de phase et de ressources ?,LA POST-PROD,6efb5d02-9,6efb5d02
Quels types de traitement lEQ 'Channel EQ' est-il idéal pour effectuer ?,LA POST-PROD,6efb5d02-9,6efb5d02
Quelles sont les options disponibles pour le filtrage dans un plugin EQ ?,LA POST-PROD,6efb5d02-9,6efb5d02
Quels sont les choix disponibles pour la phase dans le plugin Fabfilter Pro-Q ?,LA POST-PROD,6efb5d02-10,6efb5d02
Quels types de latence sont associés aux différents EQ ?,LA POST-PROD,6efb5d02-10,6efb5d02
Comment l'EQ à phase minimum affecte-t-il la qualité sonore ?,LA POST-PROD,6efb5d02-10,6efb5d02
Quand devrais-je utiliser un EQ à phase linéaire durant la production audio ?,LA POST-PROD,6efb5d02-10,6efb5d02
Quelle est l'importance de la qualité des filtres dans le choix d'un EQ ?,LA POST-PROD,6efb5d02-10,6efb5d02
Quels sont les inconvénients des plugins EQ traditionnels ?,LA POST-PROD,6efb5d02-11,6efb5d02
Pourquoi est-il important de s'imposer des limitations lors de l'utilisation des EQ ?,LA POST-PROD,6efb5d02-11,6efb5d02
Comment la complexité des EQ modernes peut-elle affecter un novice en mixage ?,LA POST-PROD,6efb5d02-11,6efb5d02
Quel est l'impact de l'utilisation de l'oreille par rapport à la vue lors du mixage ?,LA POST-PROD,6efb5d02-11,6efb5d02
Quelle vidéo est recommandée pour en savoir plus sur les EQ linear phase ?,LA POST-PROD,6efb5d02-11,6efb5d02
Quels sont les problèmes d'égalisation que rencontrent les débutants en audio ?,LA POST-PROD,6efb5d02-12,6efb5d02
Comment les plugins EQ à émulation analogique aident-ils à l'apprentissage ?,LA POST-PROD,6efb5d02-12,6efb5d02
Pourquoi est-il dangereux d'égaliser à vue plutôt qu'à l'oreille ?,LA POST-PROD,6efb5d02-12,6efb5d02
Quels sont les avantages des plugins EQ par rapport à l'équipement analogique ?,LA POST-PROD,6efb5d02-12,6efb5d02
Comment fonctionnent les algorithmes des leaders du marché dans les plugins EQ ?,LA POST-PROD,6efb5d02-12,6efb5d02
Quels sont les avantages des plugins EQ à modélisation analogique pour le son ?,LA POST-PROD,6efb5d02-13,6efb5d02
Pourquoi est-il important de se faire sa propre idée sur les plugins EQ ?,LA POST-PROD,6efb5d02-13,6efb5d02
Comment les plugins EQ colorés se distinguent-ils des EQ traditionnels ?,LA POST-PROD,6efb5d02-13,6efb5d02
Quels types de sociétés proposent des plugins EQ populaires sur le marché ?,LA POST-PROD,6efb5d02-13,6efb5d02
À quel stade de la production musicale les EQ colorés sont-ils principalement utilisés ?,LA POST-PROD,6efb5d02-13,6efb5d02
Quels sont les types de plugins EQ que je peux rencontrer dans la production musicale ?,LA POST-PROD,6efb5d02-14,6efb5d02
Comment puis-je aborder l'apprentissage des EQ dans mon DAW ?,LA POST-PROD,6efb5d02-14,6efb5d02
Quelle est l'importance de l'EQ analogique dans le mixage ?,LA POST-PROD,6efb5d02-14,6efb5d02
Pourquoi devrais-je me concentrer sur l'EQ de ma DAW au début ?,LA POST-PROD,6efb5d02-14,6efb5d02
Comment évaluer les bénéfices d'un plugin EQ lors de l'apprentissage du mixage ?,LA POST-PROD,6efb5d02-14,6efb5d02
Quels sont les objectifs principaux de l'utilisation des EQ dans la post-production audio ?,LA POST-PROD,440014b2-1,440014b2
Comment déterminer la couleur sonore d'une piste avant d'appliquer un EQ ?,LA POST-PROD,440014b2-1,440014b2
Quels types de sons nécessitent souvent une EQ corrective dans la production audio ?,LA POST-PROD,440014b2-1,440014b2
Quelles questions doit-on se poser avant d'égaliser une piste dans une composition ?,LA POST-PROD,440014b2-1,440014b2
Pourquoi est-il important de nettoyer le contenu indésirable avant d'appliquer des effets sur une piste ?,LA POST-PROD,440014b2-1,440014b2
