question,category,chunk,article
Pourquoi est-il important d'avoir une écoute critique lors de l'analyse des objets sonores ?,LA POST-PROD,8ad78a9f-1,8ad78a9f
Quelles sont les principales techniques utilisables pour créer de l'espace sonore lors du mixage ?,LA POST-PROD,8ad78a9f-2,8ad78a9f
Comment notre cerveau perçoit-il la localisation des sons dans l'espace ?,LA POST-PROD,8ad78a9f-2,8ad78a9f
Pourquoi la stéréo est-elle importante par rapport au mono dans la musique ?,LA POST-PROD,8ad78a9f-2,8ad78a9f
Quels éléments influencent la profondeur d'un son lors d'un mixage ?,LA POST-PROD,8ad78a9f-2,8ad78a9f
Comment la psycho-acoustique joue-t-elle un rôle dans la perception des sons ?,LA POST-PROD,8ad78a9f-2,8ad78a9f
Comment la musique était-elle enregistrée à l'origine avant l'avènement de la stéréophonie ?,LA POST-PROD,8ad78a9f-3,8ad78a9f
Quels étaient les défis du placement des instruments en matière d'enregistrement sonore ?,LA POST-PROD,8ad78a9f-3,8ad78a9f
Comment la stéréophonie a-t-elle changé notre perception de l'espace sonore ?,LA POST-PROD,8ad78a9f-3,8ad78a9f
Pourquoi le format stéréo est-il considéré comme le standard d'écoute en musique ?,LA POST-PROD,8ad78a9f-3,8ad78a9f
Dans quelles situations la musique est-elle encore généralement écoutée en mono aujourd'hui ?,LA POST-PROD,8ad78a9f-3,8ad78a9f
Quelle est la différence entre le son mono et le son stereo dans le mixage audio ?,LA POST-PROD,8ad78a9f-4,8ad78a9f
Comment le système mono est-il utilisé dans des événements comme la radio ou le club ?,LA POST-PROD,8ad78a9f-4,8ad78a9f
Pourquoi est-il important de vérifier la compatibilité mono lors du mixage ?,LA POST-PROD,8ad78a9f-4,8ad78a9f
Quelles sont les caractéristiques du signal stereo par rapport au signal mono ?,LA POST-PROD,8ad78a9f-4,8ad78a9f
Comment les différences entre les canaux audio améliorent-elles l'écoute en stereo ?,LA POST-PROD,8ad78a9f-4,8ad78a9f
Comment la version Mono d'un morceau peut-elle être affectée par des différences sonores ?,LA POST-PROD,8ad78a9f-5,8ad78a9f
Quels éléments audio sont souvent enregistrés en Mono avant d'être mixés en Stéréo ?,LA POST-PROD,8ad78a9f-5,8ad78a9f
Comment le Panoramique est-il utilisé dans le mixage audio ?,LA POST-PROD,8ad78a9f-5,8ad78a9f
Quelle est l'importance de la réverbération dans la perception des ondes sonores ?,LA POST-PROD,8ad78a9f-5,8ad78a9f
Comment notre cerveau perçoit-il les réflexions sonores dans différents environnements ?,LA POST-PROD,8ad78a9f-5,8ad78a9f
Comment la reverb influence-t-elle le mixage audio ?,LA POST-PROD,8ad78a9f-6,8ad78a9f
Quels outils permettent de créer une dimension d'espace dans le son ?,LA POST-PROD,8ad78a9f-6,8ad78a9f
Comment le Delay diffère-t-il de la reverb en termes de traitement audio ?,LA POST-PROD,8ad78a9f-6,8ad78a9f
Pourquoi dit-on que la reverb est un mélange d'échos distincts ?,LA POST-PROD,8ad78a9f-6,8ad78a9f
Comment passer d'un son Mono à un son Stéréo en utilisant des effets ?,LA POST-PROD,8ad78a9f-6,8ad78a9f
Quels sont les trois domaines du son importants en mixage audio ?,LA POST-PROD,8ad78a9f-7,8ad78a9f
Comment la psycho-acoustique influence-t-elle l'art du mixage ?,LA POST-PROD,8ad78a9f-7,8ad78a9f
Quels outils de traitement peut-on utiliser pour gérer l'espace sonore ?,LA POST-PROD,8ad78a9f-7,8ad78a9f
Pourquoi augmenter le volume des guitares peut-il affecter le reste du mix ?,LA POST-PROD,8ad78a9f-7,8ad78a9f
Comment évaluer un son en stéréo et sa profondeur dans le mixage ?,LA POST-PROD,8ad78a9f-7,8ad78a9f
Quel est le rôle de la psycho-acoustique dans le mixage audio?,LA POST-PROD,8ad78a9f-8,8ad78a9f
Comment la profondeur des sons influence-t-elle notre perception?,LA POST-PROD,8ad78a9f-8,8ad78a9f
Quelles sont les variables qui interagissent lors du mixage du son?,LA POST-PROD,8ad78a9f-8,8ad78a9f
Pourquoi les sons graves sont-ils plus audibles à distance?,LA POST-PROD,8ad78a9f-8,8ad78a9f
De quelle manière l'intensité et la hauteur du son se répercutent-elles l'une sur l'autre?,LA POST-PROD,8ad78a9f-8,8ad78a9f
Quelles sont les notions à maîtriser pour devenir un bon mixeur?,LA POST-PROD,8ad78a9f-9,8ad78a9f
Comment l'écoute passive peut-elle aider à améliorer mes compétences en mixage?,LA POST-PROD,8ad78a9f-9,8ad78a9f
Pourquoi est-il important de connaître les courbes de Fletcher & Munson?,LA POST-PROD,8ad78a9f-9,8ad78a9f
Quelle est l'importance de l'entraînement de l'oreille dans le mixage audio?,LA POST-PROD,8ad78a9f-9,8ad78a9f
Quels éléments de l'espace sonore dois-je explorer pour progresser dans la post-production?,LA POST-PROD,8ad78a9f-9,8ad78a9f
Comment l'écoute critique peut-elle améliorer mes compétences en mixage ?,LA POST-PROD,8ad78a9f-10,8ad78a9f
Quelles sont les différences entre l'écoute passive et l'écoute active dans la production musicale ?,LA POST-PROD,8ad78a9f-10,8ad78a9f
Pourquoi est-il important de prêter attention aux sons quotidiens pour éduquer son oreille ?,LA POST-PROD,8ad78a9f-10,8ad78a9f
Quels équipements dois-je utiliser pour développer mon écoute critique lors du mixage ?,LA POST-PROD,8ad78a9f-10,8ad78a9f
Comment la psycho-acoustique influence-t-elle notre perception des sons dans un mix ?,LA POST-PROD,8ad78a9f-10,8ad78a9f
Quelles sont les trois dimensions physiques pour appréhender le son lors du mixage?,LA POST-PROD,66feb7c8-1,66feb7c8
Pourquoi le domaine fréquentiel est-il difficile à maîtriser dans le mixage audio?,LA POST-PROD,66feb7c8-1,66feb7c8
Quel est le rôle de l'EQ dans le processus de mixage?,LA POST-PROD,66feb7c8-1,66feb7c8
Comment la fréquence influence-t-elle notre perception des sons?,LA POST-PROD,66feb7c8-1,66feb7c8
Quels outils peut-on utiliser pour travailler sur le traitement fréquentiel d'un mix?,LA POST-PROD,66feb7c8-1,66feb7c8
Quelle est la relation entre la vitesse d'oscillation et le pitch d'un son?,LA POST-PROD,66feb7c8-2,66feb7c8
Comment un musicien peut-il modifier le pitch d'un instrument?,LA POST-PROD,66feb7c8-2,66feb7c8
Quelles sont les différences de pitch entre un coup de trombone et un sifflet?,LA POST-PROD,66feb7c8-2,66feb7c8
Comment la longueur d'une corde affecte-t-elle le pitch lorsqu'un musicien joue?,LA POST-PROD,66feb7c8-2,66feb7c8
Pourquoi des cordes plus épaisses produisent-elles des pitchs plus bas?,LA POST-PROD,66feb7c8-2,66feb7c8
Comment peut-on élever le pitch en tendant une corde?,LA POST-PROD,66feb7c8-3,66feb7c8
Quel est le rôle d'une partition dans l'éducation musicale?,LA POST-PROD,66feb7c8-3,66feb7c8
Quelle est la plage d'audibilité humaine en Hertz?,LA POST-PROD,66feb7c8-3,66feb7c8
Pourquoi est-il important d'avoir un bon casque pour détecter les fréquences?,LA POST-PROD,66feb7c8-3,66feb7c8
Quelle est la dynamique du son dans le mixage audio?,LA POST-PROD,66feb7c8-3,66feb7c8
Quelle est la différence entre dynamique et amplitude dans le mixage audio ?,LA POST-PROD,66feb7c8-4,66feb7c8
Comment se manifeste la dynamique dans une pièce musicale ?,LA POST-PROD,66feb7c8-4,66feb7c8
Pourquoi la musique classique a-t-elle une plus grande dynamique que les morceaux Pop ?,LA POST-PROD,66feb7c8-4,66feb7c8
Comment le son se déplace-t-il à travers un médium élastique ?,LA POST-PROD,66feb7c8-4,66feb7c8
Quels exemples de films illustrent une représentation réaliste du son dans l'espace ?,LA POST-PROD,66feb7c8-4,66feb7c8
Comment l amplitude d une onde sonore influence t elle la perception du son?,LA POST-PROD,66feb7c8-5,66feb7c8
Quels sont les termes pour qualifier le loudness dans le domaine musical?,LA POST-PROD,66feb7c8-5,66feb7c8
Quel est le lien entre le pitch et les fréquences en termes de perception?,LA POST-PROD,66feb7c8-5,66feb7c8
De quelle manière un musicien peut il moduler le volume sonore de ses instruments?,LA POST-PROD,66feb7c8-5,66feb7c8
Quelle est l unité de mesure utilisée pour quantifier le loudness?,LA POST-PROD,66feb7c8-5,66feb7c8
Comment la distance influence-t-elle l'intensité de l'onde sonore ?,LA POST-PROD,66feb7c8-6,66feb7c8
Quels outils de traitement sont utilisés pour le mixage audio ?,LA POST-PROD,66feb7c8-6,66feb7c8
Quelle est la différence entre macro-dynamique et micro-dynamique ?,LA POST-PROD,66feb7c8-6,66feb7c8
Comment se règle la dynamique des niveaux sonores des instruments ?,LA POST-PROD,66feb7c8-6,66feb7c8
Pourquoi le morceau Pop a-t-il un niveau de Loudness plus important que le morceau classique ?,LA POST-PROD,66feb7c8-6,66feb7c8
Quelles sont les variations de niveaux qui peuvent affecter le mixage d'une voix ?,LA POST-PROD,66feb7c8-7,66feb7c8
Comment peut-on contenir les variations de niveaux lors du mixage ?,LA POST-PROD,66feb7c8-7,66feb7c8
Quel est le rôle de l'automation dans la gestion de la dynamique d'un instrument ?,LA POST-PROD,66feb7c8-7,66feb7c8
En quoi le positionnement des sources audio est-il important dans un mix ?,LA POST-PROD,66feb7c8-7,66feb7c8
Quelles techniques seront approfondies dans les prochains articles concernant les EQ et les compresseurs ?,LA POST-PROD,66feb7c8-7,66feb7c8
Comment puis-je améliorer mes compétences en mixage de musique ?,LA POST-PROD,dd4eddf3-1,dd4eddf3
Quelles erreurs fréquentes commettent les musiciens en home studio ?,LA POST-PROD,dd4eddf3-1,dd4eddf3
Pourquoi est-il important d'écouter sa musique dans différents environnements ?,LA POST-PROD,dd4eddf3-1,dd4eddf3
Comment évaluer si mon morceau sonne aussi bien que ceux des professionnels ?,LA POST-PROD,dd4eddf3-1,dd4eddf3
Quels sont les éléments clés à prendre en compte pour la phase de mixage ?,LA POST-PROD,dd4eddf3-1,dd4eddf3
Comment peut-on éduquer son oreille pour le mixage?,LA POST-PROD,dd4eddf3-2,dd4eddf3
Pourquoi est-il important d'écouter de manière critique en audio?,LA POST-PROD,dd4eddf3-2,dd4eddf3
Quelles sont les conséquences de ne pas savoir ce qu'on fait lors du mixage?,LA POST-PROD,dd4eddf3-2,dd4eddf3
Comment un ingénieur du son expérimenté aborde-t-il un mixage?,LA POST-PROD,dd4eddf3-2,dd4eddf3
Pourquoi l'écoute critique est-elle considérée comme la clé du résultat en post-production?,LA POST-PROD,dd4eddf3-2,dd4eddf3
Quels sont les aspects importants pour développer une oreille critique en mixage ?,LA POST-PROD,dd4eddf3-3,dd4eddf3
Comment l'environnement acoustique influence-t-il la qualité de l'écoute ?,LA POST-PROD,dd4eddf3-3,dd4eddf3
Quelles sont les différentes méthodes pour apprendre à écouter en audio ?,LA POST-PROD,dd4eddf3-3,dd4eddf3
Pourquoi est-il essentiel de bien interpréter les sons en tant qu'ingénieur du son ?,LA POST-PROD,dd4eddf3-3,dd4eddf3
L'entraînement de l'oreille est-il lié à l'entraînement de l'esprit ?,LA POST-PROD,dd4eddf3-3,dd4eddf3
Quels sont les paramètres spécifiques du son à considérer dans le mixage ?,LA POST-PROD,dd4eddf3-4,dd4eddf3
Comment l'entraînement de l'oreille influence-t-il notre appréciation des sons ?,LA POST-PROD,dd4eddf3-4,dd4eddf3
Quels principes fondamentaux doivent être compris avant de parler de musique ?,LA POST-PROD,dd4eddf3-4,dd4eddf3
Qu'est-ce qui se passe entre une source acoustique et un récepteur lors de la perception du son ?,LA POST-PROD,dd4eddf3-4,dd4eddf3
Pourquoi est-il important de commencer par une compréhension solide des caractéristiques de l'onde sonore ?,LA POST-PROD,dd4eddf3-4,dd4eddf3
Comment l'onde sonore se propage-t-elle dans différents milieux ?,LA POST-PROD,dd4eddf3-5,dd4eddf3
Quels sont les trois domaines du son dans l'art du mixage ?,LA POST-PROD,dd4eddf3-5,dd4eddf3
Comment se manifeste une onde périodique par rapport à un bruit ?,LA POST-PROD,dd4eddf3-5,dd4eddf3
Qu'est-ce qu'une période dans une forme d'onde ?,LA POST-PROD,dd4eddf3-5,dd4eddf3
Comment le temps entre un éclair et le tonnerre illustre-t-il la propagation du son ?,LA POST-PROD,dd4eddf3-5,dd4eddf3
Quels sont les trois domaines du mixage que nous allons aborder?,LA POST-PROD,dd4eddf3-6,dd4eddf3
Comment les interconnexions entre les domaines influencent-elles le mixage?,LA POST-PROD,dd4eddf3-6,dd4eddf3
Pourquoi est-il important de maîtriser les trois domaines pour un ingénieur du son?,LA POST-PROD,dd4eddf3-6,dd4eddf3
Quel est l'impact de changer un paramètre sur un autre domaine?,LA POST-PROD,dd4eddf3-6,dd4eddf3
Qu'est-ce qui rend l'art du mixage fascinant?,LA POST-PROD,dd4eddf3-6,dd4eddf3
Quelles sont les applications de l'intelligence artificielle dans la production audio?,LE HOME STUDIO,aca8c7fe-1,aca8c7fe
Comment l'IA influence-t-elle le domaine de la musique personnalisée?,LE HOME STUDIO,aca8c7fe-1,aca8c7fe
Quels outils audio utilisent l'intelligence artificielle pour la composition?,LE HOME STUDIO,aca8c7fe-1,aca8c7fe
Quels sont les avantages de l'IA dans le sound design?,LE HOME STUDIO,aca8c7fe-1,aca8c7fe
Comment l'IA transforme-t-elle l'industrie de l'audio et quelles opportunités crée-t-elle?,LE HOME STUDIO,aca8c7fe-1,aca8c7fe
Quels sont les types de plugins d'assistance au Beatmaking mentionnés dans le document?,LE HOME STUDIO,aca8c7fe-2,aca8c7fe
Comment l'intelligence artificielle est-elle utilisée en post-production audio?,LE HOME STUDIO,aca8c7fe-2,aca8c7fe
Quels outils audio innovants sont abordés dans le dossier?,LE HOME STUDIO,aca8c7fe-2,aca8c7fe
En quoi l'IA se distingue-t-elle d'un algorithme classique dans le contexte de la production audio?,LE HOME STUDIO,aca8c7fe-2,aca8c7fe
Quel sujet le prochain article de la série va-t-il traiter?,LE HOME STUDIO,aca8c7fe-2,aca8c7fe
Quels sont les avantages de l'intelligence artificielle dans le studio de production audio ?,LE HOME STUDIO,aca8c7fe-3,aca8c7fe
Comment l'IA peut-elle faciliter le travail d'un ingénieur du son ?,LE HOME STUDIO,aca8c7fe-3,aca8c7fe
Quel impact l'IA a-t-elle sur les métiers de la production audio ?,LE HOME STUDIO,aca8c7fe-3,aca8c7fe
Quels logiciels utilisent de l'IA pour le mixage et le mastering assisté ?,LE HOME STUDIO,aca8c7fe-3,aca8c7fe
Comment l'intégration de l'IA évolue-t-elle dans les outils numériques de production musicale ?,LE HOME STUDIO,aca8c7fe-3,aca8c7fe
Quelles innovations ont facilité le travail d'enregistrement et de traitement audio au fil des décennies ?,LE HOME STUDIO,aca8c7fe-4,aca8c7fe
Comment l'intégration de l'IA influence-t-elle la production audio actuelle ?,LE HOME STUDIO,aca8c7fe-4,aca8c7fe
Quel est l'impact de la fonction 'Total Recall' sur le mixage audio moderne ?,LE HOME STUDIO,aca8c7fe-4,aca8c7fe
De quelle manière les consoles modernes ont-elles enrichi les techniques de production audio ?,LE HOME STUDIO,aca8c7fe-4,aca8c7fe
Pourquoi le DAW est-il devenu essentiel dans un studio de production audio ?,LE HOME STUDIO,aca8c7fe-4,aca8c7fe
Quand le DAW est-il devenu le centre névralgique d'un studio de production audio?,LE HOME STUDIO,aca8c7fe-5,aca8c7fe
Comment l'ère du home-studio a-t-elle influencé le rôle de l'ingénieur du son?,LE HOME STUDIO,aca8c7fe-5,aca8c7fe
Quelle est la différence entre l'IA et un simple algorithme en audio?,LE HOME STUDIO,aca8c7fe-5,aca8c7fe
En quoi le compresseur a-t-il évolué avec l'avènement des plugins numériques?,LE HOME STUDIO,aca8c7fe-5,aca8c7fe
Pourquoi l'utilisation du compresseur reste-t-elle complexe pour les amateurs du traitement audio?,LE HOME STUDIO,aca8c7fe-5,aca8c7fe
Quels sont les avantages de l'utilisation de l'intelligence artificielle dans un studio de production audio ?,LE HOME STUDIO,aca8c7fe-6,aca8c7fe
Comment l'IA peut-elle aider à régler les paramètres de compression dans un enregistrement vocal ?,LE HOME STUDIO,aca8c7fe-6,aca8c7fe
Quelles compétences humaines l'IA pourrait-elle remplacer dans le processus de production audio ?,LE HOME STUDIO,aca8c7fe-6,aca8c7fe
De quelle manière un algorithme de compresseur IA analyse-t-il les performances vocales ?,LE HOME STUDIO,aca8c7fe-6,aca8c7fe
En quoi consiste le modèle mathématique construit par le logiciel IA pour la compression vocale ?,LE HOME STUDIO,aca8c7fe-6,aca8c7fe
Comment l'intelligence artificielle peut-elle aider un musicien à mixer sa musique ?,LE HOME STUDIO,aca8c7fe-7,aca8c7fe
Quels sont les avantages de l'utilisation de l'IA dans la production audio ?,LE HOME STUDIO,aca8c7fe-7,aca8c7fe
Qu'est-ce que le machine learning et comment est-il utilisé en studio ?,LE HOME STUDIO,aca8c7fe-7,aca8c7fe
Comment les algorithmes basés sur l'IA changent-ils la production musicale ?,LE HOME STUDIO,aca8c7fe-7,aca8c7fe
Quels domaines de la musique sont déjà influencés par l'IA ?,LE HOME STUDIO,aca8c7fe-7,aca8c7fe
Quelles sont les nouvelles formes de flux de travail créatifs générées par l IA?,LE HOME STUDIO,aca8c7fe-8,aca8c7fe
Comment l IA influence t elle le métier de producteur et d ingenieur du son?,LE HOME STUDIO,aca8c7fe-8,aca8c7fe
L intelligence artificielle est elle amenée à rendre les DAW obsolètes?,LE HOME STUDIO,aca8c7fe-8,aca8c7fe
Quels changements pouvons nous anticiper dans la production musicale grâce à l IA?,LE HOME STUDIO,aca8c7fe-8,aca8c7fe
Quel sera l avenir des métiers de la production musicale sur le plan technique et créatif?,LE HOME STUDIO,aca8c7fe-8,aca8c7fe
Quelle est l'importance d'apprendre à utiliser une DAW pour la production musicale ?,LE HOME STUDIO,3fe10ebc-1,3fe10ebc
Qu'est-ce qu'une DAW et comment cela fonctionne dans un home-studio ?,LE HOME STUDIO,3fe10ebc-1,3fe10ebc
Quels conseils donnerais-tu à un débutant qui souhaite se lancer dans l'apprentissage d'une DAW ?,LE HOME STUDIO,3fe10ebc-1,3fe10ebc
Comment la maîtrise d'une DAW peut-elle impacter l'évolution d'un producteur de musique ?,LE HOME STUDIO,3fe10ebc-1,3fe10ebc
Pourquoi est-il essentiel de revenir aux fondamentaux lors de l'apprentissage d'une DAW ?,LE HOME STUDIO,3fe10ebc-1,3fe10ebc
Quelle est l'importance d'apprendre une DAW pour le home-studio ?,LE HOME STUDIO,3fe10ebc-2,3fe10ebc
Comment une DAW a-t-elle évolué par rapport aux équipements matériels ?,LE HOME STUDIO,3fe10ebc-2,3fe10ebc
Quels sont les rôles du producteur musical moderne dans l'enregistrement ?,LE HOME STUDIO,3fe10ebc-2,3fe10ebc
Pourquoi la production musicale est-elle devenue plus accessible aujourd'hui ?,LE HOME STUDIO,3fe10ebc-2,3fe10ebc
Quel équipement est nécessaire pour connecter le monde analogique à une DAW ?,LE HOME STUDIO,3fe10ebc-2,3fe10ebc
Comment peut-on définir le rôle d'un producteur musical moderne dans un home-studio ?,LE HOME STUDIO,3fe10ebc-3,3fe10ebc
Quelles sont les étapes impliquées dans la production d'une chanson avec une DAW ?,LE HOME STUDIO,3fe10ebc-3,3fe10ebc
Pourquoi les musiques électroniques ont-elles contribué à la démocratisation du home-studio ?,LE HOME STUDIO,3fe10ebc-3,3fe10ebc
Quels types de musiques peuvent être produites dans un home-studio aujourd'hui ?,LE HOME STUDIO,3fe10ebc-3,3fe10ebc
Quels obstacles peut-on rencontrer lors de l'apprentissage d'une DAW ?,LE HOME STUDIO,3fe10ebc-3,3fe10ebc
Comment commencer mon apprentissage d'une DAW pour la production musicale ?,LE HOME STUDIO,3fe10ebc-4,3fe10ebc
Quelles compétences sont nécessaires pour un producteur musical moderne ?,LE HOME STUDIO,3fe10ebc-4,3fe10ebc
Que faire face à la confusion lors de l'apprentissage d'un logiciel audio ?,LE HOME STUDIO,3fe10ebc-4,3fe10ebc
Comment puis-je surmonter les obstacles à l'apprentissage d'une DAW ?,LE HOME STUDIO,3fe10ebc-4,3fe10ebc
Quels sont les étapes pour produire un morceau cohérent ?,LE HOME STUDIO,3fe10ebc-4,3fe10ebc
Comment commencer l'apprentissage d'une DAW pour produire ma musique?,LE HOME STUDIO,3fe10ebc-5,3fe10ebc
Quelles sont les étapes pour arranger un morceau musical?,LE HOME STUDIO,3fe10ebc-5,3fe10ebc
Comment mixer les pistes de ma production musicale?,LE HOME STUDIO,3fe10ebc-5,3fe10ebc
Pourquoi la production musicale moderne est-elle considérée comme difficile?,LE HOME STUDIO,3fe10ebc-5,3fe10ebc
Quelles sont les récompenses de l'activité de producteur musical?,LE HOME STUDIO,3fe10ebc-5,3fe10ebc
Comment commencer à apprendre une DAW pour produire ma musique?,LE HOME STUDIO,3fe10ebc-6,3fe10ebc
Est-ce que je peux faire de la musique sans expérience préalable?,LE HOME STUDIO,3fe10ebc-6,3fe10ebc
Quels sont les équipements indispensables pour démarrer en home-studio?,LE HOME STUDIO,3fe10ebc-6,3fe10ebc
Comment surmonter mes croyances limitantes dans la production musicale?,LE HOME STUDIO,3fe10ebc-6,3fe10ebc
Est-il possible de commencer à produire sans dépenser beaucoup d'argent?,LE HOME STUDIO,3fe10ebc-6,3fe10ebc
Comment choisir une DAW adaptée à ma production musicale?,LE HOME STUDIO,3fe10ebc-7,3fe10ebc
Quels sont les fondements essentiels à comprendre avant d'apprendre une DAW?,LE HOME STUDIO,3fe10ebc-7,3fe10ebc
Pourquoi les formations complètes sur les DAW n'apportent-elles pas de résultats tangibles?,LE HOME STUDIO,3fe10ebc-7,3fe10ebc
Comment aborder l'apprentissage d'une DAW de manière structurée et efficace?,LE HOME STUDIO,3fe10ebc-7,3fe10ebc
Quels outils de base sont nécessaires pour débuter dans le home studio?,LE HOME STUDIO,3fe10ebc-7,3fe10ebc
Quels sont les principes de base à apprendre pour utiliser une DAW ?,LE HOME STUDIO,3fe10ebc-8,3fe10ebc
Comment choisir entre différentes DAW pour produire ma musique ?,LE HOME STUDIO,3fe10ebc-8,3fe10ebc
Quels sont les trois piliers d'apprentissage d'une DAW ?,LE HOME STUDIO,3fe10ebc-8,3fe10ebc
"Pourquoi est-il important de maîtriser la composition, la synthèse sonore et les traitements audio ?",LE HOME STUDIO,3fe10ebc-8,3fe10ebc
Comment ces piliers peuvent-ils libérer ma créativité et ma productivité en audio ?,LE HOME STUDIO,3fe10ebc-8,3fe10ebc
Quels sont les grands domaines à maîtriser pour apprendre une DAW ?,LE HOME STUDIO,3fe10ebc-9,3fe10ebc
Comment le profil d'un apprenant influence-t-il son apprentissage en production musicale ?,LE HOME STUDIO,3fe10ebc-9,3fe10ebc
Quelles compétences un musicien autodidacte devrait-il améliorer pour progresser ?,LE HOME STUDIO,3fe10ebc-9,3fe10ebc
Pourquoi est-il important pour un DJ de produire sa propre musique aujourd'hui ?,LE HOME STUDIO,3fe10ebc-9,3fe10ebc
Comment se familiariser avec le jargon utilisé dans la production musicale ?,LE HOME STUDIO,3fe10ebc-9,3fe10ebc
Quelles sont les étapes essentielles pour commencer avec une DAW en production musicale?,LE HOME STUDIO,3fe10ebc-10,3fe10ebc
Pourquoi est-il important de se concentrer sur l'ecriture de la chanson avant la production?,LE HOME STUDIO,3fe10ebc-10,3fe10ebc
Quelles sont les qualities d'une composition musicale intemporelle?,LE HOME STUDIO,3fe10ebc-10,3fe10ebc
Comment la connaissance de la theorie musicale influence-t-elle la production audio?,LE HOME STUDIO,3fe10ebc-10,3fe10ebc
Quels sont les 7 fondamentaux de la composition musicale?,LE HOME STUDIO,3fe10ebc-10,3fe10ebc
Quels sont les éléments fondamentaux à maîtriser en apprenant une DAW pour la production musicale ?,LE HOME STUDIO,3fe10ebc-11,3fe10ebc
Pourquoi est-il important de connaître le piano dans l'apprentissage d'une DAW ?,LE HOME STUDIO,3fe10ebc-11,3fe10ebc
Quels types d'accords dois-je comprendre pour améliorer mes compositions ?,LE HOME STUDIO,3fe10ebc-11,3fe10ebc
Comment le piano facilite-t-il l'apprentissage des concepts musicaux ?,LE HOME STUDIO,3fe10ebc-11,3fe10ebc
Que devrais-je faire si je n'ai pas encore de clavier pour mes sessions de home studio ?,LE HOME STUDIO,3fe10ebc-11,3fe10ebc
Comment choisir un clavier pour débuter dans l'apprentissage d'une DAW?,LE HOME STUDIO,3fe10ebc-12,3fe10ebc
Quelles sont les méthodes pour écrire de la musique dans le piano roll?,LE HOME STUDIO,3fe10ebc-12,3fe10ebc
Pourquoi les effets Midi sont-ils utiles dans la composition musicale?,LE HOME STUDIO,3fe10ebc-12,3fe10ebc
En quoi consiste le lien entre le design sonore et la composition dans une DAW?,LE HOME STUDIO,3fe10ebc-12,3fe10ebc
Comment utiliser des synthétiseurs et des échantillonneurs dans un home-studio?,LE HOME STUDIO,3fe10ebc-12,3fe10ebc
Comment commencer l'apprentissage d'une DAW pour produire de la musique ?,LE HOME STUDIO,3fe10ebc-13,3fe10ebc
Quels sont les rôles des synthétiseurs dans un home-studio ?,LE HOME STUDIO,3fe10ebc-13,3fe10ebc
Comment les instruments virtuels influencent-ils la production musicale ?,LE HOME STUDIO,3fe10ebc-13,3fe10ebc
Quelles sont les différences entre un studio entièrement analogique et un studio numérique ?,LE HOME STUDIO,3fe10ebc-13,3fe10ebc
Comment assimiler les concepts de la synthèse sonore rapidement ?,LE HOME STUDIO,3fe10ebc-13,3fe10ebc
Quels sont les principes de fonctionnement d'un synthé à connaître pour débuter en DAW ?,LE HOME STUDIO,3fe10ebc-14,3fe10ebc
Comment apprendre à décortiquer des presets pour comprendre le son ?,LE HOME STUDIO,3fe10ebc-14,3fe10ebc
Quel est le processus de reverse engineering dans la création sonore ?,LE HOME STUDIO,3fe10ebc-14,3fe10ebc
Quels concepts sont importants pour façonner ses propres sons en synthèse ?,LE HOME STUDIO,3fe10ebc-14,3fe10ebc
Comment le design sonore est-il lié à la composition dans une DAW ?,LE HOME STUDIO,3fe10ebc-14,3fe10ebc
Comment commencer à apprendre une DAW pour produire ma musique ?,LE HOME STUDIO,3fe10ebc-15,3fe10ebc
Quels sont les cycles de travail recommandés pour le sound design et la composition ?,LE HOME STUDIO,3fe10ebc-15,3fe10ebc
Pourquoi est-il important de ne pas négliger l'un des aspects entre le sound design et la composition ?,LE HOME STUDIO,3fe10ebc-15,3fe10ebc
Quelles sont les étapes à suivre après l'apprentissage du MIDI dans la production musicale ?,LE HOME STUDIO,3fe10ebc-15,3fe10ebc
Comment le traitement audio est-il lié au mixage et au mastering dans la post-production ?,LE HOME STUDIO,3fe10ebc-15,3fe10ebc
Quels sont les avantages de travailler avec un fichier audio plutôt qu'avec du MIDI pour la production musicale?,LE HOME STUDIO,3fe10ebc-16,3fe10ebc
Comment visualiser le son produit lors de l'apprentissage d'une DAW?,LE HOME STUDIO,3fe10ebc-16,3fe10ebc
Pourquoi est-il important de partir d'un son simple dans un home studio?,LE HOME STUDIO,3fe10ebc-16,3fe10ebc
Quelles sont les techniques que je peux utiliser pour manipuler un son importé?,LE HOME STUDIO,3fe10ebc-16,3fe10ebc
