question,category,chunk,article
Comment la stéréophonie a-t-elle changé la manière dont nous percevons les instruments dans un mix,LA POST-PROD,8ad78a9f-2,8ad78a9f
Quels éléments psycho-acoustiques influencent la perception de la profondeur dans un mixage audio,LA POST-PROD,8ad78a9f-2,8ad78a9f
En quoi la reverb joue-t-elle un rôle dans la création d'un espace sonore cohérent lors du mixage,LA POST-PROD,8ad78a9f-2,8ad78a9f
Quelle est la différence principale entre le son Mono et le son Stéréo,LA POST-PROD,8ad78a9f-3,8ad78a9f
Pourquoi le format Stéréo est-il considéré comme le standard d'écoute en musique,LA POST-PROD,8ad78a9f-3,8ad78a9f
Comment la scène sonore est-elle perçue par nos oreilles en mode stéréo,LA POST-PROD,8ad78a9f-3,8ad78a9f
Quelles sont les implications de la compatibilité Mono lors du mixage,LA POST-PROD,8ad78a9f-3,8ad78a9f
Dans quels contextes musical et événementiel le son Mono est-il souvent utilisé,LA POST-PROD,8ad78a9f-3,8ad78a9f
Quelles sont les différences entre le mixage en Mono et en Stéréo,LA POST-PROD,8ad78a9f-4,8ad78a9f
Comment le réglage de Panoramique influence-t-il la spatialisation des sons,LA POST-PROD,8ad78a9f-4,8ad78a9f
Quel est le rôle de la réverbération dans la création de profondeur sonore,LA POST-PROD,8ad78a9f-4,8ad78a9f
Comment les réflexions sonores peuvent-elles affecter notre perception d'un espace,LA POST-PROD,8ad78a9f-4,8ad78a9f
Pourquoi est-il important de vérifier la compatibilité Mono lors du mixage audio,LA POST-PROD,8ad78a9f-4,8ad78a9f
Quels sont les outils utilisés en mixage pour créer une dimension d'espace dans le son,LA POST-PROD,8ad78a9f-5,8ad78a9f
Comment un son mono peut-il être transformé en son stéréo en utilisant des techniques de mixage,LA POST-PROD,8ad78a9f-5,8ad78a9f
Quels sont les rôles spécifiques de la reverb et du delay dans la création d'une ambiance sonore,LA POST-PROD,8ad78a9f-5,8ad78a9f
Quels sont les trois domaines principaux du son à prendre en compte lors de la post-production audio,LA POST-PROD,8ad78a9f-5,8ad78a9f
Comment la psycho-acoustique influence-t-elle les décisions de mixage audio,LA POST-PROD,8ad78a9f-5,8ad78a9f
Comment les éléments du mix interagissent-ils entre eux lors du processus de mixage audio,LA POST-PROD,8ad78a9f-6,8ad78a9f
Quels sont les effets de la distance sur la perception des sons dans un environnement sonore,LA POST-PROD,8ad78a9f-6,8ad78a9f
Comment la psycho-acoustique influence-t-elle notre analyse des phénomènes sonores,LA POST-PROD,8ad78a9f-6,8ad78a9f
Quels paramètres sont à prendre en compte pour créer une impression de profondeur dans un mix,LA POST-PROD,8ad78a9f-6,8ad78a9f
Comment le placement des fréquences affecte-t-il le volume perçu des instruments dans une composition,LA POST-PROD,8ad78a9f-6,8ad78a9f
Quelles sont les différences entre l'écoute passive et l'écoute active dans le développement des compétences en mixage,LA POST-PROD,8ad78a9f-7,8ad78a9f
Comment la compréhension de la psycho-acoustique influence-t-elle le processus de mixage,LA POST-PROD,8ad78a9f-7,8ad78a9f
Pourquoi est-il important de connaître les courbes de Fletcher & Munson pour devenir un bon mixeur,LA POST-PROD,8ad78a9f-7,8ad78a9f
De quelle manière l'entraînement de l'oreille peut-il se réaliser à travers l'écoute des sons quotidiens,LA POST-PROD,8ad78a9f-7,8ad78a9f
Quels sont les éléments à considérer lors de l'analyse d'un morceau de musique pendant le mixage,LA POST-PROD,8ad78a9f-7,8ad78a9f
Comment peut-on développer une écoute critique dans le mélange des sons,LA POST-PROD,8ad78a9f-8,8ad78a9f
Quelles sont les différentes considérations à prendre en compte lors de l'écoute d'un mix,LA POST-PROD,8ad78a9f-8,8ad78a9f
Pourquoi est-il important de se concentrer sur la dynamique et les fréquences dans un mix,LA POST-PROD,8ad78a9f-8,8ad78a9f
Quels exercices peuvent être bénéfiques pour améliorer ses compétences en production sonore,LA POST-PROD,8ad78a9f-8,8ad78a9f
Comment la psycho-acoustique influence-t-elle notre perception des sons dans un espace sonore,LA POST-PROD,8ad78a9f-8,8ad78a9f
Quelles sont les principales propriétés de l'onde sonore à considérer lors du mixage audio,LA POST-PROD,66feb7c8-1,66feb7c8
Comment l'outil d'EQ contribue-t-il au processus de mixage,LA POST-PROD,66feb7c8-1,66feb7c8
En quoi la fréquence d'une onde sonore influe-t-elle sur la perception du pitch,LA POST-PROD,66feb7c8-1,66feb7c8
Quels sont les effets d'une fréquence élevée par rapport à une fréquence basse dans la musique,LA POST-PROD,66feb7c8-1,66feb7c8
Comment un musicien peut-il modifier la vitesse des vibrations pour changer le pitch d'un son,LA POST-PROD,66feb7c8-1,66feb7c8
Quelles sont les différences entre pitch et volume sonore dans le mixage,LA POST-PROD,66feb7c8-2,66feb7c8
Comment la longueur d'un tube influence-t-elle le pitch d'un instrument,LA POST-PROD,66feb7c8-2,66feb7c8
Quels sont les effets de la tension et de l'épaisseur d'une corde sur le pitch,LA POST-PROD,66feb7c8-2,66feb7c8
Quelle est la plage d'audibilité humaine en termes de fréquence,LA POST-PROD,66feb7c8-2,66feb7c8
Pourquoi est-il important de se protéger les oreilles lors de l'écoute des aigus,LA POST-PROD,66feb7c8-2,66feb7c8
Quelles sont les différences entre amplitude et loudness dans un mixage audio,LA POST-PROD,66feb7c8-3,66feb7c8
Comment la dynamique d'un son influence-t-elle notre perception auditive,LA POST-PROD,66feb7c8-3,66feb7c8
Quels éléments sont nécessaires pour que le son soit véhiculé à l'oreille,LA POST-PROD,66feb7c8-3,66feb7c8
Pourquoi est-il impossible d'entendre des sons dans l'espace,LA POST-PROD,66feb7c8-3,66feb7c8
Comment l'intervalle de fréquences est-il divisé lors du mixage audio,LA POST-PROD,66feb7c8-3,66feb7c8
Quelles sont les différences entre le loudness et l'amplitude dans le mélange sonore,LA POST-PROD,66feb7c8-4,66feb7c8
Comment le volume sonore est-il mesuré et quels sont ses unités,LA POST-PROD,66feb7c8-4,66feb7c8
De quelle manière les instruments peuvent-ils influencer le loudness d'un son,LA POST-PROD,66feb7c8-4,66feb7c8
Qu'est-ce que la macro et micro-dynamique dans le mixage audio,LA POST-PROD,66feb7c8-4,66feb7c8
Pourquoi est-il important de balancer les niveaux sonores des instruments lors du mixage,LA POST-PROD,66feb7c8-4,66feb7c8
Quels sont les deux types de dynamique du son à considérer lors du mixage audio,LA POST-PROD,66feb7c8-5,66feb7c8
Comment peut-on utiliser le fader pour régler la balance des niveaux des instruments,LA POST-PROD,66feb7c8-5,66feb7c8
Quel est l'impact du loudness sur le traitement des morceaux Pop par rapport à la musique classique,LA POST-PROD,66feb7c8-5,66feb7c8
Quelles techniques peuvent être employées pour gérer les variations de niveaux d'une voix en mixage,LA POST-PROD,66feb7c8-5,66feb7c8
Comment l'espace sonore et le positionnement des sources audio influencent-ils le mixage,LA POST-PROD,66feb7c8-5,66feb7c8
Quels sont les éléments essentiels à considérer lors de la phase de mixage dans un projet audio,LA POST-PROD,dd4eddf3-1,dd4eddf3
Comment évaluer de manière critique le son d'un morceau par rapport à des productions professionnelles,LA POST-PROD,dd4eddf3-1,dd4eddf3
Quelles erreurs courantes les musiciens de home studio font-ils en matière de matériel audio,LA POST-PROD,dd4eddf3-1,dd4eddf3
Quels sont les défis liés à l'apprentissage des techniques de mixage et comment les surmonter,LA POST-PROD,dd4eddf3-1,dd4eddf3
Comment améliorer sa capacité à décrire les problèmes de mixage que l'on perçoit dans ses productions,LA POST-PROD,dd4eddf3-1,dd4eddf3
Comment peut-on définir l'écoute critique dans le processus de mixage,LA POST-PROD,dd4eddf3-2,dd4eddf3
Quelles sont les machines ou logiciels essentiels à maîtriser pour un ingénieur du son,LA POST-PROD,dd4eddf3-2,dd4eddf3
Pourquoi est-il important de connaître son environnement acoustique pour le mixage,LA POST-PROD,dd4eddf3-2,dd4eddf3
Comment développer sa sensibilité et son ressenti en tant qu'ingénieur du son,LA POST-PROD,dd4eddf3-2,dd4eddf3
Quelles méthodes peuvent être utilisées pour améliorer son apprentissage de l'écoute des sons,LA POST-PROD,dd4eddf3-2,dd4eddf3
Quelles sont les différentes caractéristiques d'une onde sonore que je dois comprendre dans le cadre du mixage,LA POST-PROD,dd4eddf3-3,dd4eddf3
Comment l'entraînement de l'oreille peut-il influencer ma perception des sons que j'écoute,LA POST-PROD,dd4eddf3-3,dd4eddf3
Quels sont les principes fondamentaux que je dois connaître avant de me lancer dans l'art du mixage,LA POST-PROD,dd4eddf3-3,dd4eddf3
Pourquoi est-il important de développer une sensibilité aux subtilités du son lors de la production musicale,LA POST-PROD,dd4eddf3-3,dd4eddf3
Quel type de milieu de propagation peut affecter la vitesse de déplacement du son que j'entends,LA POST-PROD,dd4eddf3-3,dd4eddf3
Quels sont les trois domaines du son que l'on doit maîtriser pour un bon mixage,LA POST-PROD,dd4eddf3-4,dd4eddf3
Comment la densité du milieu influence-t-elle la propagation du son,LA POST-PROD,dd4eddf3-4,dd4eddf3
Quelle est la différence entre une onde périodique et un bruit,LA POST-PROD,dd4eddf3-4,dd4eddf3
Comment se définit la période d'une onde sonore,LA POST-PROD,dd4eddf3-4,dd4eddf3
Pourquoi est-il important de comprendre l'interconnexion entre les différents paramètres lors du mixage,LA POST-PROD,dd4eddf3-4,dd4eddf3
Quelles sont les applications de l'intelligence artificielle dans la production audio,LE HOME STUDIO,aca8c7fe-1,aca8c7fe
Comment l'IA influence-t-elle la création musicale et le sound design,LE HOME STUDIO,aca8c7fe-1,aca8c7fe
Quels outils ou plugins audio utilisent l'IA pour le mixage assisté,LE HOME STUDIO,aca8c7fe-1,aca8c7fe
Comment l'IA améliore-t-elle la reconnaissance musicale et la recommandation,LE HOME STUDIO,aca8c7fe-1,aca8c7fe
Quels sont les avantages de l'IA en post-production audio,LE HOME STUDIO,aca8c7fe-1,aca8c7fe
Quels sont les principaux avantages de l'utilisation de l'intelligence artificielle dans la production audio,LE HOME STUDIO,aca8c7fe-2,aca8c7fe
Comment l'intelligence artificielle se distingue-t-elle d'un algorithme traditionnel dans le domaine du son,LE HOME STUDIO,aca8c7fe-2,aca8c7fe
Quelles innovations récentes en matière de logiciels audio intègrent l'intelligence artificielle,LE HOME STUDIO,aca8c7fe-2,aca8c7fe
Quels sont les domaines spécifiques de la post-production audio où l'intelligence artificielle est particulièrement utile,LE HOME STUDIO,aca8c7fe-2,aca8c7fe
De quelle manière l'intégration de l'intelligence artificielle dans le studio de son peut-elle améliorer l'efficacité des ingénieurs du son,LE HOME STUDIO,aca8c7fe-2,aca8c7fe
Quelles sont les tâches ennuyeuses que l'IA peut automatiser dans un studio de production audio,LE HOME STUDIO,aca8c7fe-3,aca8c7fe
Comment l'automatisation a-t-elle évolué dans le domaine de l'enregistrement audio,LE HOME STUDIO,aca8c7fe-3,aca8c7fe
Quelles innovations majeures ont facilité le travail de traitement audio au fil des décennies,LE HOME STUDIO,aca8c7fe-3,aca8c7fe
Quel impact la fonction Total Recall a-t-elle eu sur le processus de mixage,LE HOME STUDIO,aca8c7fe-3,aca8c7fe
Comment les DAW ont-ils révolutionné le rôle de l'ingénieur de mix dans les années 90,LE HOME STUDIO,aca8c7fe-3,aca8c7fe
Quels sont les avantages du home studio pour les ingénieurs du son dans le processus de mixage,LE HOME STUDIO,aca8c7fe-4,aca8c7fe
Comment l'utilisation de l'intelligence artificielle évolue-t-elle par rapport à la technologie des algorithmes,LE HOME STUDIO,aca8c7fe-4,aca8c7fe
En quoi le compresseur numérique a-t-il changé la façon de traiter la dynamique d'un enregistrement audio,LE HOME STUDIO,aca8c7fe-4,aca8c7fe
Quelles compétences sont nécessaires pour choisir les paramètres de compression lors du traitement audio,LE HOME STUDIO,aca8c7fe-4,aca8c7fe
Comment l'IA peut-elle influencer le rôle traditionnel de l'ingénieur du son dans un studio de production,LE HOME STUDIO,aca8c7fe-4,aca8c7fe
Quelles sont les compétences que l'intelligence artificielle permet de remplacer dans la production audio,LE HOME STUDIO,aca8c7fe-5,aca8c7fe
Comment un algorithme de compresseur basé sur l'IA fonctionne-t-il pour analyser les performances vocales,LE HOME STUDIO,aca8c7fe-5,aca8c7fe
Quelle est l'importance de l'analyse de données dans le fonctionnement de l'intelligence artificielle en musique,LE HOME STUDIO,aca8c7fe-5,aca8c7fe
Quels sont les concepts majeurs associés à l'apprentissage automatique dans le contexte de la production musicale,LE HOME STUDIO,aca8c7fe-5,aca8c7fe
Dans quels domaines l'intelligence artificielle a-t-elle déjà eu un impact significatif selon le document,LE HOME STUDIO,aca8c7fe-5,aca8c7fe
Quels sont les concepts clés de l'intelligence artificielle appliqués à la production audio,LE HOME STUDIO,aca8c7fe-6,aca8c7fe
Comment l'intelligence artificielle change-t-elle la production musicale,LE HOME STUDIO,aca8c7fe-6,aca8c7fe
Quelles sont les implications de l'utilisation de l'IA pour le métier de producteur,LE HOME STUDIO,aca8c7fe-6,aca8c7fe
Comment la technologie IA influence-t-elle les flux de travail créatifs dans le son,LE HOME STUDIO,aca8c7fe-6,aca8c7fe
Quel avenir pour les outils de production musicale face à l'augmentation de l'IA,LE HOME STUDIO,aca8c7fe-6,aca8c7fe
Comment une DAW peut-elle faciliter la production musicale dans un home-studio,LE HOME STUDIO,3fe10ebc-1,3fe10ebc
Quelles sont les étapes essentielles pour apprendre à utiliser une DAW,LE HOME STUDIO,3fe10ebc-1,3fe10ebc
Pourquoi est-il important de comprendre les origines du home-studio,LE HOME STUDIO,3fe10ebc-1,3fe10ebc
Comment la technologie a-t-elle influencé l'évolution des DAWs,LE HOME STUDIO,3fe10ebc-1,3fe10ebc
Quelles fonctions une DAW doit-elle remplir pour être efficace dans le mixage audio,LE HOME STUDIO,3fe10ebc-1,3fe10ebc
Quelles sont les fonctionnalités essentielles d'une DAW pour un débutant en production musicale,LE HOME STUDIO,3fe10ebc-2,3fe10ebc
Comment une interface audio facilite-t-elle la connexion entre le numérique et l'analogique,LE HOME STUDIO,3fe10ebc-2,3fe10ebc
Quelles sont les compétences requises pour devenir un producteur musical moderne,LE HOME STUDIO,3fe10ebc-2,3fe10ebc
Pourquoi la production musicale à domicile est-elle devenue plus accessible ces dernières années,LE HOME STUDIO,3fe10ebc-2,3fe10ebc
Quel impact les musiques électroniques ont-elles eu sur l'évolution du home-studio,LE HOME STUDIO,3fe10ebc-2,3fe10ebc
Quelles sont les étapes clés pour produire un morceau de musique dans un home studio,LE HOME STUDIO,3fe10ebc-3,3fe10ebc
Comment surmonter les obstacles lors de l'apprentissage d'une DAW pour la production musicale,LE HOME STUDIO,3fe10ebc-3,3fe10ebc
Quelles compétences sont nécessaires pour devenir un producteur musical moderne,LE HOME STUDIO,3fe10ebc-3,3fe10ebc
Comment créer et arranger des idées musicales dans un environnement de production audio,LE HOME STUDIO,3fe10ebc-3,3fe10ebc
En quoi consiste le processus de mixage et de mastering dans la production musicale,LE HOME STUDIO,3fe10ebc-3,3fe10ebc
Quelles sont les étapes importantes pour mixer un morceau efficacement,LE HOME STUDIO,3fe10ebc-4,3fe10ebc
Comment la compression et l’égalisation influencent-elles le mixage,LE HOME STUDIO,3fe10ebc-4,3fe10ebc
Pourquoi est-il crucial de masteriser un morceau avant sa livraison finale,LE HOME STUDIO,3fe10ebc-4,3fe10ebc
Quels défis rencontrent souvent les débutants en production musicale,LE HOME STUDIO,3fe10ebc-4,3fe10ebc
Comment surmonter l'absence d'expérience musicale pour débuter en production,LE HOME STUDIO,3fe10ebc-4,3fe10ebc
Quelles sont les compétences importantes à acquérir pour produire sa musique avec une DAW,LE HOME STUDIO,3fe10ebc-5,3fe10ebc
Comment peut-on commencer à apprendre l'utilisation d'une DAW sans avoir tout le matériel nécessaire,LE HOME STUDIO,3fe10ebc-5,3fe10ebc
Pourquoi il est utile de suivre des formations sur l'apprentissage d'une DAW,LE HOME STUDIO,3fe10ebc-5,3fe10ebc
Quels sont les défis que rencontrent les débutants lorsqu'ils essaient d'apprendre une DAW,LE HOME STUDIO,3fe10ebc-5,3fe10ebc
Quels sont les trois piliers essentiels à comprendre pour bien utiliser une DAW,LE HOME STUDIO,3fe10ebc-5,3fe10ebc
Quels sont les trois piliers essentiels à apprendre pour maîtriser une DAW,LE HOME STUDIO,3fe10ebc-6,3fe10ebc
Pourquoi est-il considéré comme un mauvais raisonnement de se concentrer sur une DAW spécifique dès le départ,LE HOME STUDIO,3fe10ebc-6,3fe10ebc
Comment la compréhension des principes de base d'une DAW peut-elle aider dans la production musicale,LE HOME STUDIO,3fe10ebc-6,3fe10ebc
Quelles étapes de la production musicale sont mentionnées et comment sont-elles liées entre elles,LE HOME STUDIO,3fe10ebc-6,3fe10ebc
"Pourquoi est-il important d'assimiler le jargon lié aux domaines de la composition, synthèse sonore et traitements audio",LE HOME STUDIO,3fe10ebc-6,3fe10ebc
Quelles sont les compétences nécessaires pour bien maîtriser une DAW dans la production musicale,LE HOME STUDIO,3fe10ebc-7,3fe10ebc
Comment peut-on améliorer ses compétences créatives en synthèse sonore et traitements audio,LE HOME STUDIO,3fe10ebc-7,3fe10ebc
Pourquoi est-il important d'écrire la chanson avant de se concentrer sur la production,LE HOME STUDIO,3fe10ebc-7,3fe10ebc
Quels types de profils peuvent bénéficier de l'apprentissage d'une DAW,LE HOME STUDIO,3fe10ebc-7,3fe10ebc
Comment la composition influence-t-elle la qualité émotionnelle d'un morceau de musique,LE HOME STUDIO,3fe10ebc-7,3fe10ebc
Quelles sont les erreurs courantes que les débutants commettent lors de la production musicale dans une DAW,LE HOME STUDIO,3fe10ebc-8,3fe10ebc
Pourquoi est-il important d'écrire la mélodie avant de se lancer dans la production,LE HOME STUDIO,3fe10ebc-8,3fe10ebc
Quels sont les éléments fondamentaux de la composition que je dois comprendre pour utiliser une DAW efficacement,LE HOME STUDIO,3fe10ebc-8,3fe10ebc
Comment le piano facilite-t-il l'apprentissage de la théorie musicale pour un producteur de musique,LE HOME STUDIO,3fe10ebc-8,3fe10ebc
Quel rôle joue la connaissance des gammes et des accords dans la production musicale avec une DAW,LE HOME STUDIO,3fe10ebc-8,3fe10ebc
Quelles sont les principales fonctions d'un piano roll dans une DAW,LE HOME STUDIO,3fe10ebc-9,3fe10ebc
Comment un clavier peut-il améliorer l'apprentissage de la composition musicale,LE HOME STUDIO,3fe10ebc-9,3fe10ebc
Quelles sont les deux méthodes d'écriture de la musique dans le piano roll,LE HOME STUDIO,3fe10ebc-9,3fe10ebc
Pourquoi est-il important de comprendre les pistes MIDI dans le processus de production musicale,LE HOME STUDIO,3fe10ebc-9,3fe10ebc
Quels sont les rôles des synthétiseurs et des échantillonneurs dans la conception sonore,LE HOME STUDIO,3fe10ebc-9,3fe10ebc
Quels sont les éléments clés à connaître pour bien débuter dans l'apprentissage d'une DAW,LE HOME STUDIO,3fe10ebc-10,3fe10ebc
Comment la technologie MIDI a-t-elle évolué depuis les années 1980 et quel impact cela a-t-il sur la production musicale,LE HOME STUDIO,3fe10ebc-10,3fe10ebc
Quelles sont les étapes pour manipuler un synthétiseur et comprendre ses presets,LE HOME STUDIO,3fe10ebc-10,3fe10ebc
Pourquoi est-il important de combiner matériel et logiciel dans un home-studio moderne,LE HOME STUDIO,3fe10ebc-10,3fe10ebc
Quelle méthode peut-on utiliser pour améliorer ses compétences en conception sonore à partir de sons existants,LE HOME STUDIO,3fe10ebc-10,3fe10ebc
Quels sont les premiers pas à suivre pour apprendre à utiliser une DAW dans la production musicale,LE HOME STUDIO,3fe10ebc-11,3fe10ebc
Comment la sonorité et la composition sont-elles liées dans le processus de création musicale,LE HOME STUDIO,3fe10ebc-11,3fe10ebc
Quelle est l'importance des traitements audio lors de la création musicale,LE HOME STUDIO,3fe10ebc-11,3fe10ebc
Comment peut-on façonner ses propres sons en manipulant des paramètres spécifiques,LE HOME STUDIO,3fe10ebc-11,3fe10ebc
Pourquoi est-il crucial de ne pas négliger l'un des aspects de la sonorité et de la composition dans un projet musical,LE HOME STUDIO,3fe10ebc-11,3fe10ebc
Quels sont les formats de fichiers audio importants à connaître lors de l'apprentissage d'une DAW,LE HOME STUDIO,3fe10ebc-12,3fe10ebc
Comment la manipulation audio améliore-t-elle le design sonore et la production musicale,LE HOME STUDIO,3fe10ebc-12,3fe10ebc
Quelles techniques audio peuvent être utilisées pour le remixage et le sound design,LE HOME STUDIO,3fe10ebc-12,3fe10ebc
Pourquoi est-il important de comprendre les effets audio lors de la création musicale,LE HOME STUDIO,3fe10ebc-12,3fe10ebc
Comment l'apprentissage de l'écoute influence-t-il le travail de l'ingénieur en mixage,LE HOME STUDIO,3fe10ebc-12,3fe10ebc
Quels sont les outils essentiels à comprendre pour débuter dans la production musicale avec une DAW,LE HOME STUDIO,3fe10ebc-13,3fe10ebc
Comment développer son oreille pour améliorer ses compétences en mixage et en production sonore,LE HOME STUDIO,3fe10ebc-13,3fe10ebc
Quelles sont les différentes dimensions du son à apprendre lors de l'utilisation d'une DAW,LE HOME STUDIO,3fe10ebc-13,3fe10ebc
Quels sont les axes d'apprentissage en dehors du logiciel audio pour un débutant en home-studio,LE HOME STUDIO,3fe10ebc-13,3fe10ebc
Comment gérer le routage du signal et la configuration de pistes multiples dans une DAW,LE HOME STUDIO,3fe10ebc-13,3fe10ebc
Quelles sont les étapes clés pour apprendre à utiliser un logiciel de production musicale,LE HOME STUDIO,3fe10ebc-14,3fe10ebc
Comment la post-production influence-t-elle la qualité d'une production musicale,LE HOME STUDIO,3fe10ebc-14,3fe10ebc
Quels éléments faut-il considérer pour optimiser l'acoustique d'un studio,LE HOME STUDIO,3fe10ebc-14,3fe10ebc
Quelle est l'importance des enceintes de monitoring dans un home studio,LE HOME STUDIO,3fe10ebc-14,3fe10ebc
Comment le mixage et le mastering contribuent-ils à la finalisation d'une chanson,LE HOME STUDIO,3fe10ebc-14,3fe10ebc
Quels sont les types de mesure du loudness selon la norme EBU,LE HOME STUDIO,d1d36480-1,d1d36480
Pourquoi est-il important de prendre en compte le niveau final en loudness durant le mastering,LE HOME STUDIO,d1d36480-1,d1d36480
Quelles recommandations en terme de loudness final peut-on appliquer selon la destination du morceau,LE HOME STUDIO,d1d36480-1,d1d36480
Comment la mesure du loudness instantané se compare-t-elle aux mesures à court terme et intégrale,LE HOME STUDIO,d1d36480-1,d1d36480
Quels paramètres de mesure LUFS sont disponibles sur les plugins et comment les utiliser en mastering,LE HOME STUDIO,d1d36480-1,d1d36480
Quels sont les types de mesures LUFS utilisés en sonorisation,LE HOME STUDIO,d1d36480-2,d1d36480
Comment est déterminé le loudness d'un morceau audio,LE HOME STUDIO,d1d36480-2,d1d36480
Quelle est l'importance de la mesure courte en relation avec les signaux de premier plan,LE HOME STUDIO,d1d36480-2,d1d36480
Quel est l'objectif d'une valeur cible de loudness dans un programme audio,LE HOME STUDIO,d1d36480-2,d1d36480
Quels paramètres complémentaires sont utiles en plus des mesures LUFS,LE HOME STUDIO,d1d36480-2,d1d36480
Quels sont les paramètres complémentaires à la mesure LUFS que l'on peut utiliser pour évaluer un morceau,LE HOME STUDIO,d1d36480-3,d1d36480
Comment le Loudness Range est-il défini et que représente-t-il dans un morceau de musique,LE HOME STUDIO,d1d36480-3,d1d36480
Quelle est la différence entre le Loudness Range et la plage dynamique d'un morceau,LE HOME STUDIO,d1d36480-3,d1d36480
Comment interpréter un LRA situé entre 6 et 12 LU par rapport aux différences de loudness dans un morceau,LE HOME STUDIO,d1d36480-3,d1d36480
Qu'est-ce que le ratio Peak-Loudness et comment est-il calculé dans le contexte de la mesure LUFS,LE HOME STUDIO,d1d36480-3,d1d36480
Quels sont les principaux types de mesures LUFS utilisées dans le traitement audio,LE HOME STUDIO,d1d36480-4,d1d36480
Comment le ratio Peak-Loudness est-il défini et pourquoi est-il important,LE HOME STUDIO,d1d36480-4,d1d36480
"Quelle est la différence entre la mesure LRA et les mesures DR, PLR et PSR",LE HOME STUDIO,d1d36480-4,d1d36480
Comment une valeur faible de DR peut-elle affecter la dynamique d'un morceau audio,LE HOME STUDIO,d1d36480-4,d1d36480
Quelles recommandations pratiques peut-on appliquer lors de l'utilisation des plugins de mesure de loudness en mixage et mastering,LE HOME STUDIO,d1d36480-4,d1d36480
Quelles sont les différences entre les mesures LUFS intégrées et à court terme dans le contexte du mixage,LE HOME STUDIO,d1d36480-5,d1d36480
Pourquoi la valeur de loudness intégrée n'est-elle pas la principale à considérer pour le loudness final,LE HOME STUDIO,d1d36480-5,d1d36480
Quels niveaux de LUFS intégrés sont recommandés pour un mixage dynamique,LE HOME STUDIO,d1d36480-5,d1d36480
Comment les variations du loudness intégrée peuvent-elles affecter l'équilibre perçu d'un morceau,LE HOME STUDIO,d1d36480-5,d1d36480
De quelle manière les parties plus calmes d'une chanson influencent-elles la mesure globale de loudness intégrée,LE HOME STUDIO,d1d36480-5,d1d36480
Quelles sont les mesures LUFS à prendre en compte pour équilibrer les morceaux dans un mixage professionnel,LE HOME STUDIO,d1d36480-6,d1d36480
Comment la mesure LUFS intégrée peut-elle influencer notre perception de la dynamique d'un morceau,LE HOME STUDIO,d1d36480-6,d1d36480
Quelle pratique est recommandée pour analyser la dynamique des morceaux en utilisant le LUFS et le PSR,LE HOME STUDIO,d1d36480-6,d1d36480
Quels sont les niveaux de loudness qui fonctionnent généralement bien pour les plateformes de streaming en ligne,LE HOME STUDIO,d1d36480-6,d1d36480
